Title,Title_link,Price,count___1LWwo,unit_info___32SjE,Headline,Field1,Field2,Field3
Chin Chin Peach Juice Drink 10.8 oz,https://www.sayweee.com/en/product/Chin-Chin-Peach-Juice-Drink/42697,$1.49,100+ Sold,$0.13/oz,Chin Chin Peach Juice Drink,(5),Taiwan,CHINCHIN
Rico Bubble Milk Tea Drink 12.3 oz,https://www.sayweee.com/en/product/Rico-Bubble-Milk-Tea-Drink/51456,$1.39,200+ Sold,$0.11/oz,Rico Bubble Milk Tea Drink,(2),Taiwan,Rico
Taoti Kyoho Grape Juice Drink  6 can,https://www.sayweee.com/en/product/Taoti-Kyoho-Grape-Juice-Drink-/15489,$6.69,,$1.11/can,Taoti Kyoho Grape Juice Drink,(1),Taiwan,
"Sangaria Ramune Soft Drink, Original Flavor 6.76 oz",https://www.sayweee.com/en/product/Sangaria-Ramune-Soft-Drink-Original-Flavor/29747,$2.49,500+ Sold,$0.36/oz,"Sangaria Ramune Soft Drink, Original Flavor",(27),Japan,
Master Kong's Peach Yogurt Drink 500 ml,https://www.sayweee.com/en/product/Master-Kongs-Peach-Yogurt-Drink/4665,$1.49,1K+ Sold,,Master Kong's Peach Yogurt Drink,(32),Mainland China,
"Binggrae Milk Drink, Strawberry Flavor 6ct 1200 ml",https://www.sayweee.com/en/product/Binggrae-Milk-Drink--Strawberry-Flavor-6ct/98613,$8.99,1K+ Sold,,"Binggrae Milk Drink, Strawberry Flavor 6ct",(176),South Korea,
Super Supau Sports Drink 335 ml,https://www.sayweee.com/en/product/Super-Supau-Sports-Drink/1627,$0.99,1K+ Sold,,Super Supau Sports Drink,(164),Taiwan,Super Supau
Master Kong Honey Grapefruit Drink 500 ml,https://www.sayweee.com/en/product/Master-Kong-Honey-Grapefruit-Drink/71923,$0.99,1K+ Sold,,Master Kong Honey Grapefruit Drink,(183),Mainland China,Master Kong
XinYuanZhai Plum Drink 300 ml,https://www.sayweee.com/en/product/XinYuanZhai-Plum-Drink/57032,$2.29,1K+ Sold,,XinYuanZhai Plum Drink,(184),Mainland China,
"Calpico Mini Non-Carbonated Soft Drinks, Original Flavor 320 ml",https://www.sayweee.com/en/product/Calpico-Mini-Non-Carbonated-Soft-Drinks--Original-Flavor/95818,$1.59,1K+ Sold,,"Calpico Mini Non-Carbonated Soft Drinks, Original Flavor",(310),Indonesia,Calpico
Master Kong Tangerine Peel and Plum Drink 500 ml,https://www.sayweee.com/en/product/Master-Kong-Tangerine-Peel-and-Plum-Drink/96348,$1.69,1K+ Sold,,Master Kong Tangerine Peel and Plum Drink,(231),Mainland China,Master Kong
"Binggrae Milk Drink, Banana Flavor 6ct 1 box",https://www.sayweee.com/en/product/Binggrae-Milk-Drink--Banana-Flavor-6ct/97080,$8.99,1K+ Sold,$8.99/box,"Binggrae Milk Drink, Banana Flavor 6ct",(337),South Korea,
XiaoYang Lactobacillus Drink 330 ml,https://www.sayweee.com/en/product/XiaoYang-Lactobacillus-Drink/31499,$1.99,1K+ Sold,,XiaoYang Lactobacillus Drink,(76),Mainland China,
Calpico Non-Carbonated Soft Drink 50.7 oz,https://www.sayweee.com/en/product/Calpico-Non-Carbonated-Soft-Drink/13833,$5.79,1K+ Sold,$0.11/oz,Calpico Non-Carbonated Soft Drink,(137),Japan,Calpico
Master Kong Rock Sugar Pear Drink  500 ml,https://www.sayweee.com/en/product/Master-Kong-Rock-Sugar-Pear-Drink-/96030,$1.69,1K+ Sold,,Master Kong Rock Sugar Pear Drink,(132),Mainland China,Master Kong
Want Want Kid Milk Flavored Drink 6pk 245 ml,https://www.sayweee.com/en/product/Want-Want-Kid-Milk-Flavored-Drink-6pk/13215,$9.99,1K+ Sold,$0.04/ml,Want Want Kid Milk Flavored Drink 6pk,(41),Taiwan,
"Calpico Non-Carbonated Soft Drink, Mango Flavor 1500 ml",https://www.sayweee.com/en/product/Calpico-NonCarbonated-Soft-Drink-Mango-Flavor/9724,$5.79,900+ Sold,,"Calpico Non-Carbonated Soft Drink, Mango Flavor",(27),Japan,
"Calpico Mini Soft Drink, Strawberry Flavor 4ct 2.7 oz",https://www.sayweee.com/en/product/Calpico-Mini-Soft-Drink--Strawberry-Flavor-4ct/98740,$1.99,900+ Sold,$0.73/oz,"Calpico Mini Soft Drink, Strawberry Flavor 4ct",(119),Indonesia,Calpico
"Calpico Mini Non-Carbonated Soft Drinks, Lychee and Mango Flavor 4ct 320 ml",https://www.sayweee.com/en/product/Calpico-Mini-Non-Carbonated-Soft-Drinks--Lychee-and-Mango-Flavor-4ct/28766,$1.59,800+ Sold,,"Calpico Mini Non-Carbonated Soft Drinks, Lychee and Mango Flavor 4ct",(64),Indonesia,Calpico
"KSF Ice Black Tea Drink, Sugar Free 500 ml",https://www.sayweee.com/en/product/KSF-Ice-Black-Tea-Drink--Sugar-Free/6615,$1.69,"800+ Sold,54 Left",,"KSF Ice Black Tea Drink, Sugar Free",(5),Mainland China,Master Kong
"Chiao Kuo Coconut Milk Drink, Original flavor 250 ml",https://www.sayweee.com/en/product/Chiao-Kuo-Coconut-Milk-Drink--Original-flavor/9657,$1.49,700+ Sold,,"Chiao Kuo Coconut Milk Drink, Original flavor",(13),Taiwan,
Vita Soy Drink Less Sugar 6pk 1 each,https://www.sayweee.com/en/product/Vita-Soy-Drink-Less-Sugar-6pk/10093,$5.19,700+ Sold,$5.19/each,Vita Soy Drink Less Sugar 6pk,(101),Hong Kong,
"Taisun Grass Jelly Drink, 6pk 1 each",https://www.sayweee.com/en/product/Taisun-Grass-Jelly-Drink--6pk/6470,$5.99,700+ Sold,$5.99/each,"Taisun Grass Jelly Drink, 6pk",(215),Taiwan,
"Calpico Soft Drink, Non-Carbonated, with White Peach 1.5L 1500 ml",https://www.sayweee.com/en/product/Calpico-Soft-Drink-NonCarbonated-with-White-Peach-15L/3986,$5.79,600+ Sold,,"Calpico Soft Drink, Non-Carbonated, with White Peach 1.5L",(42),Japan,Calpico
"UCC Black Coffee Drink, Unsweetened 9.7 oz",https://www.sayweee.com/en/product/UCC-Black-Coffee-Drink--Unsweetened/62481,$2.49,600+ Sold,$0.25/oz,"UCC Black Coffee Drink, Unsweetened",(27),Japan,UCC
Vitasoy Soy Drink 6ct 1 box,https://www.sayweee.com/en/product/Vitasoy-Soy-Drink-6ct/61400,$5.19,600+ Sold,$5.19/box,Vitasoy Soy Drink 6ct,(27),Hong Kong,
Lulu Almond Drink 250 ml,https://www.sayweee.com/en/product/Lulu-Almond-Drink/87178,$1.79,600+ Sold,,Lulu Almond Drink,,Mainland China,
Laguna Coconut Milk Drink 10.5 oz,https://www.sayweee.com/en/product/Laguna-Coconut-Milk-Drink/13525,$1.19,500+ Sold,$0.11/oz,Laguna Coconut Milk Drink,(103),Thailand,
"Binggrae Milk Drink, Melon Flavor 6ct										 1 box",https://www.sayweee.com/en/product/Binggrae-Milk-Drink--Melon-Flavor-6ct----------/59115,$8.99,400+ Sold,$8.99/box,"Binggrae Milk Drink, Melon Flavor 6ct",(80),South Korea,
"Hata Ramune Carbonated Soft Drink, Original Flavor 200 ml",https://www.sayweee.com/en/product/Hata-Ramune-Carbonated-Soft-Drink--Original-Flavor/85638,$2.49,400+ Sold,,"Hata Ramune Carbonated Soft Drink, Original Flavor",,Japan,
"Calpico Non-Carbonated Soft Drink, Lychee Flavor 1.5L 1500 ml",https://www.sayweee.com/en/product/Calpico-NonCarbonated-Soft-Drink-Lychee-Flavor-15L/3968,$5.79,400+ Sold,,"Calpico Non-Carbonated Soft Drink, Lychee Flavor 1.5L",(32),Japan,Calpico
Red Guava Mixed Fruits Juice Drink 1 count,https://www.sayweee.com/en/product/Red-Guava-Mixed-Fruits-Juice-Drink/45825,$1.19,400+ Sold,$1.19/count,Red Guava Mixed Fruits Juice Drink,(40),Taiwan,
"Shirakiku Fruits Jelly Drink, Lychee Flavor  150 g",https://www.sayweee.com/en/product/Shirakiku-Fruits-Jelly-Drink--Lychee-Flavor-/75836,$0.99,300+ Sold,,"Shirakiku Fruits Jelly Drink, Lychee Flavor",(15),Mainland China,Shirakiku
Kuki Black Sesame Latte Drink Powder 150 g,https://www.sayweee.com/en/product/Kuki-Black-Sesame-Latte-Drink-Powder/77675,$8.99,300+ Sold,$0.05/g,Kuki Black Sesame Latte Drink Powder,(16),Japan,
Honey Winter Melon Drink  12 oz,https://www.sayweee.com/en/product/Honey-Winter-Melon-Drink-/94278,$0.99,300+ Sold,$0.08/oz,Honey Winter Melon Drink,(14),,
Nectar Peach Soft Drink 1 count,https://www.sayweee.com/en/product/Nectar-Peach-Soft-Drink/18116,$2.99,300+ Sold,$2.99/count,Nectar Peach Soft Drink,(23),Japan,
Master Kong Mango Flavor Drink 500 ml,https://www.sayweee.com/en/product/Master-Kong-Mango-Flavor-Drink/96088,$1.59,300+ Sold,,Master Kong Mango Flavor Drink,(93),Mainland China,Master Kong
Bomy Mixed Fruits and Vegetables Juice Drink 580 g,https://www.sayweee.com/en/product/Bomy-Mixed-Fruits-and-Vegetables-Juice-Drink/68939,$1.99,300+ Sold,,Bomy Mixed Fruits and Vegetables Juice Drink,(16),Taiwan,
Mengniu Peekamoo Milky Drink Strawberry 6pk 1500 ml,https://www.sayweee.com/en/product/Mengniu-Peekamoo-Milky-Drink-Strawberry-6pk/99947,$6.29,300+ Sold,,Mengniu Peekamoo Milky Drink Strawberry 6pk,(13),Mainland China,
"MN Peekamoo Milky Drink Calcium and Zinc Fortified, 6pk  1500 ml",https://www.sayweee.com/en/product/MN-Peekamoo-Milky-Drink-Calcium-and-Zinc-Fortified--6pk-/1340,$6.99,300+ Sold,,"MN Peekamoo Milky Drink Calcium and Zinc Fortified, 6pk",(9),Mainland China,MN
Moshi Yuzu Sparkling Drink 12 oz,https://www.sayweee.com/en/product/Moshi-Yuzu-Sparkling-Drink/3917,$2.99,200+ Sold,$0.24/oz,Moshi Yuzu Sparkling Drink,,United States,Moshi
Nestle Milo Tonic Drink Can RTD 240 ml,https://www.sayweee.com/en/product/Nestle-Milo-Tonic-Drink-Can-RTD/14397,$1.99,200+ Sold,,Nestle Milo Tonic Drink Can RTD,(5),Australia,Nestle
"Calpico Non-Carbonated Soft Drink, Original Flavor 500ml 16.9 oz",https://www.sayweee.com/en/product/Calpico-NonCarbonated-Soft-Drink-Original-Flavor-500ml/98737,$2.49,200+ Sold,$0.14/oz,"Calpico Non-Carbonated Soft Drink, Original Flavor 500ml",(63),Japan,Calpico
"Tarami Konnuaku Jelly Drink, Melon Flavor 150 g",https://www.sayweee.com/en/product/Tarami-Konnuaku-Jelly-Drink--Melon-Flavor/34541,$2.49,200+ Sold,,"Tarami Konnuaku Jelly Drink, Melon Flavor",(7),Japan,Tarami
Vitalon Big Apple Soda Drink  330 ml,https://www.sayweee.com/en/product/Vitalon-Big-Apple-Soda-Drink-/85413,$1.89,200+ Sold,,Vitalon Big Apple Soda Drink,(4),Taiwan,
C&C Passion Fruit Flavored Sparkling Drink 500 ml,https://www.sayweee.com/en/product/C-C-Passion-Fruit-Flavored-Sparkling-Drink/14000,$1.99,200+ Sold,,C&C Passion Fruit Flavored Sparkling Drink,(12),Taiwan,
Binggrae Coffee Flavored Milk Drink 200mlx6 1 each,https://www.sayweee.com/en/product/Binggrae-Coffee-Flavored-Milk-Drink-200mlx6/46172,$8.99,200+ Sold,$8.99/each,Binggrae Coffee Flavored Milk Drink 200mlx6,(3),South Korea,Binggrae
Mengniu Peekamoo Milky Drink Original 6pk 1500 ml,https://www.sayweee.com/en/product/Mengniu-Peekamoo-Milky-Drink-Original-6pk/99966,$7.99,200+ Sold,,Mengniu Peekamoo Milky Drink Original 6pk,(14),Mainland China,
Number One Energy Drink 11.8 oz,https://www.sayweee.com/en/product/Number-One-Energy-Drink/38305,$1.29,200+ Sold,$0.10/oz,Number One Energy Drink,,Vietnam,
Moshi Yuzu & White Peach Sparkling Drink 12 oz,https://www.sayweee.com/en/product/Moshi-Yuzu---White-Peach-Sparkling-Drink/3918,$2.99,200+ Sold,$0.24/oz,Moshi Yuzu & White Peach Sparkling Drink,(1),United States,
"Calpico Non-Carbonated Soft Drink, Strawberry Flavor 50.7 fl.oz",https://www.sayweee.com/en/product/Calpico-Non-Carbonated-Soft-Drink--Strawberry-Flavor/28775,$5.79,200+ Sold,$0.11/fl.oz,"Calpico Non-Carbonated Soft Drink, Strawberry Flavor",(26),Japan,Calpico
Hawthorn Berry Sparkling Drink   230 ml,https://www.sayweee.com/en/product/Hawthorn-Berry-Sparkling-Drink--/31003,$2.49,200+ Sold,,Hawthorn Berry Sparkling Drink,(5),Mainland China,
Awastea Red Bean Black Glutinous Rice Drink 30ct 450 g,https://www.sayweee.com/en/product/Awastea-Red-Bean-Black-Glutinous-Rice-Drink-30ct/85422,$17.09,200+ Sold,$0.03/g,Awastea Red Bean Black Glutinous Rice Drink 30ct,(50),Taiwan,Awastea
Ishiya Shiroi Koibito White Lover Chocolate Milk Drink  190 g,https://www.sayweee.com/en/product/Ishiya-Shiroi-Koibito-White-Lover-Chocolate-Milk-Drink-/83422,$4.89,200+ Sold,,Ishiya Shiroi Koibito White Lover Chocolate Milk Drink,(2),Japan,
Choya Non-Alchoholic Plum Drink 700 ml,https://www.sayweee.com/en/product/Choya-NonAlchoholic-Plum-Drink/39601,$14.99,200+ Sold,,Choya Non-Alchoholic Plum Drink,(38),Japan,
Fremo Aloe Vera Drink Original Flavor 500 ml,https://www.sayweee.com/en/product/Fremo-Aloe-Vera-Drink-Original-Flavor/29393,$1.99,100+ Sold,,Fremo Aloe Vera Drink Original Flavor,(4),South Korea,
Nongfu C100 Grapefruit Drink 445 ml,https://www.sayweee.com/en/product/Nongfu-C100-Grapefruit-Drink/9369,$2.39,100+ Sold,,Nongfu C100 Grapefruit Drink,(8),Mainland China,
MN Peekamoo Milky Drink Blueberry 6pk  1500 ml,https://www.sayweee.com/en/product/MN-Peekamoo-Milky-Drink-Blueberry-6pk-/1339,$7.29,100+ Sold,,MN Peekamoo Milky Drink Blueberry 6pk,(6),Mainland China,MN
"Calpico Non-Carbonated Soft Drink, Lychee Flavor 16.9 oz",https://www.sayweee.com/en/product/Calpico-NonCarbonated-Soft-Drink-Lychee-Flavor/96132,$2.49,100+ Sold,$0.14/oz,"Calpico Non-Carbonated Soft Drink, Lychee Flavor",(34),Japan,Calpico
ChengYangJi HaiNan Old Fashion Coconut Drink  420 ml,https://www.sayweee.com/en/product/ChengYangJi-HaiNan-Old-Fashion-Coconut-Drink-/19202,$3.90,100+ Sold,,ChengYangJi HaiNan Old Fashion Coconut Drink,(1),Mainland China,
FOCO Tamarind Drink 350 ml,https://www.sayweee.com/en/product/FOCO-Tamarind-Drink/83830,$1.69,100+ Sold,,FOCO Tamarind Drink,,Thailand,
Seoul Milk Black Sesame Flavored Milk Drink 6pk 1 box,https://www.sayweee.com/en/product/Seoul-Milk-Black-Sesame-Flavored-Milk-Drink-6pk/26524,$6.99,100+ Sold,$6.99/box,Seoul Milk Black Sesame Flavored Milk Drink 6pk,,South Korea,
"Ito En Japanese Matcha and Green Tea Energy Drink, Unsweetened 155 ml",https://www.sayweee.com/en/product/Ito-En-Japanese-Matcha-and-Green-Tea-Energy-Drink--Unsweetened/85357,$2.59,50+ Sold,,"Ito En Japanese Matcha and Green Tea Energy Drink, Unsweetened",,Japan,
Star Lychee Drink 1.5L  1 bottle,https://www.sayweee.com/en/product/Star-Lychee-Drink-1-5L-/84770,$2.99,50+ Sold,$2.99/bottle,Star Lychee Drink 1.5L,(1),Saudi Arabia,
Nongfu C100 Lemon Drink 445 ml,https://www.sayweee.com/en/product/Nongfu-C100-Lemon-Drink/9374,$2.39,50+ Sold,,Nongfu C100 Lemon Drink,(1),Mainland China,
Yeo's Chrysanthemum Tea Drink 6pk 1 box,https://www.sayweee.com/en/product/Yeo-s-Chrysanthemum-Tea-Drink-6pk/94203,$4.99,50+ Sold,$4.99/box,Yeo's Chrysanthemum Tea Drink 6pk,(5),,
CJJ Passion Fruit Jelly Drink 220 g,https://www.sayweee.com/en/product/CJJ-Passion-Fruit-Jelly-Drink/26010,$2.79,50+ Sold,,CJJ Passion Fruit Jelly Drink,(4),Taiwan,
Chin Chin Guava Juice Drink  10.8 oz,https://www.sayweee.com/en/product/Chin-Chin-Guava-Juice-Drink-/42696,$1.49,50+ Sold,$0.13/oz,Chin Chin Guava Juice Drink,(3),Taiwan,CHINCHIN
"Calpico Non-Carbonated Soft Drink, White Peach Flavor 16.9 oz",https://www.sayweee.com/en/product/Calpico-Non-Carbonated-Soft-Drink--White-Peach-Flavor/96134,$2.49,50+ Sold,$0.14/oz,"Calpico Non-Carbonated Soft Drink, White Peach Flavor",(32),Japan,Calpico
Woongjin Morning Rice Drink  50.72 fl.oz,https://www.sayweee.com/en/product/Woongjin-Morning-Rice-Drink-/40966,$4.99,50+ Sold,$0.09/fl.oz,Woongjin Morning Rice Drink,(1),South Korea,
OKF Watermelon with Aloe Drink 500 ml,https://www.sayweee.com/en/product/OKF-Watermelon-with-Aloe-Drink/4918,$1.99,50+ Sold,,OKF Watermelon with Aloe Drink,(23),South Korea,
Yili Youngfun Flavored Milk Drink Strawberry Flavor 1 case,https://www.sayweee.com/en/product/Yili-Youngfun-Flavored-Milk-Drink-Strawberry-Flavor/12294,$28.99,50+ Sold,$28.99/case,Yili Youngfun Flavored Milk Drink Strawberry Flavor,(6),Mainland China,
Nongfu C100 Lime Drink 445 ml,https://www.sayweee.com/en/product/Nongfu-C100-Lime-Drink/9370,$2.39,50+ Sold,,Nongfu C100 Lime Drink,(5),Mainland China,
DemiSoda Orange Carbonated Soft Drink 250 ml,https://www.sayweee.com/en/product/DemiSoda-Orange-Carbonated-Soft-Drink/37085,$1.09,50+ Sold,,DemiSoda Orange Carbonated Soft Drink,(10),South Korea,
Asahi Japan Monster Energy Drink Zero Sugar Ultra  12 fl.oz,https://www.sayweee.com/en/product/Asahi-Japan-Monster-Energy-Drink-Zero-Sugar-Ultra-/11159,$3.59,50+ Sold,$0.29/fl.oz,Asahi Japan Monster Energy Drink Zero Sugar Ultra,,Japan,Asahi
Star Mango Drink 1.5L 1 bottle,https://www.sayweee.com/en/product/Star-Mango-Drink-1-5L/70823,$2.99,50+ Sold,$2.99/bottle,Star Mango Drink 1.5L,,United States,Star
Monster Energy Drink Zero Ultra 16 oz,https://www.sayweee.com/en/product/Monster-Energy-Drink-Zero-Ultra/46137,$1.86,50+ Sold,$0.11/oz,Monster Energy Drink Zero Ultra,,United States,
"Ambrosial Greek Yogurt Drink, Cheese Flavor 10pk 1 box",https://www.sayweee.com/en/product/Ambrosial-Greek-Yogurt-Drink--Cheese-Flavor-10pk/89622,$31.49,50+ Sold,$31.49/box,"Ambrosial Greek Yogurt Drink, Cheese Flavor 10pk",(5),Mainland China,
Lotte Soft Drink 2% Peach Flavor 1500 ml,https://www.sayweee.com/en/product/Lotte-Soft-Drink-2--Peach-Flavor/50420,$4.99,50+ Sold,,Lotte Soft Drink 2% Peach Flavor,,South Korea,Lotte
Fremo Aloe Vera Drink Grape Flavor 500 ml,https://www.sayweee.com/en/product/Fremo-Aloe-Vera-Drink-Grape-Flavor/83452,$1.79,50+ Sold,,Fremo Aloe Vera Drink Grape Flavor,,South Korea,
"Just Pure Drinking Yogurt, Original Flavor 4pk 800 g",https://www.sayweee.com/en/product/Just-Pure-Drinking-Yogurt--Original-Flavor-4pk/70375,$10.29,50+ Sold,,"Just Pure Drinking Yogurt, Original Flavor 4pk",(16),Mainland China,
PALDO Pororo Milk Flavor Drink  235 ml,https://www.sayweee.com/en/product/PALDO-Pororo-Milk-Flavor-Drink-/27829,$1.39,50+ Sold,,PALDO Pororo Milk Flavor Drink,(4),South Korea,
Tang Ding Brown Sugar Rose Four Herb Concoction Sugar Cubes Drink 7pcs 210 g,https://www.sayweee.com/en/product/Tang-Ding-Brown-Sugar-Rose-Four-Herb-Concoction-Sugar-Cubes-Drink-7pcs/26731,$11.99,50+ Sold,$0.05/g,Tang Ding Brown Sugar Rose Four Herb Concoction Sugar Cubes Drink 7pcs,(3),Taiwan,
Kirin Salty Lychee Drink 500 ml,https://www.sayweee.com/en/product/Kirin-Salty-Lychee-Drink/510,$2.99,50+ Sold,,Kirin Salty Lychee Drink,(37),Japan,Kirin
Royal Tea Garden Juicy Lemon Tea Drink  500 ml,https://www.sayweee.com/en/product/Royal-Tea-Garden-Juicy-Lemon-Tea-Drink-/85428,$2.49,50+ Sold,,Royal Tea Garden Juicy Lemon Tea Drink,,Taiwan,
Peach Sparkling Drink  230 ml,https://www.sayweee.com/en/product/Peach-Sparkling-Drink-/30220,$2.49,50+ Sold,,Peach Sparkling Drink,(2),Mainland China,
SUN YEAM Almond Oak Drink Peach Flavor 265 g,https://www.sayweee.com/en/product/SUN-YEAM-Almond-Oak-Drink-Peach-Flavor/44618,$1.69,50+ Sold,,SUN YEAM Almond Oak Drink Peach Flavor,(2),Mainland China,
Fremo Aloe Vera Drink Peach Flavor 500 ml,https://www.sayweee.com/en/product/Fremo-Aloe-Vera-Drink-Peach-Flavor/29363,$1.99,50+ Sold,,Fremo Aloe Vera Drink Peach Flavor,(2),South Korea,
Chen Jiah Juang Passion Guava Jelly Drink 220 g,https://www.sayweee.com/en/product/Chen-Jiah-Juang-Passion-Guava-Jelly-Drink/85417,$2.69,50+ Sold,,Chen Jiah Juang Passion Guava Jelly Drink,(11),Taiwan,
Za Cool Instant Herbal Drink 3 in 1  70 g,https://www.sayweee.com/en/product/Za-Cool-Instant-Herbal-Drink-3-in-1-/82405,$3.99,50+ Sold,$0.05/g,Za Cool Instant Herbal Drink 3 in 1,,Vietnam,
"Gold Kili Instant Ginger Drink, No Added Cane Sugar 1.8 oz",https://www.sayweee.com/en/product/Gold-Kili-Instant-Ginger-Drink--No-Added-Cane-Sugar/36126,$3.99,,$2.21/oz,"Gold Kili Instant Ginger Drink, No Added Cane Sugar",(4),Singapore,
Singabera Original Ginger Drink 12pk 180 g,https://www.sayweee.com/en/product/Singabera-Original-Ginger-Drink-12pk/48848,$4.69,,,Singabera Original Ginger Drink 12pk,,Indonesia,Singabera
Chin Chin Grass Jelly Drink with Honey  10.7 oz,https://www.sayweee.com/en/product/Chin-Chin-Grass-Jelly-Drink-with-Honey-/44669,$1.49,,$0.13/oz,Chin Chin Grass Jelly Drink with Honey,,Taiwan,Chin Chin
SUN YEAM Almond Oak Drink Honeydew Flavor 265 g,https://www.sayweee.com/en/product/SUN-YEAM-Almond-Oak-Drink-Honeydew-Flavor/44617,$1.79,,,SUN YEAM Almond Oak Drink Honeydew Flavor,(1),Mainland China,
Suntory Non-Alcoholic Plum Drink 280 ml,https://www.sayweee.com/en/product/Suntory-NonAlcoholic-Plum-Drink/13336,$3.99,,,Suntory Non-Alcoholic Plum Drink,(29),Japan,
KSF Jasmine Honey Tea Drink  8.45 fl.oz,https://www.sayweee.com/en/product/KSF-Jasmine-Honey-Tea-Drink-/51250,$5.19,,$0.61/fl.oz,KSF Jasmine Honey Tea Drink,(3),Mainland China,
Monster Energy Drink Lo-Carb 16 oz,https://www.sayweee.com/en/product/Monster-Energy-Drink-Lo-Carb/46136,$1.86,,$0.11/oz,Monster Energy Drink Lo-Carb,,United States,
Red Leaf Rare Soybean Drink 300 ml,https://www.sayweee.com/en/product/Red-Leaf-Rare-Soybean-Drink/79710,$1.29,,,Red Leaf Rare Soybean Drink,(1),Taiwan,Red Leaf
SUN YEAM Almond Oak Drink Original Flavor 265 g,https://www.sayweee.com/en/product/SUN-YEAM-Almond-Oak-Drink-Original-Flavor/44616,$2.99,,,SUN YEAM Almond Oak Drink Original Flavor,(3),Mainland China,
Tropics Thai Tea Drink 290 ml,https://www.sayweee.com/en/product/Tropics-Thai-Tea-Drink/86649,$2.49,,,Tropics Thai Tea Drink,,Thailand,
Nestle Carlos V Chocolate Powder Drink Mix 14.1 oz,https://www.sayweee.com/en/product/Nestle-Carlos-V-Chocolate-Powder-Drink-Mix/83204,$3.69,,$0.26/oz,Nestle Carlos V Chocolate Powder Drink Mix,(1),Mexico,Nestle
Lucia Thai Tea Drink 17.5 oz,https://www.sayweee.com/en/product/Lucia-Thai-Tea-Drink/84631,$1.99,,$0.11/oz,Lucia Thai Tea Drink,,Philippines,
"Electrolit Hydration Drink, Natural Coconut Flavor 625 ml",https://www.sayweee.com/en/product/Electrolit-Hydration-Drink--Natural-Coconut-Flavor/513,$2.99,,,"Electrolit Hydration Drink, Natural Coconut Flavor",,Mexico,Electrolit
XiaoXiaoHuo Ume Flavored Drink  500 ml,https://www.sayweee.com/en/product/-XiaoXiaoHuo-Ume-Flavored-Drink-/14400,$4.29,,,XiaoXiaoHuo Ume Flavored Drink,(5),Mainland China,
Tang Ding Crystal Honey Lemon Drink 250 g,https://www.sayweee.com/en/product/Tang-Ding-Crystal-Honey-Lemon-Drink/91292,$14.79,,$0.05/g,Tang Ding Crystal Honey Lemon Drink,(2),Taiwan,
Fremo Aloe Vera Drink Guava Flavor 500 ml,https://www.sayweee.com/en/product/Fremo-Aloe-Vera-Drink-Guava-Flavor/29364,$1.99,,,Fremo Aloe Vera Drink Guava Flavor,,South Korea,
Star Mixed Fruit Drink 1.5L 1 bottle,https://www.sayweee.com/en/product/Star-Mixed-Fruit-Drink-1-5L/84653,$2.99,,$2.99/bottle,Star Mixed Fruit Drink 1.5L,(1),Saudi Arabia,
"Maeil Biofeel Yogurt Drink, Pineapple Flavor 25pcs 1575 ml",https://www.sayweee.com/en/product/Maeil-Biofeel-Yogurt-Drink--Pineapple-Flavor-25pcs/27031,$5.99,,,"Maeil Biofeel Yogurt Drink, Pineapple Flavor 25pcs",(7),South Korea,
JackSoy Soy Milk Drink  300 ml,https://www.sayweee.com/en/product/JackSoy-Soy-Milk-Drink-/16970,$1.19,,,JackSoy Soy Milk Drink,(27),Taiwan,
Tropics Thai Tea with Basil Seed Drink 290 ml,https://www.sayweee.com/en/product/Tropics-Thai-Tea-with-Basil-Seed-Drink/86939,$2.49,,,Tropics Thai Tea with Basil Seed Drink,,Thailand,
One Litchi Lychee Vinegar Drink 310 ml,https://www.sayweee.com/en/product/One-Litchi-Lychee-Vinegar-Drink/42941,$1.69,,,One Litchi Lychee Vinegar Drink,(1),Mainland China,
Bright Dairy Momchilovtsi Yogurt Drink 12pk 2400 g,https://www.sayweee.com/en/product/Bright-Dairy-Momchilovtsi-Yogurt-Drink-12pk/99970,$29.39,,,Bright Dairy Momchilovtsi Yogurt Drink 12pk,(3),Mainland China,
"Paoxiaoyan dry white wood ear for drink, 1 Box 72 g",https://www.sayweee.com/en/product/Paoxiaoyan-dry-white-wood-ear-for-drink--1-Box/508,$16.79,,$0.23/g,"Paoxiaoyan dry white wood ear for drink, 1 Box",(7),Mainland China,Paoxiaoyan
"Hey Song C and C Sparkling Drink, Yogurt Flavor 500 ml",https://www.sayweee.com/en/product/Hey-Song-C-and-C-Sparkling-Drink-Yogurt-Flavor/25009,$1.69,,,"Hey Song C and C Sparkling Drink, Yogurt Flavor",(17),Taiwan,
Ovaltine Cocoa Malt Drink Mix  250 ml,https://www.sayweee.com/en/product/Ovaltine-Cocoa-Malt-Drink-Mix-/6613,$3.29,,,Ovaltine Cocoa Malt Drink Mix,(3),Mainland China,Ovaltine
MTR Badam Drink 180 ml,https://www.sayweee.com/en/product/MTR-Badam-Drink/28850,$1.99,,,MTR Badam Drink,(1),India,
Taoti Peach Juice Drink 5 can,https://www.sayweee.com/en/product/Taoti-Peach-Juice-Drink/15487,$5.99,,$1.19/can,Taoti Peach Juice Drink,(2),Taiwan,
Jiangzhong Koshihikari Rice Drinks 1 case,https://www.sayweee.com/en/product/Jiangzhong-Koshihikari-Rice-Drinks/57851,$18.99,,$18.99/case,Jiangzhong Koshihikari Rice Drinks,(9),Mainland China,
"Electrolit Hydration Drink, Grape Flavor  625 ml",https://www.sayweee.com/en/product/Electrolit-Hydration-Drink--Grape-Flavor-/514,$2.99,,,"Electrolit Hydration Drink, Grape Flavor",(1),Mexico,Electrolit
Suntory Zone Energy Drink (Trance) 16.9 fl.oz,https://www.sayweee.com/en/product/Suntory-Zone-Energy-Drink--Trance-/10347,$3.99,,$0.23/fl.oz,Suntory Zone Energy Drink (Trance),,Japan,
Milo Cocoa Powdered Drink 450 g,https://www.sayweee.com/en/product/Milo-Cocoa-Powdered-Drink/5512,$15.69,,$0.03/g,Milo Cocoa Powdered Drink,,Philippines,
Zuko Instant Drink Mix Tamarindo 14.1 oz,https://www.sayweee.com/en/product/Zuko-Instant-Drink-Mix-Tamarindo/82942,$2.99,,$0.21/oz,Zuko Instant Drink Mix Tamarindo,,Mexico,Zuko
Rose and Strawberry Flavor Yogurt Drink 1 case,https://www.sayweee.com/en/product/Rose-and-Strawberry-Flavor-Yogurt-Drink/27450,$24.99,,$24.99/case,Rose and Strawberry Flavor Yogurt Drink,(9),Mainland China,
Zuko Instant Drink Mix Orange 14.1 oz,https://www.sayweee.com/en/product/Zuko-Instant-Drink-Mix-Orange/82944,$2.99,,$0.21/oz,Zuko Instant Drink Mix Orange,,Mexico,Zuko
Choco Milk Chocolate Drink Mix 28.2 oz,https://www.sayweee.com/en/product/Choco-Milk-Chocolate-Drink-Mix/81722,$9.79,,$0.34/oz,Choco Milk Chocolate Drink Mix,,United States,CHOCO MIL
DRY Sparkling Blood Orange Soft Drink 750 ml,https://www.sayweee.com/en/product/DRY-Sparkling-Blood-Orange-Soft-Drink/34433,$5.29,,,DRY Sparkling Blood Orange Soft Drink,(1),United States,
Damizle Let's Mingle Green Mandarin Calamasi Drink Mix 7pk  1 box,https://www.sayweee.com/en/product/Damizle-Let-s-Mingle-Green-Mandarin-Calamasi-Drink-Mix-7pk-/26499,$5.09,,$5.09/box,Damizle Let's Mingle Green Mandarin Calamasi Drink Mix 7pk,,South Korea,
Yili Youngfun Flavored Milk Drink Blueberry Flavor 250 g,https://www.sayweee.com/en/product/Yili-Youngfun-Flavored-Milk-Drink-Blueberry-Flavor/12295,$28.99,,$0.11/g,Yili Youngfun Flavored Milk Drink Blueberry Flavor,(1),Mainland China,
XiaoXiaoHuo Sea Salt Lychee Flavored Drink  500 ml,https://www.sayweee.com/en/product/-XiaoXiaoHuo-Sea-Salt-Lychee-Flavored-Drink-/14399,$3.99,,,XiaoXiaoHuo Sea Salt Lychee Flavored Drink,(2),Mainland China,
Cool Taste Strawberry Jelly Drink 160 g,https://www.sayweee.com/en/product/Cool-Taste-Strawberry-Jelly-Drink/87149,$1.29,,,Cool Taste Strawberry Jelly Drink,,Philippines,
"KFI Masti Pani Puri Drink, Tamarind Mint Flavor  33.8 oz",https://www.sayweee.com/en/product/KFI-Masti-Pani-Puri-Drink--Tamarind-Mint-Flavor-/5813,$5.09,,$0.15/oz,"KFI Masti Pani Puri Drink, Tamarind Mint Flavor",(1),Canada,
