Title,Title_link,Price,unit_info___32SjE,count___1LWwo,Headline,Field1,Field2,Field3
"Wang Korea BBQ Bong Korean Fish Sausage, Barbecue Flavor 10ct 340 g",https://www.sayweee.com/en/product/Wang-Korea-BBQ-Bong-Korean-Fish-Sausage--Barbecue-Flavor-10ct/36845,$6.49,,300+ Sold,"Wang Korea BBQ Bong Korean Fish Sausage, Barbecue Flavor 10ct",(38),South Korea,Wang Korea
Yeo's Singapore Inspired Honey Glazed Pork Bites 4 oz,https://www.sayweee.com/en/product/Yeos-Singapore-Inspired-Honey-Glazed-Pork-Bites/12433,$7.99,$1.99/oz,200+ Sold,Yeo's Singapore Inspired Honey Glazed Pork Bites,(11),United States,Yeo's
Ching Yeh Pork Sung 4 oz,https://www.sayweee.com/en/product/Ching-Yeh-Pork-Sung/12891,$3.99,$0.99/oz,300+ Sold,Ching Yeh Pork Sung,(100),United States,
HTY Original Beef Jerky 2.75 oz,https://www.sayweee.com/en/product/HTY-Original-Beef-Jerky/98929,$6.99,$2.54/oz,100+ Sold,HTY Original Beef Jerky,(25),Taiwan,
HTY Spicy Beef Jerky  78 g,https://www.sayweee.com/en/product/HTY-Spicy-Beef-Jerky-/98932,$6.99,$0.08/g,50+ Sold,HTY Spicy Beef Jerky,(31),United States,
Chicken Paw with Pickled Peppers 200 g,https://www.sayweee.com/en/product/Chicken-Paw-with-Pickled-Peppers/83965,$5.99,,1K+ Sold,Chicken Paw with Pickled Peppers,(11),Mainland China,
Perky Jerky Chimichurri Wagyu Beef 2.2 oz,https://www.sayweee.com/en/product/Perky-Jerky-Chimichurri-Wagyu-Beef/83567,$7.99,$3.63/oz,,Perky Jerky Chimichurri Wagyu Beef,(2),United States,
Duke's Hot & Spicy Smoked Shorty Sausage  142 g,https://www.sayweee.com/en/product/Duke-s-Hot---Spicy-Smoked-Shorty-Sausage-/34912,$6.99,$0.04/g,,Duke's Hot & Spicy Smoked Shorty Sausage,(1),United States,
Perky Jerky Salt & Pepper Wagyu Beef 2.2 oz,https://www.sayweee.com/en/product/Perky-Jerky-Salt---Pepper-Wagyu-Beef/83429,$7.99,$3.63/oz,50+ Sold,Perky Jerky Salt & Pepper Wagyu Beef,,United States,Perky Jerky
"Old Country Beef Jerky, Original Flavor  80 g",https://www.sayweee.com/en/product/Old-Country-Beef-Jerky-Original-Flavor-/13093,$12.69,$0.15/g,,"Old Country Beef Jerky, Original Flavor",(23),United States,
"Silver Horn Beef Jerky, Lemongrass 8 oz",https://www.sayweee.com/en/product/Silver-Horn-Beef-Jerky--Lemongrass/82435,$11.99,$1.49/oz,50+ Sold,"Silver Horn Beef Jerky, Lemongrass",(6),United States,
Bach Cuc Beef Jerky Curry Flavor 8 oz,https://www.sayweee.com/en/product/Bach-Cuc-Beef-Jerky-Curry-Flavor/85445,$13.99,$1.74/oz,,Bach Cuc Beef Jerky Curry Flavor,,Vietnam,
"Vegetarian Jerkey, Spicy Chicken Flavor  108 g",https://www.sayweee.com/en/product/Vegetarian-Jerkey--Spicy-Chicken-Flavor-/40143,$1.99,,200+ Sold,"Vegetarian Jerkey, Spicy Chicken Flavor",(4),Mainland China,
"Bach Cuc Beef Jerky, Sesame Flavor 8 oz",https://www.sayweee.com/en/product/Bach-Cuc-Beef-Jerky--Sesame-Flavor/3910,$12.99,$1.62/oz,50+ Sold,"Bach Cuc Beef Jerky, Sesame Flavor",(6),United States,Bach Cuc
Yeo's Singapore Inspired Honey Sriracha Glazed Pork Bites 4 oz,https://www.sayweee.com/en/product/Yeos-Singapore-Inspired-Honey-Sriracha-Glazed-Pork-Bites/14935,$7.99,$1.99/oz,,Yeo's Singapore Inspired Honey Sriracha Glazed Pork Bites,(5),United States,
"Suniupai Vegetarian Beef Steak, Cumin Flavor  90 g",https://www.sayweee.com/en/product/Suniupai-Vegetarian-Beef-Steak--Cumin-Flavor-/40144,$1.99,,200+ Sold,"Suniupai Vegetarian Beef Steak, Cumin Flavor",(10),Mainland China,
King's Fruit Flavored Beef Jerky 8 oz,https://www.sayweee.com/en/product/King-s-Fruit-Flavored-Beef-Jerky/67253,$17.99,$2.24/oz,,King's Fruit Flavored Beef Jerky,(8),United States,
"Chicken Paw with Pickled Peppers, Lemon Flavor 200 g",https://www.sayweee.com/en/product/Chicken-Paw-with-Pickled-Peppers--Lemon-Flavor/83966,$5.99,,100+ Sold,"Chicken Paw with Pickled Peppers, Lemon Flavor",(2),Mainland China,
"Suniupai Vegetarian Beef Steak, Spicy Flavor 90 g",https://www.sayweee.com/en/product/Suniupai-Vegetarian-Beef-Steak--Spicy-Flavor/40146,$1.99,,200+ Sold,"Suniupai Vegetarian Beef Steak, Spicy Flavor",(4),Mainland China,
King's Teriyaki Beef Jerky Strip 8 oz,https://www.sayweee.com/en/product/King-s-Teriyaki-Beef-Jerky-Strip/67248,$17.99,$2.24/oz,,King's Teriyaki Beef Jerky Strip,(4),United States,King's
Chinese Brand Hot Beef Jerky 1.5 oz,https://www.sayweee.com/en/product/Chinese-Brand-Hot-Beef-Jerky/94139,$3.49,$2.32/oz,200+ Sold,Chinese Brand Hot Beef Jerky,(11),United States,
Chicken Paw with Chinese Sauerkraut 200 g,https://www.sayweee.com/en/product/Chicken-Paw-with-Chinese-Sauerkraut/83967,$5.99,,50+ Sold,Chicken Paw with Chinese Sauerkraut,,Mainland China,
Hsin Tung Yang Peppered Beef Jerky 2.75 oz,https://www.sayweee.com/en/product/Hsin-Tung-Yang-Peppered-Beef-Jerky/80905,$6.99,$2.54/oz,,Hsin Tung Yang Peppered Beef Jerky,(4),United States,HSIN TUNG YANG
HYT Sweet and Spicy Beef Jerky 2.75 oz,https://www.sayweee.com/en/product/HYT-Sweet-and-Spicy-Beef-Jerky/98689,$6.99,$2.54/oz,50+ Sold,HYT Sweet and Spicy Beef Jerky,(32),Taiwan,
Chinese Preserved Pork Floss 4 oz,https://www.sayweee.com/en/product/Chinese-Preserved-Pork-Floss/99366,$3.99,$0.99/oz,,Chinese Preserved Pork Floss,(23),United States,
