Title,Title_link,Price,count___1LWwo,unit_info___32SjE,Headline,Field1,Field2,Field3
YunPinXian Yunnan Rice Noodles Mushroom 7.76 oz,https://www.sayweee.com/en/product/YunPinXian-Yunnan-Rice-Noodles-Mushroom/48464,$3.49,800+ Sold,$0.44/oz,YunPinXian Yunnan Rice Noodles Mushroom,(7),Mainland China,
Simply Food Sesame Coconut Rice Paper  140 g,https://www.sayweee.com/en/product/Simply-Food-Sesame-Coconut-Rice-Paper-/69556,$3.89,100+ Sold,,Simply Food Sesame Coconut Rice Paper,(2),Vietnam,Simply Food
Rice King Thai Sweet Long Grain Rice Bag  4.4 lb,https://www.sayweee.com/en/product/Rice-King-Thai-Sweet-Long-Grain-Rice-Bag-/70953,$7.99,200+ Sold,$1.81/lb,Rice King Thai Sweet Long Grain Rice Bag,(135),Mainland China,
CJ BARN BARN MI 50% Brown RIce+ 50% Brown Sweet RIce 15 lb,https://www.sayweee.com/en/product/CJ-BARN-BARN-MI-50--Brown-RIce--50--Brown-Sweet-RIce/44763,$19.99,50+ Sold,$1.33/lb,CJ BARN BARN MI 50% Brown RIce+ 50% Brown Sweet RIce,(25),United States,CJ Foods
Rice King Pon Lai Rice Gold 15 lb,https://www.sayweee.com/en/product/Rice-King-Pon-Lai-Rice-Gold/82510,$29.99,50+ Sold,$1.99/lb,Rice King Pon Lai Rice Gold,(2),United States,
Golden Rice Taiwan Premium Short Grain Rice 6000 g,https://www.sayweee.com/en/product/Golden-Rice-Taiwan-Premium-Short-Grain-Rice/31814,$26.99,,,Golden Rice Taiwan Premium Short Grain Rice,(2),Taiwan,
Rice King Multi Grain Rice 4.4 lb,https://www.sayweee.com/en/product/Rice-King-Multi-Grain-Rice/85875,$14.19,,$3.22/lb,Rice King Multi Grain Rice,,Thailand,
"Baijia Guizhou Rice Noodles, Beef Flavor 270 g",https://www.sayweee.com/en/product/Baijia-Guizhou-Rice-Noodles--Beef-Flavor/11083,$3.99,1K+ Sold,,"Baijia Guizhou Rice Noodles, Beef Flavor",(224),Mainland China,
Shao Hsing Rice Cooking Wine 750 ml,https://www.sayweee.com/en/product/Shao-Hsing-Rice-Cooking-Wine/85849,$3.99,1K+ Sold,,Shao Hsing Rice Cooking Wine,(1237),Mainland China,Shao Hsing
"Haohuanluo River Snails Rice Noodles, Original Flavor  300 g",https://www.sayweee.com/en/product/Haohuanluo-River-Snails-Rice-Noodles--Original-Flavor-/7309,$4.69,1K+ Sold,,"Haohuanluo River Snails Rice Noodles, Original Flavor",(209),Mainland China,Happy Snail
Doll Dim Sum Shrimp Cheong Fun Rice Roll 203 g,https://www.sayweee.com/en/product/Doll-Dim-Sum-Shrimp-Cheong-Fun-Rice-Roll/32336,$3.59,1K+ Sold,,Doll Dim Sum Shrimp Cheong Fun Rice Roll,(501),Hong Kong,
"Laurel Sesame Rice Balls, Frozen 10pc 1 each",https://www.sayweee.com/en/product/Laurel-Sesame-Rice-Balls-Frozen-10pc/94113,$2.99,1K+ Sold,$2.99/each,"Laurel Sesame Rice Balls, Frozen 10pc",(723),Taiwan,Laurel
"Synear Glutinous Rice Balls with Black Sesame, Frozen 400 g",https://www.sayweee.com/en/product/Synear-Glutinous-Rice-Balls-with-Black-Sesame--Frozen/77787,$3.29,1K+ Sold,,"Synear Glutinous Rice Balls with Black Sesame, Frozen",(168),Mainland China,Synear
Luobawang Luo Si Tomato Rice Noodles 306 g,https://www.sayweee.com/en/product/Luobawang-Luo-Si-Tomato-Rice-Noodles/63105,$4.49,1K+ Sold,,Luobawang Luo Si Tomato Rice Noodles,(234),Mainland China,
Synear Ningbo Black Pearls Sesame Rice Balls 400 g,https://www.sayweee.com/en/product/Synear-Ningbo-Black-Pearls-Sesame-Rice-Balls/59965,$3.19,1K+ Sold,,Synear Ningbo Black Pearls Sesame Rice Balls,(56),Mainland China,Synear
Nishiki Premium Medium Grain Rice 15 lb,https://www.sayweee.com/en/product/Nishiki-Premium-Medium-Grain-Rice/78866,$23.99,1K+ Sold,$1.59/lb,Nishiki Premium Medium Grain Rice,(1037),United States,Nishiki
[HHL] Snails Rice Noodle (Original) 400g 400 g,https://www.sayweee.com/en/product/-HHL--Snails-Rice-Noodle--Original--400g/10917,$4.69,1K+ Sold,,[HHL] Snails Rice Noodle (Original) 400g,(83),Mainland China,
Erawan Glutinous Rice Flour 1 lb,https://www.sayweee.com/en/product/Erawan-Glutinous-Rice-Flour/97870,$2.19,1K+ Sold,$2.19/lb,Erawan Glutinous Rice Flour,(323),Thailand,Erawan
Synear Mini Black Sesame Rice Balls 300 g,https://www.sayweee.com/en/product/Synear-Mini-Black-Sesame-Rice-Balls/26222,$2.49,1K+ Sold,,Synear Mini Black Sesame Rice Balls,(86),Mainland China,Synear
"Synear Assorted Mini Rice Balls, Frozen 300 g",https://www.sayweee.com/en/product/Synear-Assorted-Mini-Rice-Balls--Frozen/77789,$3.19,1K+ Sold,,"Synear Assorted Mini Rice Balls, Frozen",(201),Mainland China,Synear
Liziqi Snail Rice Noodles 335 g,https://www.sayweee.com/en/product/Liziqi-Snail-Rice-Noodles/28856,$6.49,1K+ Sold,,Liziqi Snail Rice Noodles,(197),Mainland China,
"QianWei Rhubarb Glutinous Rice Ball with Black Sesame Filling, Frozen  500 g",https://www.sayweee.com/en/product/QianWei-Rhubarb-Glutinous-Rice-Ball-with-Black-Sesame-Filling--Frozen-/17232,$3.79,1K+ Sold,,"QianWei Rhubarb Glutinous Rice Ball with Black Sesame Filling, Frozen",(70),Mainland China,Sweet-Scented
Liuzhou Guangxi Specialty Luo Si Fen Spicy Rice Noodles 315 g,https://www.sayweee.com/en/product/Liuzhou-Guangxi-Specialty-Luo-Si-Fen-Spicy-Rice-Noodles/96741,$4.49,1K+ Sold,,Liuzhou Guangxi Specialty Luo Si Fen Spicy Rice Noodles,(222),Mainland China,
Sekka Premium Japanese Medium Grain Rice 15 lb,https://www.sayweee.com/en/product/Sekka-Premium-Japanese-Medium-Grain-Rice/81224,$17.99,1K+ Sold,$1.19/lb,Sekka Premium Japanese Medium Grain Rice,(395),United States,Sekka
Chiao Kou Purple Rice Porridge with Mixed Chinese Sweets  350 g,https://www.sayweee.com/en/product/Chiao-Kou-Purple-Rice-Porridge-with-Mixed-Chinese-Sweets-/97227,$3.19,1K+ Sold,,Chiao Kou Purple Rice Porridge with Mixed Chinese Sweets,(139),,
Brown Sugar Glutinous Rice Cake 220 g,https://www.sayweee.com/en/product/Brown-Sugar-Glutinous-Rice-Cake/65691,$5.49,1K+ Sold,,Brown Sugar Glutinous Rice Cake,(73),Mainland China,
"Synear Glutinous Rice Ball with Sesame, Frozen 320 g",https://www.sayweee.com/en/product/Synear-Glutinous-Rice-Ball-with-Sesame--Frozen/77793,$4.69,1K+ Sold,,"Synear Glutinous Rice Ball with Sesame, Frozen",(47),Mainland China,
Nishiki Premium Medium Grain Rice 5 lb,https://www.sayweee.com/en/product/Nishiki-Premium-Medium-Grain-Rice/96142,$8.99,1K+ Sold,$1.79/lb,Nishiki Premium Medium Grain Rice,(113),United States,Nishiki
Fortune Avenue Steamed Rice Cake with Pork Blood 16 oz,https://www.sayweee.com/en/product/Fortune-Avenue-Steamed-Rice-Cake-with-Pork-Blood/66320,$9.49,1K+ Sold,$0.59/oz,Fortune Avenue Steamed Rice Cake with Pork Blood,(308),United States,
Amoy Glutinous Rice Dumpling 3pc 180 g,https://www.sayweee.com/en/product/Amoy-Glutinous-Rice-Dumpling-3pc/39202,$3.29,1K+ Sold,,Amoy Glutinous Rice Dumpling 3pc,(216),Hong Kong,Amoy
Taiwan Brand Glutinous Rice Dumpling with Pork  12 oz,https://www.sayweee.com/en/product/Taiwan-Brand-Glutinous-Rice-Dumpling-with-Pork-/74889,$5.49,1K+ Sold,$0.45/oz,Taiwan Brand Glutinous Rice Dumpling with Pork,(66),United States,
Doll Dim Sum Mini Glutinous Rice Dumpling 7.9 oz,https://www.sayweee.com/en/product/Doll-Dim-Sum-Mini-Glutinous-Rice-Dumpling/26396,$3.19,1K+ Sold,$0.40/oz,Doll Dim Sum Mini Glutinous Rice Dumpling,(152),Mainland China,
BYL Red Sweet Rice Dumpling  Frozen 200 g,https://www.sayweee.com/en/product/BYL-Red-Sweet-Rice-Dumpling--Frozen/84515,$2.49,1K+ Sold,,BYL Red Sweet Rice Dumpling  Frozen,(13),Mainland China,
Erawan Rice Flour 1 lb,https://www.sayweee.com/en/product/Erawan-Rice-Flour/3042,$1.89,1K+ Sold,$1.89/lb,Erawan Rice Flour,(245),Thailand,Erawan
LAUREL'S Black Sesame Glutinous Rice Ball 10pc 1 each,https://www.sayweee.com/en/product/LAUREL-S-Black-Sesame-Glutinous-Rice-Ball-10pc/16767,$2.99,1K+ Sold,$2.99/each,LAUREL'S Black Sesame Glutinous Rice Ball 10pc,(139),United States,Laurel
Liu Quan Instant Spicy Snail Rice Noodles Vermicelli 315 g,https://www.sayweee.com/en/product/Liu-Quan-Instant-Spicy-Snail-Rice-Noodles-Vermicelli/97903,$4.49,1K+ Sold,,Liu Quan Instant Spicy Snail Rice Noodles Vermicelli,(650),Mainland China,
"Vegetarian Rice Mushroom Buns, Frozen 420 g",https://www.sayweee.com/en/product/Vegetarian-Rice-Mushroom-Buns-Frozen/34460,$3.99,1K+ Sold,,"Vegetarian Rice Mushroom Buns, Frozen",(434),Mainland China,
Wowo Brand Fermented Glutinous Rice 600 g,https://www.sayweee.com/en/product/Wowo-Brand-Fermented-Glutinous-Rice/97184,$3.99,1K+ Sold,,Wowo Brand Fermented Glutinous Rice,(196),Mainland China,
"Si Nian Mini Glutinous Rice Balls, Frozen 300 g",https://www.sayweee.com/en/product/Si-Nian-Mini-Glutinous-Rice-Balls--Frozen/67393,$2.99,"1K+ Sold,27 Left",,"Si Nian Mini Glutinous Rice Balls, Frozen",(216),Mainland China,
"Master Lee Cooked Rice with Vegan Fish Flavored Eggplant, Frozen  460 g",https://www.sayweee.com/en/product/Master-Lee-Cooked-Rice-with-Vegan-Fish-Flavored-Eggplant--Frozen-/19143,$2.89,1K+ Sold,,"Master Lee Cooked Rice with Vegan Fish Flavored Eggplant, Frozen",(54),Mainland China,
Kikkoman Manjo Aji-Mirin Sweet Cooking Rice Seasoning  10 oz,https://www.sayweee.com/en/product/Kikkoman-Manjo-Aji-Mirin-Sweet-Cooking-Rice-Seasoning-/5614,$3.99,1K+ Sold,$0.39/oz,Kikkoman Manjo Aji-Mirin Sweet Cooking Rice Seasoning,(183),Japan,
"Master Lee Cooked Rice with Sauteed Potato, Green Pepper & Eggplant, Frozen 460 g",https://www.sayweee.com/en/product/Master-Lee-Cooked-Rice-with-Sauteed-Potato--Green-Pepper---Eggplant--Frozen/19078,$3.49,1K+ Sold,,"Master Lee Cooked Rice with Sauteed Potato, Green Pepper & Eggplant, Frozen",(42),Mainland China,
Tiger Sugar Black Sugar Sesame Rice Ball 200 g,https://www.sayweee.com/en/product/Tiger-Sugar-Black-Sugar-Sesame-Rice-Ball/47345,$3.29,1K+ Sold,,Tiger Sugar Black Sugar Sesame Rice Ball,(79),Taiwan,Tiger Sugar
Aroy-D Sticky Rice with Mango 8.8 oz,https://www.sayweee.com/en/product/Aroy-D-Sticky-Rice-with-Mango/80049,$4.87,1K+ Sold,$0.55/oz,Aroy-D Sticky Rice with Mango,(21),Thailand,AROYD
FenWeiXiang Hunan Style Rice Noodle 280 g,https://www.sayweee.com/en/product/FenWeiXiang-Hunan-Style-Rice-Noodle/67682,$4.19,900+ Sold,,FenWeiXiang Hunan Style Rice Noodle,(215),Mainland China,
"Liuquan Instant Spicy Rice Noodle, Original 400 g",https://www.sayweee.com/en/product/Liuquan-Instant-Spicy-Rice-Noodle--Original/67498,$4.09,900+ Sold,,"Liuquan Instant Spicy Rice Noodle, Original",(92),Mainland China,
"Mi Po Po Fermented Glutinous Rice, Large 900 g",https://www.sayweee.com/en/product/Mi-Po-Po-Fermented-Glutinous-Rice-Large/18065,$5.99,900+ Sold,,"Mi Po Po Fermented Glutinous Rice, Large",(104),Mainland China,
"Spring Home Mini Rice Balls, Sweet Potato and Taro, Frozen 180 g",https://www.sayweee.com/en/product/Spring-Home-Mini-Rice-Balls--Sweet-Potato-and-Taro--Frozen/40492,$2.69,900+ Sold,,"Spring Home Mini Rice Balls, Sweet Potato and Taro, Frozen",(166),United States,
Vegetarian Rice Mushroom Bun  14.8 oz,https://www.sayweee.com/en/product/Vegetarian-Rice-Mushroom-Bun-/72237,$4.49,900+ Sold,$0.30/oz,Vegetarian Rice Mushroom Bun,(73),Mainland China,
"Liuzhou Snail Rice Noodles, Spicy Plus  400 g",https://www.sayweee.com/en/product/Liuzhou-Snail-Rice-Noodles--Spicy-Plus-/23509,$5.29,900+ Sold,,"Liuzhou Snail Rice Noodles, Spicy Plus",(19),Mainland China,
"Liuzhou Snail Rice Noodles, Spicy Plus  400 g",https://www.sayweee.com/en/product/Liuzhou-Snail-Rice-Noodles--Spicy-Plus-/23509,$5.29,900+ Sold,,"Liuzhou Snail Rice Noodles, Spicy Plus",(19),Mainland China,
Jiangxi Rice Vermicelli 400 g,https://www.sayweee.com/en/product/Jiangxi-Rice-Vermicelli/44377,$1.99,900+ Sold,,Jiangxi Rice Vermicelli,(47),Mainland China,
"Master Lee  Cooked Rice Ball with Cumin & Squid, Frozen 100 g",https://www.sayweee.com/en/product/Master-Lee--Cooked-Rice-Ball-with-Cumin---Squid--Frozen/18080,$1.39,900+ Sold,,"Master Lee  Cooked Rice Ball with Cumin & Squid, Frozen",(31),Mainland China,
Rhee Chun New Variety Extra Fancy Rice 15 lb,https://www.sayweee.com/en/product/Rhee-Chun-New-Variety-Extra-Fancy-Rice/2802,$15.99,"800+ Sold,38 Left",$1.06/lb,Rhee Chun New Variety Extra Fancy Rice,(98),United States,
BYL Ningbo Hot Pot Rice Cake  Frozen 1 lb,https://www.sayweee.com/en/product/BYL-Ningbo-Hot-Pot-Rice-Cake--Frozen/84570,$2.19,800+ Sold,$2.19/lb,BYL Ningbo Hot Pot Rice Cake  Frozen,(9),Mainland China,
Shanghai Brand Glutinous Rice Dumpling with Pork  12 oz,https://www.sayweee.com/en/product/Shanghai-Brand-Glutinous-Rice-Dumpling-with-Pork-/74888,$5.49,800+ Sold,$0.45/oz,Shanghai Brand Glutinous Rice Dumpling with Pork,(46),United States,
Synear Ningbo White Pearls Peanut Rice Balls 400 g,https://www.sayweee.com/en/product/Synear-Ningbo-White-Pearls-Peanut-Rice-Balls/59969,$3.19,800+ Sold,,Synear Ningbo White Pearls Peanut Rice Balls,(11),Mainland China,Synear
Wuming Classic Rice Noodle  1000 g,https://www.sayweee.com/en/product/Wuming-Classic-Rice-Noodle-/66835,$4.99,800+ Sold,,Wuming Classic Rice Noodle,(44),Mainland China,Wu Ming
Koda Farms Mochiko Sweet Rice Flour  16 oz,https://www.sayweee.com/en/product/Koda-Farms-Mochiko-Sweet-Rice-Flour-/35373,$3.29,800+ Sold,$0.20/oz,Koda Farms Mochiko Sweet Rice Flour,(30),United States,Koda Farm
"Happy Snail Liuzhou Snail Rice Noodles, Crayfish Flavor 320 g",https://www.sayweee.com/en/product/Happy-Snail-Liuzhou-Snail-Rice-Noodles--Crayfish-Flavor/9254,$5.49,800+ Sold,,"Happy Snail Liuzhou Snail Rice Noodles, Crayfish Flavor",(275),Mainland China,
"Mommy's Gourmet Brand Pork Rice Dumpling with Salted Egg Yolk, Frozen 12 oz",https://www.sayweee.com/en/product/Mommy-s-Gourmet-Brand-Pork-Rice-Dumpling-with-Salted-Egg-Yolk--Frozen/29171,$5.99,800+ Sold,$0.49/oz,"Mommy's Gourmet Brand Pork Rice Dumpling with Salted Egg Yolk, Frozen",(12),United States,
Big Green Organic Black Rice 454g 16 oz,https://www.sayweee.com/en/product/Big-Green-Organic-Black-Rice-454g/96972,$4.79,800+ Sold,$0.29/oz,Big Green Organic Black Rice 454g,(185),Mainland China,Big Green
Oh Ricey Pnompenh Rice Noodles Vietnam Instant Noodles 1 oz,https://www.sayweee.com/en/product/Oh-Ricey-Pnompenh-Rice-Noodles-Vietnam-Instant-Noodles/17042,$1.19,800+ Sold,$1.19/oz,Oh Ricey Pnompenh Rice Noodles Vietnam Instant Noodles,(11),Vietnam,
"Gourmet Alley Rice Cake, Sliced 500 g",https://www.sayweee.com/en/product/Gourmet-Alley-Rice-Cake--Sliced/42389,$3.99,800+ Sold,,"Gourmet Alley Rice Cake, Sliced",(15),Mainland China,Gourmet Alley
"Bibigo Crispy Rice Wrapper Dumplings with Meat and Vegetables, Frozen  28 oz",https://www.sayweee.com/en/product/Bibigo-Crispy-Rice-Wrapper-Dumplings-with-Meat-and-Vegetables--Frozen-/42053,$9.99,800+ Sold,$0.35/oz,"Bibigo Crispy Rice Wrapper Dumplings with Meat and Vegetables, Frozen",(237),South Korea,Bibigo
Liu Quan Snail Rice Noodles Vermicelli 268 g,https://www.sayweee.com/en/product/Liu-Quan-Snail-Rice-Noodles-Vermicelli/82873,$3.99,700+ Sold,,Liu Quan Snail Rice Noodles Vermicelli,(313),Mainland China,
WoWo Brand Fermented Glutinous Rice 818 g,https://www.sayweee.com/en/product/WoWo-Brand-Fermented-Glutinous-Rice/97514,$5.29,700+ Sold,,WoWo Brand Fermented Glutinous Rice,(86),Mainland China,
Black Glutinous Rice 1.5 lb,https://www.sayweee.com/en/product/Black-Glutinous-Rice/35720,$5.99,700+ Sold,$3.99/lb,Black Glutinous Rice,(444),Taiwan,
Kong Yen Rice Vinegar  20.2 fl.oz,https://www.sayweee.com/en/product/Kong-Yen-Rice-Vinegar-/8420,$2.99,700+ Sold,$0.14/fl.oz,Kong Yen Rice Vinegar,(164),Taiwan,
Fulinmen Aromatic Medium Grain Rice 11 lb,https://www.sayweee.com/en/product/Fulinmen-Aromatic-Medium-Grain-Rice/85273,$33.99,700+ Sold,$3.09/lb,Fulinmen Aromatic Medium Grain Rice,(81),Mainland China,
Synear Authentic Rice Balls with Red Bean Filling 454 g,https://www.sayweee.com/en/product/Synear-Authentic-Rice-Balls-with-Red-Bean-Filling/43490,$3.75,"700+ Sold,40 Left",,Synear Authentic Rice Balls with Red Bean Filling,(21),Mainland China,Synear
Qian Wei Yang Chu MINI  Mixed Glutinous Rice Ball  Frozen 280 g,https://www.sayweee.com/en/product/Qian-Wei-Yang-Chu-MINI--Mixed-Glutinous-Rice-Ball--Frozen/85483,$1.99,700+ Sold,,Qian Wei Yang Chu MINI  Mixed Glutinous Rice Ball  Frozen,(5),Mainland China,
"Spring Home Mini Rice Ball, Original  300 g",https://www.sayweee.com/en/product/Spring-Home-Mini-Rice-Ball--Original-/99228,$2.49,700+ Sold,,"Spring Home Mini Rice Ball, Original",(10),Singapore,
Tiger Taiwanese Rice Noodles 400 g,https://www.sayweee.com/en/product/Tiger-Taiwanese-Rice-Noodles/1623,$3.49,600+ Sold,,Tiger Taiwanese Rice Noodles,(334),Taiwan,Tiger
"S&B Tasty Hayashi Rice, Japanese Gravy Mix 5.6 oz",https://www.sayweee.com/en/product/SB-Tasty-Hayashi-Rice-Japanese-Gravy-Mix/79755,$2.79,600+ Sold,$0.49/oz,"S&B Tasty Hayashi Rice, Japanese Gravy Mix",(44),Japan,S&B
Hakubai Premium Sweet Rice 5 lb,https://www.sayweee.com/en/product/Hakubai-Premium-Sweet-Rice/13091,$10.99,600+ Sold,$2.19/lb,Hakubai Premium Sweet Rice,(111),United States,
"HUNSTY Small Sweet Glutinous Rice Ball, Frozen  400 g",https://www.sayweee.com/en/product/HUNSTY-Small-Sweet-Glutinous-Rice-Ball--Frozen-/78808,$3.49,600+ Sold,,"HUNSTY Small Sweet Glutinous Rice Ball, Frozen",(52),Taiwan,HUNSTY
Qian Wei Yang Chu Ningbo Style Rice Ball Peanut Frozen 400 g,https://www.sayweee.com/en/product/Qian-Wei-Yang-Chu-Ningbo-Style-Rice-Ball-Peanut-Frozen/85469,$3.29,600+ Sold,,Qian Wei Yang Chu Ningbo Style Rice Ball Peanut Frozen,(2),Mainland China,
Qian wei yang chu Rhubarb Small Rice Ball Black Sesame Frozen 280 g,https://www.sayweee.com/en/product/Qian-wei-yang-chu-Rhubarb-Small-Rice-Ball-Black-Sesame-Frozen/85468,$2.49,600+ Sold,,Qian wei yang chu Rhubarb Small Rice Ball Black Sesame Frozen,(1),Mainland China,
"Shizuren Energy Instant Rice Noodles, Beef Flavor 100 g",https://www.sayweee.com/en/product/Shizuren-Energy-Instant-Rice-Noodles--Beef-Flavor/5717,$3.59,600+ Sold,$0.03/g,"Shizuren Energy Instant Rice Noodles, Beef Flavor",(83),Mainland China,
QiaoJiaShan Rice Cake 200 g,https://www.sayweee.com/en/product/QiaoJiaShan-Rice-Cake/26230,$3.49,600+ Sold,,QiaoJiaShan Rice Cake,(101),Mainland China,
Bibigo Foods Rice Porridge with Mushrooms and Vegetables 280 g,https://www.sayweee.com/en/product/Bibigo-Foods-Rice-Porridge-with-Mushrooms-and-Vegetables/16000,$4.99,600+ Sold,,Bibigo Foods Rice Porridge with Mushrooms and Vegetables,(55),South Korea,Bibigo
Vegetarian Glutinous Rice Dumpling  270 g,https://www.sayweee.com/en/product/Vegetarian-Glutinous-Rice-Dumpling-/35842,$2.99,500+ Sold,,Vegetarian Glutinous Rice Dumpling,(71),Mainland China,
CJ Cooked White Rice with Seaweed Soup 165 g,https://www.sayweee.com/en/product/CJ-Cooked-White-Rice-with-Seaweed-Soup/59348,$3.99,500+ Sold,,CJ Cooked White Rice with Seaweed Soup,(11),South Korea,
Tiger Sugar Black Sugar Salted Egg Custard Rice Ball 200 g,https://www.sayweee.com/en/product/Tiger-Sugar-Black-Sugar-Salted-Egg-Custard-Rice-Ball/82991,$3.29,500+ Sold,,Tiger Sugar Black Sugar Salted Egg Custard Rice Ball,(66),Taiwan,Tiger Sugar
Sunway Nanchang Rice Noodles 208.8 g,https://www.sayweee.com/en/product/Sunway-Nanchang-Rice-Noodles/46896,$2.99,500+ Sold,,Sunway Nanchang Rice Noodles,(47),Mainland China,
Kokuho Rose Premium Quality Rice 15 lb,https://www.sayweee.com/en/product/Kokuho-Rose-Premium-Quality-Rice/10895,$21.99,500+ Sold,$1.46/lb,Kokuho Rose Premium Quality Rice,(76),United States,
"Master Lee Yangzhou Style Fried Rice, Frozen 330 g",https://www.sayweee.com/en/product/Master-Lee-Yangzhou-Style-Fried-Rice--Frozen/20970,$2.39,500+ Sold,,"Master Lee Yangzhou Style Fried Rice, Frozen",(31),Mainland China,
Sunity Herbal Jelly with Purple Rice and Milk  444 g,https://www.sayweee.com/en/product/Sunity-Herbal-Jelly-with-Purple-Rice-and-Milk-/10137,$4.59,500+ Sold,,Sunity Herbal Jelly with Purple Rice and Milk,(51),Mainland China,Sunity
"Luosi Rice Noodles, Mushroom Flavor 400 g",https://www.sayweee.com/en/product/Luosi-Rice-Noodles--Mushroom-Flavor/35256,$4.99,500+ Sold,,"Luosi Rice Noodles, Mushroom Flavor",(28),Mainland China,
WFZ Frozen 8 Flavor Purple Gluten Rice  200 g,https://www.sayweee.com/en/product/WFZ-Frozen-8-Flavor-Purple-Gluten-Rice-/95947,$2.69,500+ Sold,,WFZ Frozen 8 Flavor Purple Gluten Rice,(40),Mainland China,
YABA Unagi Fried Rice with Roasted Eel Frozen 12 oz,https://www.sayweee.com/en/product/YABA-Unagi-Fried-Rice-with-Roasted-Eel-Frozen/40084,$7.99,500+ Sold,$0.66/oz,YABA Unagi Fried Rice with Roasted Eel Frozen,(14),Mainland China,
JiangXi Rice Vermicelli  14 oz,https://www.sayweee.com/en/product/JiangXi-Rice-Vermicelli-/27016,$2.29,500+ Sold,$0.16/oz,JiangXi Rice Vermicelli,(65),Mainland China,
Tamaki Gold California Koshihikari Short Grain Rice 15 lb,https://www.sayweee.com/en/product/Tamaki-Gold-California-Koshihikari-Short-Grain-Rice/36852,$36.99,500+ Sold,$2.46/lb,Tamaki Gold California Koshihikari Short Grain Rice,(121),United States,Tamaki
"Master Lee Fried Rice with Zucchini & Egg, Frozen 330 g",https://www.sayweee.com/en/product/Master-Lee-Fried-Rice-with-Zucchini---Egg--Frozen/21178,$2.39,500+ Sold,,"Master Lee Fried Rice with Zucchini & Egg, Frozen",(15),Mainland China,
"Steamed Siu Mai Mushroom and Sticky Rice Dumplings, Frozen 300 g",https://www.sayweee.com/en/product/Steamed-Siu-Mai-Mushroom-and-Sticky-Rice-Dumplings--Frozen/19037,$5.49,500+ Sold,,"Steamed Siu Mai Mushroom and Sticky Rice Dumplings, Frozen",(87),Mainland China,Asian Choice
Surasang 88 Seoul Spicy Stir-Fried Rice Cake  1.8 lb,https://www.sayweee.com/en/product/Surasang-88-Seoul-Spicy-Stir-Fried-Rice-Cake-/36663,$8.99,400+ Sold,$4.99/lb,Surasang 88 Seoul Spicy Stir-Fried Rice Cake,(81),South Korea,Surasang
CJ Bibigo Beef Fried Rice 16.4 oz,https://www.sayweee.com/en/product/CJ-Bibigo-Beef-Fried-Rice/34481,$7.99,400+ Sold,$0.48/oz,CJ Bibigo Beef Fried Rice,(4),United States,Bibigo
Three Ladies Brand Organic Jasmine Rice 5 lb,https://www.sayweee.com/en/product/Three-Ladies-Brand-Organic-Jasmine-Rice/89525,$11.99,400+ Sold,$2.39/lb,Three Ladies Brand Organic Jasmine Rice,(12),Thailand,3 Ladies
Tiger Sugar Chocolate Crispy Rice Ball 200 g,https://www.sayweee.com/en/product/Tiger-Sugar-Chocolate-Crispy-Rice-Ball/48064,$4.29,400+ Sold,,Tiger Sugar Chocolate Crispy Rice Ball,(5),Taiwan,Tiger Sugar
"YunPinXian Yunnan Rice Noodles, Spicy Mushroom Flavor 7.76 oz",https://www.sayweee.com/en/product/YunPinXian-Yunnan-Rice-Noodles--Spicy-Mushroom-Flavor/48466,$3.49,400+ Sold,$0.44/oz,"YunPinXian Yunnan Rice Noodles, Spicy Mushroom Flavor",(4),Mainland China,
Imperial Taste Hsinchu Rice Noodles 14 oz,https://www.sayweee.com/en/product/Imperial-Taste-Hsinchu-Rice-Noodles/7579,$2.79,400+ Sold,$0.19/oz,Imperial Taste Hsinchu Rice Noodles,(221),Taiwan,Imperial Taste
Jia Liu Liu Zhou Spicy Rice Noodle 260 g,https://www.sayweee.com/en/product/Jia-Liu-Liu-Zhou-Spicy-Rice-Noodle/32858,$3.49,400+ Sold,,Jia Liu Liu Zhou Spicy Rice Noodle,(27),Mainland China,
Surasang Instant Rice Cake Soup 177 g,https://www.sayweee.com/en/product/Surasang-Instant-Rice-Cake-Soup/98580,$2.49,400+ Sold,,Surasang Instant Rice Cake Soup,(16),South Korea,Surasang
"Master Lee  Fried Rice with Spicy Crayfish, Frozen 330 g",https://www.sayweee.com/en/product/Master-Lee--Fried-Rice-with-Spicy-Crayfish--Frozen/20987,$4.79,400+ Sold,,"Master Lee  Fried Rice with Spicy Crayfish, Frozen",(14),Mainland China,
WFZ Frozen 8 Flavor Gluten Rice  200 g,https://www.sayweee.com/en/product/WFZ-Frozen-8-Flavor-Gluten-Rice-/95690,$2.99,400+ Sold,,WFZ Frozen 8 Flavor Gluten Rice,(6),Mainland China,
Ottogi Cooked White Rice 12pk 1 case,https://www.sayweee.com/en/product/Ottogi-Cooked-White-Rice-12pk/82771,$14.99,300+ Sold,$14.99/case,Ottogi Cooked White Rice 12pk,(1),South Korea,Ottogi
Surasang 88 Seoul Topokki Rice Cake with Soup 170 g,https://www.sayweee.com/en/product/Surasang-88-Seoul-Topokki-Rice-Cake-with-Soup/40993,$4.99,300+ Sold,,Surasang 88 Seoul Topokki Rice Cake with Soup,(1),South Korea,Surasang
Yinlu Mixed Black Rice Congee 280 g,https://www.sayweee.com/en/product/Yinlu-Mixed-Black-Rice-Congee/30035,$2.39,300+ Sold,,Yinlu Mixed Black Rice Congee,(6),Mainland China,
Lee Kum Kee Seasoned Rice Vinegar 16.9 oz,https://www.sayweee.com/en/product/Lee-Kum-Kee-Seasoned-Rice-Vinegar/15443,$2.49,300+ Sold,$0.14/oz,Lee Kum Kee Seasoned Rice Vinegar,(78),Mainland China,Lee Kum Kee
Synear Flower Jasmine Rice Dumplings 240 g,https://www.sayweee.com/en/product/Synear-Flower-Jasmine-Rice-Dumplings/45487,$5.39,300+ Sold,,Synear Flower Jasmine Rice Dumplings,(38),Mainland China,Synear
"88 Korean Spicy Rice Cakes, Old-Fashioned Flavor 560 g",https://www.sayweee.com/en/product/88-Korean-Spicy-Rice-Cakes--Old-Fashioned-Flavor/1527,$5.39,300+ Sold,,"88 Korean Spicy Rice Cakes, Old-Fashioned Flavor",(188),South Korea,
Mogami 8-Blend Whole Grain Rice 5 lb,https://www.sayweee.com/en/product/Mogami-8Blend-Whole-Grain-Rice/2201,$20.99,300+ Sold,$4.19/lb,Mogami 8-Blend Whole Grain Rice,(190),United States,Mogami
Sukoyaka Genmai Whole Grain Brown Rice 15 lb,https://www.sayweee.com/en/product/Sukoyaka-Genmai-Whole-Grain-Brown-Rice/1495,$28.99,300+ Sold,$1.93/lb,Sukoyaka Genmai Whole Grain Brown Rice,(56),United States,
Nature's Soy Fresh Rice Noodles 454 g,https://www.sayweee.com/en/product/Natures-Soy-Fresh-Rice-Noodles/74731,$1.69,300+ Sold,,Nature's Soy Fresh Rice Noodles,(75),United States,Nature's Soy
Three Ladies (XL) Rice Stick Banh Pho Viet Mien Luo 14 oz,https://www.sayweee.com/en/product/Three-Ladies--XL--Rice-Stick-Banh-Pho-Viet-Mien-Luo/3665,$1.99,300+ Sold,$0.14/oz,Three Ladies (XL) Rice Stick Banh Pho Viet Mien Luo,(2),Vietnam,Three Ladies
Wen Zhou Rice Noodle 400 g,https://www.sayweee.com/en/product/Wen-Zhou-Rice-Noodle/21795,$1.89,300+ Sold,,Wen Zhou Rice Noodle,(23),Mainland China,
WanHe Rice Noodle with Sesame Paste Soup Base  220 g,https://www.sayweee.com/en/product/WanHe-Rice-Noodle-with-Sesame-Paste-Soup-Base-/14808,$3.79,300+ Sold,,WanHe Rice Noodle with Sesame Paste Soup Base,(5),Mainland China,
Qiao Jia Zha Mint Rice Cake 4PC Frozen 360 g,https://www.sayweee.com/en/product/Qiao-Jia-Zha-Mint-Rice-Cake-4PC-Frozen/55208,$4.49,300+ Sold,,Qiao Jia Zha Mint Rice Cake 4PC Frozen,(3),United States,
Tamaki Kenko Haiga Short Grain Rice 15 lb,https://www.sayweee.com/en/product/Tamaki-Kenko-Haiga-Short-Grain-Rice/91936,$36.99,300+ Sold,$2.46/lb,Tamaki Kenko Haiga Short Grain Rice,(76),United States,Tamaki
