Product_Name,Brand,Price,Reviews,Origin,Rate,Platform,Category,Sold_Weekly,Sold_Monthly,Weekly_Revenue
Melaleuca Crispy Roll A (Flavors: Original Sesame Chocolate) 288g,lien haw foods,25.64,0,Taiwan,,Yami,Chocolate,400,1600,10256
Lake Salt Milk Candy 75g,uha,4.95,0,Japan,,Yami,Chocolate,400,1600,1980
Soda Flavor Gummy 40g,uha,1.65,0,Japan,,Yami,Chocolate,400,1600,660
Taiwan Chocolate Pinapple Cake 180g 9pcs,ching tse,23.74,1,Taiwan,3,Yami,Chocolate,25,100,593.5
FUJI Strawberry Cheese Cake Flavor Chocolate Wafer 8pc,kit kat,16.5,1,United States,5,Yami,Chocolate,400,1600,6600
HOKKAIDO Limited White Chocolate Marshmallow 85g,royce,14.9,1,Japan,3,Yami,Chocolate,400,1600,5960
Plain and Chocolate Baum Bar 12pc,tokyo campanella,22.5,1,Japan,3,Yami,Chocolate,400,1600,9000
Almond Sakura Chocolate 190g,royce,22.9,0,Japan,,Yami,Chocolate,400,1600,9160
Strawberry Macaroons 6pc,royce,21.99,0,Japan,,Yami,Chocolate,400,1600,8796
CoFANCY Chocolate Collection Daily Colored Contacts (10pcs/box) #Berry Brown-3.75,cofancy,21.99,0,Mainland China,,Yami,Chocolate,25,100,549.75
CoFANCY Chocolate Collection Daily Colored Contacts (10pcs/box) #Berry Brown-3.50,cofancy,21.99,0,Mainland China,,Yami,Chocolate,25,100,549.75
CoFANCY Chocolate Collection Daily Colored Contacts (10pcs/box) #Berry Brown-3.25,cofancy,21.99,0,Mainland China,,Yami,Chocolate,25,100,549.75
CoFANCY Chocolate Collection Daily Colored Contacts (10pcs/box) #Berry Brown-3.00,cofancy,21.99,0,Mainland China,,Yami,Chocolate,25,100,549.75
CoFANCY Chocolate Collection Daily Colored Contacts (10pcs/box) #Berry Brown-2.75,cofancy,21.99,0,Mainland China,,Yami,Chocolate,25,100,549.75
CoFANCY Chocolate Collection Daily Colored Contacts (10pcs/box) #Berry Brown-2.50,cofancy,21.99,0,Mainland China,,Yami,Chocolate,25,100,549.75
CoFANCY Chocolate Collection Daily Colored Contacts (10pcs/box) #Berry Brown-2.25,cofancy,21.99,0,Mainland China,,Yami,Chocolate,25,100,549.75
CoFANCY Chocolate Collection Daily Colored Contacts (10pcs/box) #Berry Brown-2.00,cofancy,21.99,0,Mainland China,,Yami,Chocolate,25,100,549.75
CoFANCY Chocolate Collection Daily Colored Contacts (10pcs/box) #Berry Brown-1.75,cofancy,21.99,0,Mainland China,,Yami,Chocolate,25,100,549.75
Red and White Strawberry Chocolate 6pc,tirol,3.85,0,Japan,,Yami,Chocolate,400,1600,1540
Herbal Candy Tangerine-Lemon 20g,nin jiom,3.99,0,Hong Kong,,Yami,Chocolate,400,1600,1596
Herbal Candy Super Mint 20g,nin jiom,3.99,0,Hong Kong,,Yami,Chocolate,400,1600,1596
Moshi Orange Jam Filled Marshmallow 80g,cvmallow,3.99,0,Malaysia,,Yami,Chocolate,25,100,99.75
Moshi Strawberry Jam Filled Marshmallow 80g,cvmallow,3.99,0,Malaysia,,Yami,Chocolate,25,100,99.75
Chocolate with Dots and Flavour Condom 3pcs,durex,7.99,0,United States,,Yami,Chocolate,200,800,1598
MUM'S Bake Wafer Qube Chocolate Cream 100g,cocoland,6.39,0,Malaysia,,Yami,Chocolate,25,100,159.75
Mint Pastille Licorice Flavor 38g,cocoland,3.19,0,Malaysia,,Yami,Chocolate,400,1600,1276
Scott's DHA Gummies Mix Flavour 15pcs,cocoland,7.99,0,Malaysia,,Yami,Chocolate,25,100,199.75
SCOTT'S DHA Gummies Blackcurrant 15pcs,cocoland,7.99,0,Malaysia,,Yami,Chocolate,25,100,199.75
SCOTT'S Blackcurrant Flavour Vitamin C Pastilles 30g,cocoland,7.99,0,Malaysia,,Yami,Chocolate,25,100,199.75
SCOTT'S Peach Flavour Vitamin C Pastilles 30g,cocoland,6.39,0,Malaysia,,Yami,Chocolate,25,100,159.75
SCOTT'S Mango Flavour Vitamin C Pastilles 30g,cocoland,6.39,0,Malaysia,,Yami,Chocolate,25,100,159.75
LOT 100 Tamarind Pastilles with Vitamin C 38g,cocoland,2.39,0,Malaysia,,Yami,Chocolate,400,1600,956
LIESE PRETTIA Bubble Hair Dye Dark Chocolate 1set @Cosme Award No.1,kao,13.99,0,Japan,,Yami,Chocolate,400,1600,5596
CoFANCY Chocolate Collection Daily Colored Contacts (10pcs/box) #Berry Brown-0.00,cofancy,21.99,0,Mainland China,,Yami,Chocolate,25,100,549.75
Hinamatsuri -Flower Candy Bag 70g,hananoya,10.49,0,Japan,,Yami,Chocolate,400,1600,4196
Almond Nougat-Soft Assortment 454g,golden bonbon,19.99,0,Canada,,Yami,Chocolate,400,1600,7996
Soft Almond Nougat-Blue box 200g,golden bonbon,11.49,0,Canada,,Yami,Chocolate,400,1600,4596
Soft Almond Nougat-Salty Caramel 200g,golden bonbon,11.49,0,Canada,,Yami,Chocolate,400,1600,4596
Max Lozenges 16pcs,huangfeihong,11.19,0,Mainland China,,Yami,Chocolate,400,1600,4476
Max Chocolate Hazelnut Cream Wafer 145g,a1,6.39,0,Malaysia,,Yami,Chocolate,300,1200,1917
Mocca Shots Caffein Gummies Dark Chocolate Orange Mocca Shots (12-Pack),seattle gummy company,36,0,United States,,Yami,Chocolate,400,1600,14400
Mocca Shots Caffein Gummies Dark Chocolate Raspberry Mocca Shots (12-Pack),seattle gummy company,36,0,United States,,Yami,Chocolate,400,1600,14400
Mocca Shots Caffein Gummies Dutch Chocolate Mocca Shots (12-Pack),seattle gummy company,36,0,United States,,Yami,Chocolate,400,1600,14400
Mocca Shots Caffein Gummies Salted Caramel Chocolate Mocca Shots (12-Pack),seattle gummy company,36,0,United States,,Yami,Chocolate,400,1600,14400
Mocca Shots Caffein Gummies Mint Chocolate Mocca Shots (12-Pack),seattle gummy company,36,0,United States,,Yami,Chocolate,400,1600,14400
Maple Chocolate cake 8pc,maple mania,33.5,0,Japan,,Yami,Chocolate,400,1600,13400
Kokoo 3 In 1 Chocolate Drink With Hazelnut 12pcs,huangfeihong,15.99,0,Mainland China,,Yami,Chocolate,400,1600,6396
Marshies Marshmallows Chocolate Singles 24pcs,markenburg,3.99,0,Malaysia,,Yami,Chocolate,400,1600,1596
Marshmallow Orange Jam 70g,ego,3.99,0,Malaysia,,Yami,Chocolate,200,800,798
Marshmallow With Chocolate Flavour Filling 100g,ego,3.19,0,Malaysia,,Yami,Chocolate,200,800,638
Chocolate Corn Snack 30g,cosmos,4.79,0,Korea,,Yami,Chocolate,400,1600,1916
Rich Chocolate Popcorn 200g,sumo's gourmet popcorn,13.59,0,Malaysia,,Yami,Chocolate,400,1600,5436
Taiping Hor Ka Sai Coffee Mix Chocolate Malt Non-Diary Creamer & Sugar 400g,happy tree 55,19.99,0,Malaysia,,Yami,Chocolate,400,1600,7996
Caramelized Milk + Salt Chocolate  Milk Candy 80g,uha,4.88,0,Japan,,Yami,Chocolate,400,1600,1952
Perfect Multi Eyes Shadow Palette 01 Rose Chocolate 1pc,canmake,14.28,0,Japan,,Yami,Chocolate,400,1600,5712
Nuts Chocolate Roasted Bread 5pc,gateau festa harada,19.9,0,Japan,,Yami,Chocolate,400,1600,7960
2022Valentine?€?s Day Limited Edition Chocolate Cookies 5pc,godiva,26.8,0,Belgium,,Yami,Chocolate,400,1600,10720
MELTKISS mont Blanc Chocolate 56g,meiji,5.89,1,Japan,5,Yami,Chocolate,400,1600,2356
Lucky Candy 368g,garden,4.68,4,Hong Kong,5,Yami,Chocolate,400,1600,1872
JAPAN MORINAKA  Chocolate 44pc,morinaga,4.5,0,Japan,,Yami,Chocolate,400,1600,1800
JAPAN Toffee 80g,fujiya,4.5,1,Japan,5,Yami,Chocolate,400,1600,1800
JAPAN KIT KAT Strawberry Milk Chocolate wafer 11pc,nestle,6,2,Japan,3.5,Yami,Chocolate,400,1600,2400
JAPAN KIT KAT Black Cocoa Chocolate wafer 14pc,nestle,5.9,0,Japan,,Yami,Chocolate,400,1600,2360
JAPAN HOKKAIDO MATCHA Chocolate Wafer 6pc,royce,15.9,1,Japan,5,Yami,Chocolate,400,1600,6360
JAPAN HOKKAIDO Hazelnut Chocolate Wafer 6pc,royce,15.9,0,Japan,,Yami,Chocolate,400,1600,6360
JAPAN HOKKAIDO Chocolate Champagne 20pc,royce,18.99,2,Japan,5,Yami,Chocolate,400,1600,7596
JAPAN KIT KAT Strawberry Milk Chocolate wafer 11pc,nestle,6,2,Japan,3.5,Yami,Chocolate,400,1600,2400
JAPAN KIT KAT Black Cocoa Chocolate wafer 14pc,nestle,5.9,0,Japan,,Yami,Chocolate,400,1600,2360
JAPAN HOKKAIDO MATCHA Chocolate Wafer 6pc,royce,15.9,1,Japan,5,Yami,Chocolate,400,1600,6360
JAPAN HOKKAIDO Hazelnut Chocolate Wafer 6pc,royce,15.9,0,Japan,,Yami,Chocolate,400,1600,6360
JAPAN HOKKAIDO Chocolate Tiramisu 20pc,royce,18.99,4,Japan,5,Yami,Chocolate,400,1600,7596
JAPAN HOKKAIDO Fruit Chocolate Wafer 6pc,royce,15.9,0,Japan,,Yami,Chocolate,400,1600,6360
JAPAN ICHIGO CANDY 81g,senjaku,2.88,0,Japan,,Yami,Chocolate,400,1600,1152
White Chocolate Cheese Buton Cookies 25pc,royce,19.9,0,Japan,,Yami,Chocolate,400,1600,7960
"Almond Nougat , Assrt Gft Box 249g",golden bonbon,12.99,0,Canada,,Yami,Chocolate,400,1600,5196
Chocolate Chip Cookie 99g,bourbon,2.49,9,Japan,4.7,Yami,Chocolate,400,1600,996
White Chocolate Biscuit Vanilla Flavor 55g,bourbon,2.99,8,Japan,4.8,Yami,Chocolate,400,1600,1196
JAPAN HOKKAIDO Chocolate BLACK 20pc,royce,18.99,4,Japan,5,Yami,Chocolate,400,1600,7596
JAPAN HOKKAIDO Chocolate Whiskey 20pc,royce,18.99,0,Japan,,Yami,Chocolate,400,1600,7596
JAPAN HOKKAIDO Chocolate MILK 20pc,royce,18.99,7,Japan,4.6,Yami,Chocolate,400,1600,7596
JAPAN KIT KAT Matcha Chocolate wafer 12pc,nestle,5.9,3,Japan,4.7,Yami,Chocolate,400,1600,2360
LYFEN Popping Candy Mylikes Milk Chocolate 50g,yifen,4.99,0,Mainland China,,Yami,Chocolate,400,1600,1996
JAPAN UME CANDY 110g,ribon,3.98,1,Japan,5,Yami,Chocolate,400,1600,1592
Disney fruit soda flavor lollipop 1pcs,popcan,0.99,82,Japan,4.9,Yami,Chocolate,400,1600,396
Ink Color Cara 08 Pink Chocolate 7g,peripera,8,0,Korea,,Yami,Chocolate,400,1600,3200
HOKKAIDO Corn Chocolate Bars 10pc,hori,9.9,0,Japan,,Yami,Chocolate,400,1600,3960
JAPAN LOTTE KOARA&MARCH WITH Cheese White chocolate 48g,lotte korea,3.8,0,Korea,,Yami,Chocolate,400,1600,1520
JAPAN TOKYO CHRISTMAS CHOCOLATE 11each,morozoff,15.5,2,Japan,4.5,Yami,Chocolate,400,1600,6200
JAPAN TOKYO CHOCOLATE 15each,morozoff,17.5,0,Japan,,Yami,Chocolate,400,1600,7000
JAPAN TOKYO CHOCOLATE COOKIES 12pc,morozoff,19.8,0,Japan,,Yami,Chocolate,400,1600,7920
Pineapple Slices 100g,bestore,5.99,0,Mainland China,,Yami,Chocolate,200,800,1198
Milk Chocolate Digestive Cookie 3.56oz,bourbon,2.69,75,Japan,4.9,Yami,Chocolate,400,1600,1076
ELISE Rich Black and White Chocolate Wafer Rolls 44pcs 5.57oz,bourbon,4.99,7,Japan,4.9,Yami,Chocolate,400,1600,1996
JAPAN Strawberry 58g,kabaya,2.85,2,Japan,5,Yami,Chocolate,400,1600,1140
DISNEY Chocolate Cake 8pc,tokyo banana,26,2,Japan,5,Yami,Chocolate,400,1600,10400
JAPAN CHOCOLATE 8pc,quolofune,26.8,0,Japan,,Yami,Chocolate,400,1600,10720
Wafer Roll Chocolate 400g,healthful,14.99,2,Taiwan,5,Yami,Chocolate,400,1600,5996
JUNE 1ST Egg Roll (Chocolate) 320g,lien haw foods,31.34,1,Taiwan,5,Yami,Chocolate,400,1600,12536
JAPAN GIANT CAPLICO CHOCOLATE 34g,glico,2.9,1,Japan,5,Yami,Chocolate,400,1600,1160
Hi-chew 3 Flavor Soft Candy 94g,morinaga,3.98,1,Japan,4,Yami,Chocolate,400,1600,1592
JAPAN Milk Candy High Concentrate 8.2 Creamy Hard candies 88g,uha,3.5,0,Japan,,Yami,Chocolate,400,1600,1400
JAPAN KIT KAT Strawberry Chocolate wafer 12pc,nestle,5.9,1,Japan,5,Yami,Chocolate,400,1600,2360
Fruit Candy Cola Flavor  Limited 40g,uha,1.6,1,Japan,5,Yami,Chocolate,400,1600,640
Crispy Peanut Candy - Peanut Butter Coconut - All Natural Low Sugar High Protein - 120g,numa,4.49,2,United States,4.5,Yami,Chocolate,400,1600,1796
Crispy Peanut Candy - Original Peanut Butter - All Natural Low Sugar High Protein - 120g,numa,4.49,0,United States,,Yami,Chocolate,400,1600,1796
HONEY MUSEUN Herbal Propolis Lozenger 30g,lien haw foods,6.64,0,Taiwan,,Yami,Chocolate,400,1600,2656
Noir Crunch Chocolate Mini Almond Flavor 32g,ybc,1.99,3,Japan,4,Yami,Chocolate,400,1600,796
YBC Noir Crunch Chocolate Vanilla Flavor 35g,yamazaki,1.99,4,Japan,4.8,Yami,Chocolate,400,1600,796
Candy with Strawberry filling 70g,pine,2.99,2,Japan,4.5,Yami,Chocolate,400,1600,1196
"Alfort Mini Chocolate Rich Mruku, 54g",bourbon,1.99,11,Japan,4.8,Yami,Chocolate,400,1600,796
JAPAN Sesame Chocolate cake 8pc,ginza tamaya,19.99,6,Japan,4.7,Yami,Chocolate,400,1600,7996
JAPAN Chocolate Brownie cake 5pc,ginza tamaya,18.5,0,Japan,,Yami,Chocolate,400,1600,7400
JAPAN Chocolate Cookies 10pc,tokyo milk cheese factory,14.5,2,Japan,4,Yami,Chocolate,400,1600,5800
KIT KAT Chocolate Wafer Bars Heavy Matcha Flavor 13pc,nestle,7.99,0,Japan,,Yami,Chocolate,400,1600,3196
Chocolate Mascarpone Cookies 10pc,tokyo milk cheese factory,13.98,2,Japan,5,Yami,Chocolate,400,1600,5592
TAINAN ONLY I-MEI Fruit Gummy Candy (Grape) 50g,lien haw foods,3.79,0,Taiwan,,Yami,Chocolate,400,1600,1516
Lake Salt Milk Candy 105g,uha,3.59,1,Japan,5,Yami,Chocolate,400,1600,1436
JAPAN HOKKADO Rum Raisin chocolate Corn Stick 10pc,hokkaido,9.99,1,Japan,5,Yami,Chocolate,400,1600,3996
JAPAN HOKKADO Milk chocolate Corn Stick 10pc,hokkaido,9.99,0,Japan,,Yami,Chocolate,400,1600,3996
JAPAN HOKKADO White chocolate Corn Stick 10pc,hokkaido,9.99,1,Japan,5,Yami,Chocolate,400,1600,3996
JAPAN HOKKADO Milk chocolate 17pc,hokkaido,15.9,0,Japan,,Yami,Chocolate,400,1600,6360
JAPAN HOKKADO White chocolate 18pc,hokkaido,15.9,1,Japan,5,Yami,Chocolate,400,1600,6360
LOTTE COFFE BRANDY CHOCOLATE 10pc,lotte korea,5.99,0,Korea,,Yami,Chocolate,400,1600,2396
LOTTE COGNAC BRANDY CHOCOLATE 10pc,lotte korea,5.49,0,Korea,,Yami,Chocolate,400,1600,2196
LOTTE RUMRAISINS CHOCOLATE 10pc,lotte korea,5.49,1,Korea,5,Yami,Chocolate,400,1600,2196
JAPAN KIT KAT CHEESE CAKE Chocolate wafer 9pc,nestle,6,2,Japan,4.5,Yami,Chocolate,400,1600,2400
JAPAN LOTTE SASHA Chocolate 69g,lotte korea,4.99,0,Korea,,Yami,Chocolate,400,1600,1996
JAPAN POCKY Strawberry Chocolate Biscuit Sticks 58g,glico,3.5,0,Japan,,Yami,Chocolate,400,1600,1400
JAPAN ISHIYA White Chocolate Cookies 36pc and Black Chocolate cookies 18pc total 54pc,ishiya seika,91.9,0,Japan,,Yami,Chocolate,400,1600,36760
JAPAN ISHIYA White Chocolate Cookies 27pc and Black Chocolate cookies 9pc total 36pc,ishiya seika,53.9,1,Japan,5,Yami,Chocolate,400,1600,21560
JAPAN ISHIYA White Chocolate Cookies 27pc,ishiya seika,39.9,7,Japan,5,Yami,Chocolate,400,1600,15960
JAPAN ISHIYA Black Chocolate Cookies 18pc,ishiya seika,25.9,1,Japan,5,Yami,Chocolate,400,1600,10360
JAPAN ISHIYA White Chocolate Cookies 18pc,ishiya seika,25.9,3,Japan,4.7,Yami,Chocolate,400,1600,10360
JAPAN ISHIYA White Chocolate Cookies 12pc,ishiya seika,16.99,4,Japan,5,Yami,Chocolate,400,1600,6796
GLICOl Pocky Chocolate Tasty,glico,2.8,0,Japan,,Yami,Chocolate,400,1600,1120
SLIM UP SLIM SUPERFOOD SHAKE DIETSUPPORT CHOCOLATE LATTE 360g,asahi,28,0,Japan,,Yami,Chocolate,300,1200,8400
ISHIYA GINZA Hazelnut Chocolate Cookies 12pc,ishiya seika,25.99,0,Japan,,Yami,Chocolate,400,1600,10396
ISHIYA GINZA High Milk Chocolate Cookies 12pc,ishiya seika,25.99,0,Japan,,Yami,Chocolate,400,1600,10396
ISHIYA GINZA HOKKAIDO Cheese Chocolate Cookies 12pc,ishiya seika,25.99,0,Japan,,Yami,Chocolate,400,1600,10396
ISHIYA GINZA HOKKAIDO Wine Chocolate Cookies 12pc,ishiya seika,25.99,1,Japan,5,Yami,Chocolate,400,1600,10396
ISHIYA GINZA Caramel Chocolate Cookies 12pc,ishiya seika,25.99,0,Japan,,Yami,Chocolate,400,1600,10396
ISHIYA GINZA White Chocolate Egg Roll 8pc,ishiya seika,16.99,0,Japan,,Yami,Chocolate,400,1600,6796
ISHIYA GINZA Milk Chocolate Egg Roll 8pc,ishiya seika,16.99,0,Japan,,Yami,Chocolate,400,1600,6796
Raisin Rum Chocolate 80g,meiji,4.69,3,Japan,5,Yami,Chocolate,400,1600,1876
JAPAN MELTYKISS Premium chocolate Raisin Rum 80g,meiji,4.5,5,Japan,4.8,Yami,Chocolate,400,1600,1800
JAPAN MELTYKISS Premium chocolate Brandy Orange 80g,meiji,4.5,2,Japan,5,Yami,Chocolate,400,1600,1800
Lucido-L Creamy Milk Hair Color Chocolate Ganache 1pcs,mandom,15.99,0,Japan,,Yami,Chocolate,400,1600,6396
Calorie Mate Block Balanced Food Chocolate Flavor 80g,otsuka,2.95,1,Japan,5,Yami,Chocolate,400,1600,1180
Chocolate Flavoured Sweetened Dairy Creamer 180g,f&n,15.99,0,Singapore,,Yami,Chocolate,200,800,3198
Crunch Milk Candy 51.2g,fujiya,2.29,18,Japan,4.7,Yami,Chocolate,400,1600,916
Peko Milk Candy 54g,fujiya,2.39,13,Japan,4.4,Yami,Chocolate,400,1600,956
JAPAN Chocolate Brazil 50g,meiji,4.9,0,Japan,,Yami,Chocolate,400,1600,1960
JAPAN Chocolate PERU 50g,meiji,4.9,0,Japan,,Yami,Chocolate,400,1600,1960
JAPAN Chocolate Venezuela 50g,meiji,4.9,0,Japan,,Yami,Chocolate,400,1600,1960
JAPAN Chocolate Dominican Republic 50g,meiji,4.9,0,Japan,,Yami,Chocolate,400,1600,1960
JAPAN ISHIYA Macha Milk Chocolate 12pc,ishiya seika,25.9,2,Japan,5,Yami,Chocolate,400,1600,10360
JAPAN ISHIYA Gianduja Chocolate 12pc,ishiya seika,25.9,0,Japan,,Yami,Chocolate,400,1600,10360
JAPAN ISHIYA Hokkaido Cheese Chocolate 12pc,ishiya seika,25.9,1,Japan,4,Yami,Chocolate,400,1600,10360
JAPAN ISHIYA Hokkaido Wine Chocolate 12pc,ishiya seika,25.9,1,Japan,3,Yami,Chocolate,400,1600,10360
JAPAN ISHIYA Caramel Chocolate 12pc,ishiya seika,25.9,0,Japan,,Yami,Chocolate,400,1600,10360
JAPAN ISHIYA Milk Chocolate 12pc,ishiya seika,25.99,0,Japan,,Yami,Chocolate,400,1600,10396
PARLOUR Chocolate Sand 8pc,shiseido,19.9,0,Japan,,Yami,Chocolate,400,1600,7960
PURE Vitamin C Gummy Grape Flavor 56g,kanro,2.2,0,Japan,,Yami,Chocolate,400,1600,880
Pure Gummy Candy Lemon Flavor 56g,kanro,2.2,0,Japan,,Yami,Chocolate,400,1600,880
Pure Gummy Candy Grape Flavor 56g,kanro,2.2,0,Japan,,Yami,Chocolate,400,1600,880
JAPAN Chocolate Cookies 15pc,glico,4.96,2,Japan,5,Yami,Chocolate,400,1600,1984
JAPAN Strawberry White Chocolate Milfille 8pc,francais,19.9,1,Japan,4,Yami,Chocolate,400,1600,7960
Chocolate Cookies 20pc,antenor,24.59,0,Japan,,Yami,Chocolate,300,1200,7377
Golden Chocolate Roast Bread,gateau festa harada,20.9,0,Japan,,Yami,Chocolate,400,1600,8360
Chocolate Hi Milk 50g,meiji,1.59,14,Japan,4.6,Yami,Chocolate,400,1600,636
Chocolate Melty Blend Hazelnut 2.11oz,meiji,3.59,69,Japan,4.9,Yami,Chocolate,400,1600,1436
Chocolate Caramel Cake 3pc,gateau festa harada,11.98,0,Japan,,Yami,Chocolate,400,1600,4792
Double Chocolate Roast Bread 5pc,gateau festa harada,21.99,0,Japan,,Yami,Chocolate,400,1600,8796
Chocolate Caramel Cake 3pc,gateau festa harada,16.99,0,Japan,,Yami,Chocolate,400,1600,6796
Low Sugar Crystallized Ginger 100g - Chewy / No Pungency / 100% Nature,nestlady,9.9,5,United States,5,Yami,Chocolate,400,1600,3960
KUKKIA Whipped Chocolate Sandwiched with Cookie,akaibohshi,6.49,5,Japan,4.6,Yami,Chocolate,300,1200,1947
Akai Bohshi Coconut Chocolate Sandwich 18pc 470g,akaibohshi,17.99,3,Japan,5,Yami,Chocolate,300,1200,5397
JAPAN Takaoka Original Nama Chocolate 172g,meiji,13.88,2,Japan,5,Yami,Chocolate,400,1600,5552
JAPAN Takaoka Nama Caramel Chocolate 165g,meiji,13.88,1,Japan,5,Yami,Chocolate,400,1600,5552
JAPAN Takaoka Nama White Chocolate 165g,meiji,13.88,1,Japan,5,Yami,Chocolate,400,1600,5552
JAPAN TAKENOKO CHOCOLATE COOKIES 61g,meiji,3.98,0,Japan,,Yami,Chocolate,400,1600,1592
Hand Made Lollipop Fruit Flavor 35g,bestore,3.99,1,Mainland China,5,Yami,Chocolate,200,800,798
Hand Made Flower Candy 40g,bestore,2.99,1,Mainland China,5,Yami,Chocolate,200,800,598
JAPAN GATEAU RUSK CHOCOLATE COOKIES 5piece,gateau festa harada,15,1,Japan,5,Yami,Chocolate,400,1600,6000
Fruit Candy Soda 40g,uha,1.75,0,Japan,,Yami,Chocolate,400,1600,700
Casual Gift Chocolate Biscuit Carre 10pc,yoku moku,18.9,0,Japan,,Yami,Chocolate,400,1600,7560
White Chocolate Rusk 9pc,gateau festa harada,18.8,0,Japan,,Yami,Chocolate,400,1600,7520
JAPAN ORIKO CHOCOLATE 65g,meiji,6.2,2,Japan,5,Yami,Chocolate,400,1600,2480
Tokyo Meishokan 270g,eitaro,23.99,8,Mainland China,4.4,Yami,Chocolate,400,1600,9596
Mixed Flavor Candy 480g,seika foods,13.99,8,Japan,4.4,Yami,Chocolate,400,1600,5596
Baked Matcha Chocolate  Cake 186g,colombin,19.99,8,Japan,4.6,Yami,Chocolate,25,100,499.75
Cookie with Chocolate 210g,colombin,19.99,14,Japan,4.8,Yami,Chocolate,200,800,3998
Throat Refreshing Herbal Drops Mint Original Flavor 80g,ryukakusan,4.7,0,Japan,,Yami,Chocolate,400,1600,1880
Throat Refreshing Herbal Drops Peach Flavor 80g,ryukakusan,4.7,2,Japan,3.5,Yami,Chocolate,400,1600,1880
JAPAN ASADAAME BABY CANDY 30tablet,uha,11.6,0,Japan,,Yami,Chocolate,400,1600,4640
Harajuku Chocolate 297g,colombin,13.5,0,Japan,,Yami,Chocolate,25,100,337.5
Harajuku Baked Chocolate 198g,colombin,10,6,Japan,3.3,Yami,Chocolate,25,100,250
JAPAN HANABATAKEBOKUJO CARAMEL CANDY 45g,hokkaido,10.9,2,Japan,4.5,Yami,Chocolate,400,1600,4360
Raisin Milk Candy 105g,uha,3.59,0,Japan,,Yami,Chocolate,400,1600,1436
JAPAN chocolate Sand 10pc,tokyo campanella,19.9,2,Japan,5,Yami,Chocolate,400,1600,7960
Kit Kat Japanese Uji Koi Dark COCO KitKat Chocolates 135g,nestle,5.2,0,Japan,,Yami,Chocolate,400,1600,2080
JAPAN Candy 32g,kracie,2.2,0,Japan,,Yami,Chocolate,400,1600,880
JAPAN KINOKONOYAMA Original Chocolate Cookies 74g,meiji,2.98,1,Japan,5,Yami,Chocolate,400,1600,1192
Chocolate Koeda Milk 11pc 64.9g,morinaga,3.89,0,Japan,,Yami,Chocolate,400,1600,1556
Frugra Fruit and Granola Cereal Chocolate and Banana 425g,calbee,8.49,31,Japan,4.7,Yami,Chocolate,200,800,1698
JAPAN Milk Caramel Candy 12tablet,morinaga,2.2,0,Japan,,Yami,Chocolate,400,1600,880
JAPAN LOTTE Lactobacillus Milk Chocolate 48g,lotte korea,5.2,3,Korea,5,Yami,Chocolate,400,1600,2080
Kit Kat Japanese Uji Koi Dark Matcha Green Tea KitKat Chocolates 135g,nestle,5.2,0,Japan,,Yami,Chocolate,400,1600,2080
ISHIYA 12pc White Chocolate Cookies and 12pc Black Chocolate Cookies 24pc,ishiya seika,39.18,0,Japan,,Yami,Chocolate,400,1600,15672
ISHIYA 27pc White Chocolate Cookies and 18pc Black Chocolate Cookies  54pc,ishiya seika,92.72,0,Japan,,Yami,Chocolate,400,1600,37088
ISHIYA 27pc White Chocolate Cookies and 9pc Black Chocolate cookies 36pc,ishiya seika,55.97,1,Japan,5,Yami,Chocolate,400,1600,22388
ISHIYA White Chocolate Cookies 18pc,ishiya seika,26.39,2,Japan,3,Yami,Chocolate,400,1600,10556
ISHIYA White Chocolate Cookies 9pc,ishiya seika,14.39,0,Japan,,Yami,Chocolate,400,1600,5756
JAPAN POCKY Almond Chocolate Biscuit Sticks,glico,2.85,2,Japan,5,Yami,Chocolate,400,1600,1140
JAPAN R.L WAFFLE CAKE KOROKORO WAFFLE COOKIE Chocolate 145g,world rhythm,17.5,0,Japan,,Yami,Chocolate,400,1600,7000
JAPAN Seekworther Lozenges 88g,ryukakusan,4.5,0,Japan,,Yami,Chocolate,400,1600,1800
JAPAN Original Lozenges 100g,ryukakusan,4.5,1,Japan,5,Yami,Chocolate,400,1600,1800
JAPAN Lozenges Blueberry 75g,ryukakusan,4.5,0,Japan,,Yami,Chocolate,400,1600,1800
JAPAN Candy 42g,graphico,6.2,1,Japan,4,Yami,Chocolate,400,1600,2480
Chocolate Cracker Sandwich 180g,zess,1.99,1,Mainland China,5,Yami,Chocolate,400,1600,796
JAPAN CHOCOLATE 64g,meiji,4.98,0,Japan,,Yami,Chocolate,400,1600,1992
JAPAN CHOCOLATE 80g,meiji,4.98,1,Japan,5,Yami,Chocolate,400,1600,1992
JAPAN FETTUCCINE JELLY DROPS COLA 50g,bourbon,2.99,0,Japan,,Yami,Chocolate,25,100,74.75
JAPAN POCKY Almond Chocolate Biscuit Sticks 58g,glico,2.99,0,Japan,,Yami,Chocolate,400,1600,1196
JAPAN Black Chocolate 1each,yuraku,1.18,3,Japan,4,Yami,Chocolate,400,1600,472
Choco Kit Jewelry Chocolate Candy 25g,haitai,2.29,22,Korea,4.8,Yami,Chocolate,400,1600,916
Cola Gummy 50g,uha,1.5,10,Japan,4.6,Yami,Chocolate,400,1600,600
ISHIYA SHIROI KOIBITO White Lover White Chocolate Cookies 12pcs,ishiya seika,16.5,0,Japan,,Yami,Chocolate,400,1600,6600
BREATH CARE MINT 50 tablets,kobayashi,6.7,1,Japan,5,Yami,Chocolate,400,1600,2680
BREATH CARE Lemon 50 tablets,kobayashi,6.7,1,Japan,4,Yami,Chocolate,400,1600,2680
JAPAN Apple Gummy 58g,kabaya,2.2,1,Japan,5,Yami,Chocolate,400,1600,880
JAPAN Grape Gummy 58g,kabaya,2.2,6,Japan,5,Yami,Chocolate,400,1600,880
JAPAN Pencil Suger 80,kanro,4.98,1,Japan,5,Yami,Chocolate,400,1600,1992
JAPAN TOUGH Gummy sugar 100g,kabaya,4.99,1,Japan,5,Yami,Chocolate,400,1600,1996
MORNIAGA Salt Caramel Candy 92g,morinaga,5.59,0,Japan,,Yami,Chocolate,400,1600,2236
Choco Variety Pack 27pc In Bag Bis Milk Strawberry Jelly Cookie 176g,tirol,5.88,5,Japan,4.8,Yami,Chocolate,400,1600,2352
Red Bean Milk Candy 105g,uha,4.85,0,Japan,,Yami,Chocolate,400,1600,1940
JAPAN GINZA Jelly Fudge 14pc,rokumeikan,20.9,0,Japan,,Yami,Chocolate,400,1600,8360
JAPAN MACYA CANDY 66g,kanro,4.5,0,Japan,,Yami,Chocolate,400,1600,1800
GINZA SILVER GRAPE Milk Strawberry Chocolate Puffly 10pc,ginza silber grape,25.5,0,Japan,,Yami,Chocolate,400,1600,10200
GINZA SILVER GRAPE Milk Chocolate Puffly 10pc,ginza silber grape,25.5,0,Japan,,Yami,Chocolate,400,1600,10200
Color Flute Roll Chocolate Flavor 40g,master kong,1.49,29,Mainland China,4.8,Yami,Chocolate,400,1600,596
Chocolate Teddy Biscuits 120g,cap ping pong,3.99,0,Malaysia,,Yami,Chocolate,400,1600,1596
77Chocolate Brown Sugar Bubble Tea Ball 40g/bag,lien haw foods,2.84,0,Taiwan,,Yami,Chocolate,400,1600,1136
JAPAN Herbal Throat Candy Stick Pack Lemon 42g,ryukakusan,2.99,0,Japan,,Yami,Chocolate,400,1600,1196
BALANCE POWER BIG Chocolate Brownie 2pc,healthy club,2,2,Japan,3.5,Yami,Chocolate,400,1600,800
Snack Candy Lollipop Present Gift 1pc,glico,0.72,12,Japan,5,Yami,Chocolate,400,1600,288
Gummy Cola Flavor 40g,uha,1.75,0,Japan,,Yami,Chocolate,400,1600,700
MILO Active-Go 3in1 Chocolate Milk Drink 18packs,nestle,19.19,1,Japan,5,Yami,Chocolate,400,1600,7676
MILO Active-Go Chocolate Drink No Sugar 18packs,nestle,19.19,0,Japan,,Yami,Chocolate,400,1600,7676
Mashmallow Chocolate Sand Cookie 6pc,baked mallow,24,3,Japan,5,Yami,Chocolate,100,400,2400
HIYOKO Chocolate Cake 6pc,hiyoko manju,22,1,Japan,5,Yami,Chocolate,400,1600,8800
Silver of Grape Sakura Almond Chocolate Cookies 12pc,ginza silber grape,25.5,2,Japan,5,Yami,Chocolate,400,1600,10200
Party Wafer Chocolate & Milk Flavor 220g,gastone lago,5.29,1,New Zealand,5,Yami,Chocolate,400,1600,2116
Mylikes Milk Chocolate 1pack 25g,liangfeng,1.09,1,Mainland China,5,Yami,Chocolate,400,1600,436
LOTTE Koala Chocolate Cream Filling Biscuit 50g,lotte korea,3.9,1,Korea,5,Yami,Chocolate,400,1600,1560
JAPAN Pop Candy 21pieces,fujiya,5.5,1,Japan,5,Yami,Chocolate,400,1600,2200
Plum Candy 80g,nobel,4.2,3,Japan,5,Yami,Chocolate,400,1600,1680
JAPAN Apple Gummy 45g,kabaya,2,6,Japan,5,Yami,Chocolate,400,1600,800
JAPAN Grape Gummy 45g,kabaya,2,6,Japan,5,Yami,Chocolate,400,1600,800
Pop Candy 21pieces,fujiya,4.98,11,Japan,5,Yami,Chocolate,400,1600,1992
Food Snack Candy Lollipop Present Gift 1pc,glico,0.7,10,Japan,4.9,Yami,Chocolate,400,1600,280
Charcoal Roasted Coffee Candy 200g,nanguo,2.59,17,Mainland China,4.6,Yami,Chocolate,400,1600,1036
JAPAN Milk Caramel Candy 12pc,morinaga,2.5,0,Japan,,Yami,Chocolate,400,1600,1000
JAPAN MINTIA BREEZE Fresh Lemon 30pc,asahi,6.99,0,Japan,,Yami,Chocolate,200,800,1398
JAPAN MINTIA BREEZE Crystal Silver 30pc,asahi,6.99,1,Japan,5,Yami,Chocolate,200,800,1398
Chocolate Wafer Sticks 330g,astor,4.79,2,Indonesia,5,Yami,Chocolate,200,800,958
Pocky Metly Chocolate Cream Biscuit Sticks 131g,glico,4.69,15,Japan,4.6,Yami,Chocolate,400,1600,1876
