Product_Name,Brand,Price,Reviews,Origin,Rate,Platform,Category,Sold_Weekly,Sold_Monthly,Weekly_Revenue
Pocky Almond Chocolate Biscuit Sticks 41g,glico,2.19,290,Japan,4.9,Yami,Chocolate,400,1600,876
Koala Chocolate Cream Filling Biscuit 41g,lotte japan,1.19,142,Japan,4.8,Yami,Chocolate,400,1600,476
Meltyblend Chocolate Premium Cacao 60g,meiji,3.99,135,Japan,4.8,Yami,Chocolate,400,1600,1596
Chocolate Flavored Soy Drink 250ml,vitasoy,0.79,238,Hong Kong,4.7,Yami,Chocolate,400,1600,316
Bun With Chocolate Filling Breadd 75g,d-plus,1.99,26,Japan,4.5,Yami,Chocolate,200,800,398
Pejoy Chocolate Cream Filled Biscuit Sticks 8 Packs 120g,glico,3.59,141,Japan,4.9,Yami,Chocolate,400,1600,1436
UHA Gummy Candy Green Grape Flavor 48g,uha,2.99,80,Japan,4.8,Yami,Chocolate,400,1600,1196
Pocky Matcha Chocolate Biscuit Sticks 70g,glico,1.99,162,Japan,4.7,Yami,Chocolate,400,1600,796
Assorted Peanut Crisp Candy 328g,hsufuchi,6.59,69,Taiwan,4.9,Yami,Chocolate,400,1600,2636
GGE Baked Rice Snack Chocolate Flavor 45g,weilih,1.89,200,Taiwan,4.7,Yami,Chocolate,400,1600,756
Meltyblend Chocolate Fruity Strawberry 60g,meiji,3.99,76,Japan,4.8,Yami,Chocolate,400,1600,1596
Pocky Classic Chocolate Biscuit Sticks Family Pack 9 Packs,glico,3.59,85,Japan,4.8,Yami,Chocolate,400,1600,1436
Meltyblend Green Tea Chocolate 60g,meiji,3.99,108,Japan,4.6,Yami,Chocolate,400,1600,1596
Gummy Candy Orange Flavor 51g,meiji,1.59,27,Japan,4.9,Yami,Chocolate,400,1600,636
Mushroom Chocolate Cookie 74g,meiji,2.99,29,Japan,4.9,Yami,Chocolate,400,1600,1196
Taste Sugar Kololo Grape 40g,uha,2.89,87,Japan,4.5,Yami,Chocolate,400,1600,1156
Pocky Winter Melty Chocolate Flavor Stick 56g,glico,1.99,6,Japan,4.7,Yami,Chocolate,400,1600,796
Milk Chocolate Lollipop,fujiya,1.68,10,Japan,4.6,Yami,Chocolate,400,1600,672
Peko Poko Chocolate Lollipops 0.8oz,fujiya,1.69,16,Japan,4.9,Yami,Chocolate,400,1600,676
Kit Kat Chocolate Wafer Melon Flavor 11pc,nestle,4.19,2,Japan,5,Yami,Chocolate,400,1600,1676
Japanese Kit Kat Cheese Cake Chocolate Wafer 9pc,nestle,6.99,7,Japan,4.9,Yami,Chocolate,400,1600,2796
Japanese Kit Kat Strawberry Chocolate Wafer,nestle,5.99,1,Japan,5,Yami,Chocolate,400,1600,2396
Pocky Super Slender Chocolate Biscuit Sticks 73g  Random version,glico,2.19,143,Japan,4.8,Yami,Chocolate,400,1600,876
Mikakuto Coke Flavored Gummy 40g,uha,2.49,2,Japan,5,Yami,Chocolate,400,1600,996
Chocolate and Milk Cake,gaolegao,11.99,11,Mainland China,5,Yami,Chocolate,400,1600,4796
Gummy Candy Peach Flavor 50g,bourbon,1.99,9,Japan,4.8,Yami,Chocolate,400,1600,796
Japanese Kit Kat Milk Tea Chocolate Wafer 12pc,nestle,6.99,3,Japan,3.7,Yami,Chocolate,400,1600,2796
PEKO Chan Gummy Grape 1.76oz,fujiya,1.69,9,Japan,4.2,Yami,Chocolate,400,1600,676
PEKO Chan Gummy Peach 1.76oz,fujiya,1.69,6,Japan,4.7,Yami,Chocolate,400,1600,676
POCKY Banana Cream Covered Chocolate Biscuit Sticks 70g,glico,1.99,96,Japan,4.7,Yami,Chocolate,400,1600,796
Japanese Kit Kat Matcha Chocolate Wafer 135g,nestle,6.99,203,Japan,4.7,Yami,Chocolate,400,1600,2796
Chocolate Gummy Candy Muscat Flavor 81g,meiji,4.49,49,Japan,4.9,Yami,Chocolate,400,1600,1796
Dark Chocolate 50g,meiji,1.99,47,Japan,4.6,Yami,Chocolate,400,1600,796
Japanese Kit Kat Matcha Chocolate Wafer 12pc,nestle,6.99,1,Japan,5,Yami,Chocolate,400,1600,2796
Milk Chocolate 50g,meiji,1.99,25,Japan,4.5,Yami,Chocolate,400,1600,796
Gummy Candy Grape Flavor 50g,bourbon,1.99,2,Japan,5,Yami,Chocolate,25,100,49.75
Japanese Kit Kat Strawberry Milk Flavor 11pc,nestle,6.99,2,Japan,5,Yami,Chocolate,400,1600,2796
Chocolate Milk 200ml*6,kuang quan,7.99,5,Taiwan,5,Yami,Chocolate,400,1600,3196
Japanese Kit Kat Crepe White Chocolate Wafer,nestle,6.99,1,Japan,5,Yami,Chocolate,400,1600,2796
Jaga Chocolate Potato Chips 40g,bourbon,2.49,17,Japan,4.6,Yami,Chocolate,400,1600,996
Mixed Fruit Flavor Candy with Real Fruit 2.82oz,morinaga,2.19,10,Japan,4.7,Yami,Chocolate,400,1600,876
Chocolate Gummy Candy Mixed Fruits Flavor 81g,meiji,4.49,25,Japan,4.6,Yami,Chocolate,400,1600,1796
Hello Kitty Marshmallow Strawberry Flavor 90g,eiwa,2.69,7,Japan,5,Yami,Chocolate,400,1600,1076
Japanese Kit Kat Pistachio Chocolate Wafer 11pc,nestle,7.99,2,Japan,4,Yami,Chocolate,400,1600,3196
Matcha Chocolate,fujiya,3.49,41,Japan,4.7,Yami,Chocolate,400,1600,1396
Japanese Kit Kat Orange Chocolate Wafer 9pc,nestle,6.99,2,Japan,5,Yami,Chocolate,400,1600,2796
Pocky Classic Chocolate Biscuit Sticks 70g,glico,2.19,33,Japan,5,Yami,Chocolate,400,1600,876
White Chocolate Cookie 78g,bourbon,2.99,17,Japan,4.7,Yami,Chocolate,400,1600,1196
Fettuccine Gummy  Lemon 50g,bourbon,1.89,4,Japan,5,Yami,Chocolate,25,100,47.25
Candy Lollipop Present Gift 1pc,glico,0.75,4,Japan,5,Yami,Chocolate,400,1600,300
Japanese Kit Kat Oat Chocolate Wafer,nestle,6.99,1,Japan,5,Yami,Chocolate,400,1600,2796
Xylitol Alpha Gum Powermint Flavor 86g,lotte korea,4.99,0,Korea,,Yami,Chocolate,400,1600,1996
Japanese Kit Kat Raspberry Chocolate Wafer,nestle,6.99,11,Japan,4.7,Yami,Chocolate,400,1600,2796
Pejoy Cookies & Cream Creamy Vanilla Filled Chocolate Biscuit Sticks 56g,glico,2.09,41,Japan,4.8,Yami,Chocolate,400,1600,836
Hokkaido Milk Candy 120g,fujiya,2.99,33,Japan,4.4,Yami,Chocolate,400,1600,1196
Japanese Kit Kat Crunch Chocolate Mini 82.8g,nestle,5.99,2,Japan,5,Yami,Chocolate,400,1600,2396
KUKKIA Whipped Chocolate Sandwiched with Cookie Gift Box 4 Flavor 20pcs,akaibohshi,11.99,27,Japan,4.8,Yami,Chocolate,200,800,2398
Chocolate Gummy Candy Strawberry Flavor 81g,meiji,4.69,24,Japan,4.7,Yami,Chocolate,400,1600,1876
KIT KAT Macha Latte Chocolate wafer 11pc,nestle,6,0,Japan,,Yami,Chocolate,400,1600,2400
Chocolate Pencil 4pcs 27g,fujiya,1.99,3,Japan,5,Yami,Chocolate,400,1600,796
Snack Candy Lollipop Present Gift 1pc,glico,0.75,1,Japan,5,Yami,Chocolate,400,1600,300
Mikakutang Soda Flavour Soft Candy 40g,uha,2.49,2,Japan,4,Yami,Chocolate,400,1600,996
Fruit Candy Grape Flavor 48g,uha,1.5,36,Japan,4.8,Yami,Chocolate,400,1600,600
Shortbread Cookies Dark Chocolate Yoghurt Flavor 144g,jzjt,6.99,0,Mainland China,,Yami,Chocolate,400,1600,2796
KIT KAT Coffee Chocolate wafer 12pc,nestle,6,0,Japan,,Yami,Chocolate,400,1600,2400
Japanese Kit Kat Cocoa Flavor Wafer,nestle,6.99,0,Japan,5,Yami,Chocolate,400,1600,2796
KUKKIA Whipped Chocolate Sandwiched with Cookie 4 Flavor 48pcs 374g,akaibohshi,27.99,2,Japan,5,Yami,Chocolate,300,1200,8397
MARSHMALLOW HELLO KITTY MANGO 90g,eiwa,2.69,7,Japan,5,Yami,Chocolate,400,1600,1076
Fruit Candy Muscat Flavor  48g,uha,1.5,27,Japan,4.7,Yami,Chocolate,400,1600,600
Castella Japanese Style Baked Sponge Cake Chocolate Flavor 7Slices 280g,imuraya,6.99,50,Japan,4.2,Yami,Chocolate,400,1600,2796
Hokkaido Four Season Chocolate Gift Set 40pc,royce,32.99,1,Japan,5,Yami,Chocolate,400,1600,13196
Japanese Kit Kat Mini Chocolate 81g,nestle,5.99,4,Japan,4,Yami,Chocolate,400,1600,2396
GINBIS Animal Biscuits Chocolate Flavor 50g,ginbis,1.19,0,Japan,,Yami,Chocolate,400,1600,476
Creamy Chocolate Biscuits 200g,khong guan,2.69,68,Singapore,4.8,Yami,Chocolate,400,1600,1076
KIT KAT Melon Chocolate wafer 11pc,nestle,6,0,Japan,,Yami,Chocolate,400,1600,2400
Orange Peel Gummy 150g,mushroomstorm,7.59,1,Mainland China,5,Yami,Chocolate,400,1600,3036
MARSHMALLOW HELLO KITTY CHOCOLATE 47g,eiwa,3.29,3,Japan,5,Yami,Chocolate,25,100,82.25
Mini Bit Assorted Chocolate 165g,bourbon,5.69,1,Japan,5,Yami,Chocolate,400,1600,2276
HOKKAIDO OKINAWA Chocolate Mango 20pc,royce,18.99,0,Japan,,Yami,Chocolate,400,1600,7596
Dars White Chocolate Confectionery 42g,morinaga,1.99,63,Japan,4.6,Yami,Chocolate,400,1600,796
Mini Roll Cake Chocolate Flavor 70g,bourbon,2.99,7,Japan,4.6,Yami,Chocolate,400,1600,1196
Precieux white chocolate Covered Lemon Cake 5pcs,chen yun pao chuan,12.99,5,Taiwan,4.6,Yami,Chocolate,25,100,324.75
Quadratini Bite Size Wafer Cookies Chocolate Flavor 250g,loacker,5.29,42,Itlay,4.9,Yami,Chocolate,400,1600,2116
Hi-chew 3 Flavor Soft Candy 100g,morinaga,2.49,22,Japan,4.8,Yami,Chocolate,400,1600,996
Macadami Choco 9pc 60g,meiji,5.49,1,Japan,5,Yami,Chocolate,400,1600,2196
Chocolate Hand Made Buscuit 105g,tianpeng,2.99,41,Taiwan,4.7,Yami,Chocolate,400,1600,1196
Kamu Cola 27g,kabaya,1.69,2,Japan,4,Yami,Chocolate,400,1600,676
HI-CHEW Soft Chewy Fruit Candy Grape 50g,morinaga,1.29,5,Japan,4.8,Yami,Chocolate,400,1600,516
Uji Hojicha Flavor Chocolate Stick 61.6g,morinaga,2.99,2,Japan,4,Yami,Chocolate,400,1600,1196
Nobel Super Soda Candy 84g,nobel,3.29,0,Japan,,Yami,Chocolate,400,1600,1316
Disney fruit soda flavor lollipop 10pcs,popcan,9.99,2,Japan,5,Yami,Chocolate,400,1600,3996
Chocolate Milk 215ml*6,go long,12.99,1,Taiwan,5,Yami,Chocolate,400,1600,5196
Hi-Chew Soft Candy Mixed Berry Flavor 90g,morinaga,2.29,9,Japan,5,Yami,Chocolate,400,1600,916
Bitter Chocolate Pack 42g,morinaga,1.99,0,Japan,,Yami,Chocolate,400,1600,796
KIT KAT Cocoa Chocolate wafer 12pc,nestle,6,1,Japan,5,Yami,Chocolate,400,1600,2400
ROYCE HOKKAIDO Original Flavor Fresh Chocolate 20pc,royce,19.58,1,Japan,5,Yami,Chocolate,400,1600,7832
GuoKui Chocolate Walnut Biscuit 70g,agan,5.99,3,Mainland China,5,Yami,Chocolate,300,1200,1797
Bing Bing Crispy Ice Cream Cone Snack with Chocolate Filling 8pcs 71.2g,hapi,3.89,14,Japan,4.6,Yami,Chocolate,400,1600,1556
Candy Bag Flower Pattern 150g,taiki,3.99,9,Japan,4.7,Yami,Chocolate,400,1600,1596
Napoleon Brandy bonbon,hamada,13.99,2,Japan,5,Yami,Chocolate,400,1600,5596
Pejoy Red Wine Chocolate 126g,glico,6.49,0,Japan,,Yami,Chocolate,400,1600,2596
Pear Paste Lollipop,lao jin mofang,5.99,1,Mainland China,5,Yami,Chocolate,400,1600,2396
BiscuitI Milk And Chocolate Flavor 120g,rimo,3.49,3,Japan,5,Yami,Chocolate,400,1600,1396
HI-CHEW Soft Chewy Fruit Candy Green Apple Flavor 50g,morinaga,1.29,1,Japan,5,Yami,Chocolate,400,1600,516
Chocolate Cream Filling Puff 65g,imei,1.59,111,Taiwan,4.6,Yami,Chocolate,400,1600,636
Cocktail bonbon 96g,hamada,14.99,0,Japan,,Yami,Chocolate,400,1600,5996
Tublo Matcha Azuki  80g,shoei delicy,3.89,1,Japan,5,Yami,Chocolate,400,1600,1556
Strawberry Shake Candy 4.2oz,milkita,2.29,1,Indonesia,5,Yami,Chocolate,400,1600,916
Super Lemon Candy 84g,nobel,3.49,0,Japan,,Yami,Chocolate,400,1600,1396
Marshmallow Pineapple Flavor 90g,eiwa,2.49,1,Japan,5,Yami,Chocolate,25,100,62.25
Filled Crisp White chocolate Flavor 116g,jinyu,2.19,1,Mainland China,5,Yami,Chocolate,400,1600,876
Choco Ball 68g,meiji,3.99,0,Japan,,Yami,Chocolate,400,1600,1596
Lipton Tea Candy 61g,kasugai,3.19,2,Japan,5,Yami,Chocolate,400,1600,1276
Caramel Hard Candy 50g,alpenliebe,4.39,6,Mainland China,5,Yami,Chocolate,300,1200,1317
KITKAT Orange Chocolate wafer 9pc,nestle,6,0,Japan,,Yami,Chocolate,400,1600,2400
Puff Chocolate Flavor 46g,haitai,1.39,4,Korea,4.5,Yami,Chocolate,400,1600,556
Toshitsu 90% Off Nodoame 58g,morinaga,3.49,0,Japan,,Yami,Chocolate,400,1600,1396
ROYCE HOKKAIDO Matcha Flavor Fresh Chocolate 20pc,royce,19.68,1,Japan,5,Yami,Chocolate,400,1600,7872
Coconut Milk With Paw Shape Marshmellow 92g,lrgw,4.39,5,Mainland China,5,Yami,Chocolate,400,1600,1756
Probiotics Soft Candy 50g,seika foods,1.99,2,Japan,5,Yami,Chocolate,400,1600,796
HI-CHEW Soft Chewy Fruit Candy Lemon Flavor 12tablet,morinaga,1.4,0,Japan,,Yami,Chocolate,400,1600,560
Dars Silky Milk Chocolate42g,morinaga,1.99,54,Japan,4.6,Yami,Chocolate,400,1600,796
Milk Cchocolate 120g,meiji,5.29,0,Japan,,Yami,Chocolate,400,1600,2116
AMOS 4D Gummy Blocks 100g,amos,1.49,6,Korea,4.3,Yami,Chocolate,300,1200,447
Extra Concentrated Salted Milk Candy 80g,uha,4.59,3,Japan,5,Yami,Chocolate,400,1600,1836
HI-CHEW Soft Chewy Fruit Candy Green Apple Flavor 12tablet,morinaga,1.4,0,Japan,,Yami,Chocolate,400,1600,560
HI-CHEW Soft Chewy Fruit Candy Strawberry Flavor 12tablet,morinaga,1.4,0,Japan,,Yami,Chocolate,400,1600,560
MARSHMALLOW HELLO KITTY MATCHA 80g,eiwa,3.29,1,Japan,5,Yami,Chocolate,25,100,82.25
Chocolate Mascarpone Cookies 10pc,tokyo milk cheese factory,19.99,10,Japan,4.8,Yami,Chocolate,400,1600,7996
Pear Extract lollipop 100g,mushroomstorm,8.45,3,Mainland China,5,Yami,Chocolate,400,1600,3380
KOALA MINI COOKIE Chocolate Filling 50g,lotte japan,2.09,0,Japan,,Yami,Chocolate,400,1600,836
Panda Chocolate Filling Cookie 57g,meiji,1.19,70,Japan,4.8,Yami,Chocolate,400,1600,476
Alfort Mini Chocolate 12pc 55g,bourbon,2.09,0,Japan,,Yami,Chocolate,25,100,52.25
Gummy Candy Orange Flavor 20g,want want,0.49,0,Taiwan,,Yami,Chocolate,400,1600,196
Soft Candy 2 Soda Flavor 100g,uha,2.89,39,Japan,4.8,Yami,Chocolate,400,1600,1156
Dalgona 20g*3,haitai,3.29,3,Korea,5,Yami,Chocolate,400,1600,1316
Icon Chocolate Sandwich Cookie 42g,fujiya,2.19,1,Japan,5,Yami,Chocolate,400,1600,876
Black Sesame Candy 312g,lejiajia,4.69,27,Mainland China,4.4,Yami,Chocolate,400,1600,1876
Premium Milk Candy Tea Flavor 66g,kanro,3.59,12,Japan,4.7,Yami,Chocolate,400,1600,1436
Strawberry Flavor Chocolate Layer Cake,gaolegao,11.99,12,Mainland China,4.3,Yami,Chocolate,400,1600,4796
Coconut Candy 200g,nanguo,3.29,0,Mainland China,,Yami,Chocolate,400,1600,1316
Black Thunder Chcolate Strawberry Flavor 161g,yuraku,4.89,4,Japan,4.8,Yami,Chocolate,400,1600,1956
Teitoshitsu Milk Chocolate 60g,shoei delicy,2.29,2,Japan,5,Yami,Chocolate,400,1600,916
MOEGINO Chocolate Sandwich Cookie 10pcs 122g,tivoli tivon,8.99,1,Japan,5,Yami,Chocolate,400,1600,3596
Milky Creamy Lollipop Assorted Fruit Flavor 115g,milkita,2.69,10,Indonesia,4.8,Yami,Chocolate,400,1600,1076
JAPAN HOKKAIDO Chocolate SAKURA 20pc,royce,18.99,2,Japan,5,Yami,Chocolate,400,1600,7596
Cheese Chocolat 47g,bourbon,2.39,2,Japan,4,Yami,Chocolate,25,100,59.75
KUKKIA Whipped Chocolate Sandwiched with Cookie 4 Flavor 32pcs,akaibohshi,19.99,21,Japan,4.8,Yami,Chocolate,200,800,3998
Pejoy Chocolate Cream Filled Biscuit Sticks 56g,glico,2.09,32,Japan,4.9,Yami,Chocolate,400,1600,836
Mint Candy Strawberry Flavor  FRODO 15g,kakao friends,3.29,11,Korea,4.9,Yami,Chocolate,400,1600,1316
Alfort Chocolate Cookies 199g,bourbon,4.99,9,Japan,4.8,Yami,Chocolate,400,1600,1996
Pure Gummy Candy Plum 56g,kanro,2.99,0,Japan,,Yami,Chocolate,400,1600,1196
Alphabet Chocolate 39.6g,meito,2.19,2,Japan,4,Yami,Chocolate,400,1600,876
Chocolate Shake Candy 4.2oz,milkita,2.29,0,Indonesia,,Yami,Chocolate,400,1600,916
LIESE PRETTIA Bubble Hair Dye Dark Chocolate 1set @Cosme Award No.1,kao,11.99,0,Japan,4.8,Yami,Chocolate,400,1600,4796
HOKKAIDO OKINAWA Chocolate Brown sugar 20pc,royce,18.99,0,Japan,,Yami,Chocolate,400,1600,7596
Blackcurrant Filling and Dark Chocolate,gastone lago,4.79,3,New Zealand,4.7,Yami,Chocolate,400,1600,1916
4D Mini Fruit Strawberry 72g,kanro,3.29,0,Japan,,Yami,Chocolate,400,1600,1316
Uji Matcha Chocolate Bar 3pc,meito,2.19,5,Japan,3.6,Yami,Chocolate,400,1600,876
Snack Candy Lollipop Present Gift 1pc,glico,0.83,0,Japan,,Yami,Chocolate,400,1600,332
Coconut Milk With Corgi Shape Marshmellow 92g,lrgw,4.39,2,Mainland China,5,Yami,Chocolate,400,1600,1756
Shiroi Koibito Chocolate Cookie White Chocolate 27Piece,ishiya seika,36.84,0,Japan,,Yami,Chocolate,400,1600,14736
Cereal Chocolate Flavor  300g,nissin,8.99,0,Japan,,Yami,Chocolate,400,1600,3596
HI-CHEW Soft Chewy Fruit Candy Strawberry Flavor 50g,morinaga,1.29,6,Japan,5,Yami,Chocolate,400,1600,516
Matcha Chocolat Au Lait 13.5g,haitai,4.49,2,Korea,5,Yami,Chocolate,400,1600,1796
Japanese KitKat Blue Ocean Chocolate Wafer 12pcs 124g,nestle,7.29,0,Japan,,Yami,Chocolate,400,1600,2916
Ejiao Gummy Candy  60Pcs,deej,12.99,4,Mainland China,4.8,Yami,Chocolate,25,100,324.75
Ishiya Winter Chocolate Gianduja Mille-Feuille 6Pcs,ishiya seika,21.99,0,Japan,,Yami,Chocolate,400,1600,8796
Xylicrystal Ichigo Milk 63g,kasugai,2.99,0,Japan,,Yami,Chocolate,400,1600,1196
SENJAKU KURO AME CANDY 106g,senjaku,1.15,0,Japan,,Yami,Chocolate,400,1600,460
CANDY IMPACT MINTS 0.53OZ,kakao friends,3.29,2,Korea,4,Yami,Chocolate,400,1600,1316
2 in 1 Mixed Fruit Candy 11.65oz,morinaga,6.49,4,Japan,5,Yami,Chocolate,400,1600,2596
X'mas Party Hard Candy 13g,wonderland,1.29,0,Japan,,Yami,Chocolate,400,1600,516
CANDY IMPACT MINTS 15g,kakao friends,3.29,3,Korea,4.7,Yami,Chocolate,400,1600,1316
Elise Biscuit Milk & Chocolate 110g,bourbon,2.99,15,Japan,4.5,Yami,Chocolate,400,1600,1196
Japanese Chocolate Egg Roll Limited Edition 7pc,yoku moku,19.99,2,Japan,5,Yami,Chocolate,400,1600,7996
Disney Chocolate 1bag,disney,0.85,1,United States,5,Yami,Chocolate,200,800,170
Mango Soft Candy 50g,uha,1.99,9,Japan,4.3,Yami,Chocolate,400,1600,796
WENHEYOU CINNAMON OIL CANDY,wenheyou,5.69,0,Mainland China,,Yami,Chocolate,400,1600,2276
Queen Milk Candy 70g,kasugai,3.49,2,Japan,5,Yami,Chocolate,400,1600,1396
Strawberry Blueberry Mixed Flavor Elastic Gummy 56g,kanro,2.35,0,Japan,,Yami,Chocolate,400,1600,940
Millefas Chocolate Flavor 119g,bourbon,4.99,1,Japan,5,Yami,Chocolate,25,100,124.75
Wafer White Chocolate 57g,bourbon,3.29,0,Japan,,Yami,Chocolate,25,100,82.25
Japanese Kit Kat Chocolate Wafer Original 14pc,nestle,6.99,0,Japan,,Yami,Chocolate,400,1600,2796
Biscuit Strawberry And Chocolate Flavor 120g,rimo,3.49,2,Japan,5,Yami,Chocolate,400,1600,1396
Cute Sanwish Gummy 150g,mushroomstorm,7.21,4,Mainland China,4.8,Yami,Chocolate,400,1600,2884
Pure Gummy Candy Strawberry 56g,kanro,2.99,0,Japan,,Yami,Chocolate,400,1600,1196
Kakao Friend Mint JAY-G 15g,kakao friends,3.49,2,Korea,5,Yami,Chocolate,400,1600,1396
HONG YUAN Candy  Lychee Flavor 350g,hongyuan,3.49,0,Mainland China,5,Yami,Chocolate,400,1600,1396
ROYCE HOKKAIDO Tiramisu Flavor Fresh Chocolate 20pc,royce,19.68,0,Japan,,Yami,Chocolate,400,1600,7872
ROYCE HOKKAIDO Sakura Flavor Fresh Chocolate 20pc,royce,19.68,0,Japan,,Yami,Chocolate,400,1600,7872
Corn Cracker Light Salted Flavor Christmas Limited Edition 75g,house,2.99,0,Japan,,Yami,Chocolate,400,1600,1196
Uji Matcha Crunchy Chocolate 135g,meito,5.99,4,Japan,5,Yami,Chocolate,400,1600,2396
MUSHROOMSTORM Howthorn lollipop 90g,mushroomstorm,6.64,7,Mainland China,4.7,Yami,Chocolate,400,1600,2656
4D Blocks 72g,kanro,3.29,1,Japan,5,Yami,Chocolate,400,1600,1316
Sspiart Namacream 60g,bourbon,2.39,0,Japan,,Yami,Chocolate,25,100,59.75
Coconut Chocolate Sand 135g,akaibohshi,7.99,2,Japan,5,Yami,Chocolate,300,1200,2397
Kanu Mint Chocolate Latte 8pc*17.3g,maxim top,7.99,0,Korea,,Yami,Chocolate,400,1600,3196
ROYCE HOKKAIDO Flavor Fresh Chocolate #White 20pc,royce,19.68,0,Japan,,Yami,Chocolate,400,1600,7872
Crepe Dentelle Crispy Crepe Chocolate Walnut Flavor 90g,gavottes,4.49,8,France,4.9,Yami,Chocolate,400,1600,1796
Hi-chew 3 Flavor Tropical Mix Soft Candy 100g,morinaga,2.49,14,Japan,4.9,Yami,Chocolate,400,1600,996
GLICO Disney Chocolate Lollipop 2pc,glico,1.99,0,Japan,,Yami,Chocolate,400,1600,796
Ishiya Winter Chocolate Waffle 3Pcs,ishiya seika,10.99,3,Japan,4,Yami,Chocolate,400,1600,4396
Puff Chocolate Flavor 146g,haitai,3.89,0,Korea,,Yami,Chocolate,400,1600,1556
Milk Chocolate 50g,morinaga,1.99,2,Japan,5,Yami,Chocolate,400,1600,796
ROYCE  HOKKAIDO Chocolate Champagne 20pc,royce,18.88,0,Japan,,Yami,Chocolate,400,1600,7552
Coconut Flakers,other brands,3.49,0,Unclear,,Yami,Chocolate,400,1600,1396
MOEGINO Chocolate Sandwich Cookie 24pcs 464g,tivoli tivon,22.99,1,Japan,5,Yami,Chocolate,400,1600,9196
Mint Candy Orange Flavor TUBE 15g,kakao friends,3.29,3,Korea,4.7,Yami,Chocolate,400,1600,1316
Matcha Konpeito 45g,marutai,1.99,1,Japan,3,Yami,Chocolate,400,1600,796
Mint Candy Honey Mellon Flavor 15g,kakao friends,3.29,4,Korea,3.5,Yami,Chocolate,400,1600,1316
PIKACHU Valentine's day limited Chocolat 4pc,xongjingwu,12.99,0,Japan,,Yami,Chocolate,400,1600,5196
Nuts Bon Caramel Crunch 81g,kanro,3.49,0,Japan,,Yami,Chocolate,400,1600,1396
Pretzel Chocolate 48g,bourbon,2.89,0,Japan,,Yami,Chocolate,25,100,72.25
Milky Creamy Candy Assorted Tropical Fruit Flavor 120g,milkita,2.99,6,Indonesia,4.7,Yami,Chocolate,400,1600,1196
Milo Vitamin and Minerals Powder Drink Chocolate Flavor  396g,nestle,6.49,0,Japan,,Yami,Chocolate,400,1600,2596
Chocolate and Caramel Crispy Wafer Roll 185g,bourbon,5.99,4,Japan,5,Yami,Chocolate,400,1600,2396
Lucky Chocolate Flavor Biscuit Stick 45g,meiji,1.89,35,Japan,4.8,Yami,Chocolate,400,1600,756
Milky Creamy Candy Assorted Ice Cream Flavor 4.23 OZ,milkita,2.69,16,Indonesia,4.8,Yami,Chocolate,400,1600,1076
Strawberry Gummy 58g,kabaya,2.99,0,Japan,,Yami,Chocolate,400,1600,1196
Plain Chocolate 8pcs 58g,mary's,21.99,0,Japan,,Yami,Chocolate,400,1600,8796
Chocolate No.1 Shop Gift Box 551g,imei,29.99,1,Taiwan,5,Yami,Chocolate,400,1600,11996
French Champs Night Chocolate Gift Box 414g,imei,22.99,2,Taiwan,5,Yami,Chocolate,400,1600,9196
Nerichu Yogurt Chewing Gum 30g,heart,3.09,0,Japan,,Yami,Chocolate,400,1600,1236
Konjac Peach Jelly 6pc,orihiro,3.9,2,Japan,5,Yami,Chocolate,400,1600,1560
Nanguo Ginger Coconut Candy 200g,nanguo,3.29,0,Mainland China,,Yami,Chocolate,400,1600,1316
Baked Chocolate Snack 101g,morinaga,2.65,0,Japan,,Yami,Chocolate,400,1600,1060
PIKACHU Valentine's day limited Chocolat 11pc,xongjingwu,26.9,1,Japan,5,Yami,Chocolate,400,1600,10760
OFF Chocolate 8pcs,fujiya,3.29,0,Japan,,Yami,Chocolate,400,1600,1316
Fuyu No Milk 80g,asahi,3.49,0,Japan,,Yami,Chocolate,200,800,698
Fruit Candy Soda Flavor  Limited 40g,uha,1.5,0,Japan,,Yami,Chocolate,400,1600,600
Teochew Gummy Jelly 250g,mushroomstorm,8.54,1,Mainland China,5,Yami,Chocolate,400,1600,3416
Galbo Fragrance and Rich White Candy 60g,meiji,3.49,1,Japan,5,Yami,Chocolate,400,1600,1396
HONG YUAN Candy Tangerine Flavor  355g,hongyuan,3.29,0,Mainland China,4.5,Yami,Chocolate,400,1600,1316
Oligosmart Chocolate Super 50g,meiji,4.49,2,Japan,5,Yami,Chocolate,400,1600,1796
Grape Marshmallow 100g,royal family,2.49,0,Taiwan,,Yami,Chocolate,400,1600,996
Chocolate Flavour Wafers Tin 700g,garden,12.99,1,Hong Kong,5,Yami,Chocolate,400,1600,5196
Coconut Milk With Egg Shape Marshmellow 92g,lrgw,4.39,0,Mainland China,,Yami,Chocolate,400,1600,1756
POCKY Chocolate Biscuit Sticks 53g,glico,3.9,0,Japan,,Yami,Chocolate,400,1600,1560
Ramune Soda Soft Candy 50g,uha,1.99,32,Japan,4.8,Yami,Chocolate,400,1600,796
Whistle Candy Tablet Family Assort 110g,coris,5.89,0,Japan,,Yami,Chocolate,400,1600,2356
Soft Candy 4 Flavor 100g,uha,2.99,60,Japan,4.8,Yami,Chocolate,400,1600,1196
Vanilla Shake Candy 4.2oz,milkita,2.29,0,Indonesia,,Yami,Chocolate,400,1600,916
JAPAN Herbal Throat Candy Stick Pack honey milk 42g,ryukakusan,2.5,0,Japan,,Yami,Chocolate,400,1600,1000
Valentine Chocolate 39pc,message de rose,69,1,Japan,5,Yami,Chocolate,400,1600,27600
Hot-Kid Milk Chewy Candy Original Flavor 318g,want want,6.49,6,Taiwan,4.5,Yami,Chocolate,400,1600,2596
Hi-Chew Acai 50g 10pc,morinaga,1.09,0,Japan,,Yami,Chocolate,400,1600,436
ON Chocolate 7pcs,fujiya,3.29,0,Japan,,Yami,Chocolate,400,1600,1316
Pepero Almond and Chocolate 32g,lotte korea,2.29,9,Korea,4.7,Yami,Chocolate,400,1600,916
Precieux white chocolate Covered Lemon Cake 10pcs,chen yun pao chuan,26.99,8,Taiwan,4.6,Yami,Chocolate,25,100,674.75
Candy Bag 150g,taiki,3.99,1,Japan,5,Yami,Chocolate,400,1600,1596
Chocolate Flavored Peanut Crisp Egg Roll 218g,kaluokaman,4.39,1,Mainland China,3,Yami,Chocolate,400,1600,1756
Gummy Candy 100% Fruit Juice (mango) 150g,twin rabbit,2.39,6,United States,3.5,Yami,Chocolate,400,1600,956
HOKKAIDO OKINAWA Chocolate Mango 20pc,royce,19.58,0,Japan,,Yami,Chocolate,400,1600,7832
Jujube Nougat 150g bag,golden bonbon,4.89,1,Canada,5,Yami,Chocolate,400,1600,1956
Chewing Candy Yogurt Flavor 63g,lotte korea,3.29,8,Korea,4.6,Yami,Chocolate,400,1600,1316
Egg Roll Chocolate Flavor 62g,haitai,1.99,8,Korea,4.8,Yami,Chocolate,400,1600,796
Matcha Candy 95g,ameyasan,3.89,12,Japan,4.1,Yami,Chocolate,300,1200,1167
Gold Throat Candy Tablet Golden Ginger 15g,asahi,3.49,0,Japan,,Yami,Chocolate,200,800,698
Carre De Chocola Cacao 70 & Almond 111g,morinaga,6.29,0,Japan,,Yami,Chocolate,400,1600,2516
Herbal Throat Candy Stick Pack Citrus Lemon 42g,ryukakusan,2.4,0,Japan,,Yami,Chocolate,400,1600,960
Mixed Candy 96g,oishi,2.29,0,Mainland China,,Yami,Chocolate,400,1600,916
BALI'SBEST Iced Tea Candy 150g,bali's best,1.99,2,Mainland China,5,Yami,Chocolate,200,800,398
Sepiart Horoniga Cacao 60g,bourbon,2.39,0,Japan,,Yami,Chocolate,25,100,59.75
Konjac Macha Jelly 6pc,orihiro,3.9,0,Japan,,Yami,Chocolate,400,1600,1560
Chocolate Valentine Edition 40pcs,royce,19.99,2,Japan,5,Yami,Chocolate,400,1600,7996
CHUNGUANG Coconut Candy228g,chun guang,3.99,0,Mainland China,,Yami,Chocolate,400,1600,1596
KIT KAT Peach Chocolate wafer 11pc,nestle,6,0,Japan,,Yami,Chocolate,400,1600,2400
Melody Chocolate Box,goncharoff,34.99,0,Japan,,Yami,Chocolate,400,1600,13996
KASUGAI Candy Peach Cream Frappe Flavor 76g,kasugai,3.29,0,Japan,,Yami,Chocolate,400,1600,1316
Carre De Chocoka French 21pc 128g,morinaga,5.89,0,Japan,,Yami,Chocolate,400,1600,2356
HI-CHEW Soft Chewy Fruit Candy Mango 50g,morinaga,1.29,7,Japan,5,Yami,Chocolate,400,1600,516
White Chocolate Hazelnut Waffle Snack 284g,crown,5.99,196,Korea,4.8,Yami,Chocolate,400,1600,2396
Amaoichigo Season Choco 120g,chirin,4.59,0,Japan,,Yami,Chocolate,400,1600,1836
EXCEL Color Lusting Gel Liner CG02 Chocolate 11g,excel,16.27,1,Japan,5,Yami,Chocolate,200,800,3254
Sake Flavor Chocolate Wafer 8pc,kit kat,16.5,8,United States,5,Yami,Chocolate,400,1600,6600
Konjac Coffee Jelly 6pc,orihiro,3.9,0,Japan,,Yami,Chocolate,400,1600,1560
JAPAN Herbal Throat Candy Stick Pack Lemon 10 capsules,ryukakusan,3.06,0,Japan,,Yami,Chocolate,400,1600,1224
Petit Coffret Rose Chocolate 3pcs,mary's,15.99,0,Japan,,Yami,Chocolate,400,1600,6396
KANRO  ASOBON Soda Gummy 56g,kanro,2.99,1,Japan,5,Yami,Chocolate,400,1600,1196
Healthier Creamy Candy - Banana - All Natural Low Sugar High Protein - 3.7oz bag,numa,4.49,1,United States,4,Yami,Chocolate,400,1600,1796
Konjac Muscat Jelly 6pc,orihiro,3.9,0,Japan,,Yami,Chocolate,400,1600,1560
KITKAT Oat Chocolate wafer 13pc,nestle,5.9,3,Japan,4.7,Yami,Chocolate,400,1600,2360
Baton Cookie Coconut 25pc,royce,17.9,3,Japan,5,Yami,Chocolate,400,1600,7160
Minettokupuru Chocolate 8pcs,mary's,34.99,0,Japan,,Yami,Chocolate,400,1600,13996
Salt Sport Candy 79g,pine,1.5,2,Japan,5,Yami,Chocolate,400,1600,600
