Title,Title_link,Price,unit_info___32SjE,Headline,Field1,Field3,Field2
"I-Mei Butter Egg Roll, Original Flavor  180 g",https://www.sayweee.com/en/product/I-Mei-Butter-Egg-Roll--Original-Flavor-/94206,$4.99,,"I-Mei Butter Egg Roll, Original Flavor",(174),,
"Beitian Energy 99 Rice Roll, Taro Flavor  180 g",https://www.sayweee.com/en/product/Beitian-Energy-99-Rice-Roll--Taro-Flavor-/36486,$2.99,,"Beitian Energy 99 Rice Roll, Taro Flavor",(12),Taiwan,
Bourbon Baum Roll Cookies 7ct 3.2 oz,https://www.sayweee.com/en/product/Bourbon-Baum-Roll-Cookies-7ct/79825,$1.99,$0.62/oz,Bourbon Baum Roll Cookies 7ct,(16),Japan,BOURBON
Peacock Custard Wafer Rolls 63 g,https://www.sayweee.com/en/product/Peacock-Custard-Wafer-Rolls/12361,$2.99,$0.04/g,Peacock Custard Wafer Rolls,(33),Taiwan,
"Kaman Egg Rolls, Seaweed Flavor 90 g",https://www.sayweee.com/en/product/Kaman-Egg-Rolls--Seaweed-Flavor/38171,$6.99,$0.07/g,"Kaman Egg Rolls, Seaweed Flavor",,Mainland China,Kaman
YAKISS Roll Biscuit Cherry Blossom Matcha Flavor 160 g,https://www.sayweee.com/en/product/YAKISS-Roll-Biscuit-Cherry-Blossom-Matcha-Flavor/16107,$6.99,$0.04/g,YAKISS Roll Biscuit Cherry Blossom Matcha Flavor,(3),Mainland China,
"Karman Egg Rolls, Soybean Milk Flavor 308 g",https://www.sayweee.com/en/product/Karman-Egg-Rolls--Soybean-Milk-Flavor/34322,$8.99,,"Karman Egg Rolls, Soybean Milk Flavor",(1),Mainland China,
ChingTse Sauce Egg Roll Black Sesame Flavor 200 g,https://www.sayweee.com/en/product/ChingTse-Sauce-Egg-Roll-Black-Sesame-Flavor/84526,$25.99,$0.12/g,ChingTse Sauce Egg Roll Black Sesame Flavor,,Taiwan,
Healthful Hazelnut Cocoa Wafer Roll  400 g,https://www.sayweee.com/en/product/Healthful-Hazelnut-Cocoa-Wafer-Roll-/12362,$14.99,$0.03/g,Healthful Hazelnut Cocoa Wafer Roll,(18),Taiwan,Healthful
Sakura Strawberry Egg Rolls 260 g,https://www.sayweee.com/en/product/Sakura-Strawberry-Egg-Rolls/28233,$9.49,$0.03/g,Sakura Strawberry Egg Rolls,(3),Mainland China,
Healthful Brown Sugar Wafer Rolls 400 g,https://www.sayweee.com/en/product/Healthful-Brown-Sugar-Wafer-Rolls/62011,$14.99,$0.03/g,Healthful Brown Sugar Wafer Rolls,(16),Taiwan,Healthful
YAKISS Roll Biscuit Mango Pomelo Sago Flavor 160 g,https://www.sayweee.com/en/product/YAKISS-Roll-Biscuit-Mango-Pomelo-Sago-Flavor/16091,$6.99,$0.04/g,YAKISS Roll Biscuit Mango Pomelo Sago Flavor,(7),Mainland China,
"Kaman Crispy Egg Roll, Durian Flavor 218 g",https://www.sayweee.com/en/product/Kaman-Crispy-Egg-Roll--Durian-Flavor/34323,$4.39,,"Kaman Crispy Egg Roll, Durian Flavor",(3),Mainland China,
Cocoa Egg Rolls 260 g,https://www.sayweee.com/en/product/Cocoa-Egg-Rolls/28232,$9.49,$0.03/g,Cocoa Egg Rolls,(7),Mainland China,
Wei-Chuan Purple Sweet Potato Egg Roll 17.6 oz,https://www.sayweee.com/en/product/Wei-Chuan-Purple-Sweet-Potato-Egg-Roll/79655,$12.49,$0.70/oz,Wei-Chuan Purple Sweet Potato Egg Roll,(3),Mainland China,
Healthful Wafer Roll Strawberry  400 g,https://www.sayweee.com/en/product/Healthful-Wafer-Roll-Strawberry-/91934,$14.99,$0.03/g,Healthful Wafer Roll Strawberry,(12),Taiwan,Healthful
ChingTse Sauce Egg Roll Peanut Butter Flavor 200 g,https://www.sayweee.com/en/product/ChingTse-Sauce-Egg-Roll-Peanut-Butter-Flavor/84525,$25.99,$0.12/g,ChingTse Sauce Egg Roll Peanut Butter Flavor,(2),Taiwan,
"Kee Wah Assorted Egg Rolls 6pk, 3 Flavors 216 g",https://www.sayweee.com/en/product/Kee-Wah-Assorted-Egg-Rolls-6pk--3-Flavors/5953,$15.99,$0.07/g,"Kee Wah Assorted Egg Rolls 6pk, 3 Flavors",(9),Hong Kong,
HiWalk Handmade Sesame Egg Rolls 8ct 1 each,https://www.sayweee.com/en/product/HiWalk-Handmade-Sesame-Egg-Rolls-8ct/9931,$39.99,$39.99/each,HiWalk Handmade Sesame Egg Rolls 8ct,(35),Taiwan,
"Deka Wafer Roll, Choco Banana Flavor  12.7 oz",https://www.sayweee.com/en/product/Deka-Wafer-Roll--Choco-Banana-Flavor-/22763,$3.99,$0.31/oz,"Deka Wafer Roll, Choco Banana Flavor",(2),Indonesia,
MX Petite Original Eggroll 36pcs 208.8 g,https://www.sayweee.com/en/product/MX-Petite-Original-Eggroll-36pcs/22697,$19.99,$0.09/g,MX Petite Original Eggroll 36pcs,,Mainland China,
Tiger Sugar Milk Egg Roll Gift Box 340 g,https://www.sayweee.com/en/product/Tiger-Sugar-Milk-Egg-Roll-Gift-Box/23092,$18.99,$0.05/g,Tiger Sugar Milk Egg Roll Gift Box,(10),Taiwan,
"Karman Egg Rolls, Chocolate Peanut Crisp Flavor 218 g",https://www.sayweee.com/en/product/Karman-Egg-Rolls--Chocolate-Peanut-Crisp-Flavor/35090,$6.89,$0.03/g,"Karman Egg Rolls, Chocolate Peanut Crisp Flavor",(4),Mainland China,
"Kaman Crispy Egg Roll, Soybean Milk Flavor 218 g",https://www.sayweee.com/en/product/Kaman-Crispy-Egg-Roll--Soybean-Milk-Flavor/34325,$6.89,$0.03/g,"Kaman Crispy Egg Roll, Soybean Milk Flavor",(4),Mainland China,
Wei-i Tuna Flavor Egg Rolls 60 g,https://www.sayweee.com/en/product/Wei-i-Tuna-Flavor-Egg-Rolls/33876,$4.49,$0.07/g,Wei-i Tuna Flavor Egg Rolls,(6),Taiwan,
"Karman Egg Rolls, Salted Egg Flavor 308 g",https://www.sayweee.com/en/product/Karman-Egg-Rolls--Salted-Egg-Flavor/33873,$11.99,$0.03/g,"Karman Egg Rolls, Salted Egg Flavor",,Mainland China,
"Karman Egg Rolls, Durian Flavor  308 g",https://www.sayweee.com/en/product/Karman-Egg-Rolls--Durian-Flavor-/34111,$11.99,$0.03/g,"Karman Egg Rolls, Durian Flavor",,Mainland China,
Kaman Eggroll Gift Bag 508 g,https://www.sayweee.com/en/product/Kaman-Eggroll-Gift-Bag/38163,$15.99,$0.03/g,Kaman Eggroll Gift Bag,,Mainland China,
Cheese Egg Rolls  260 g,https://www.sayweee.com/en/product/Cheese-Egg-Rolls-/28234,$9.49,$0.03/g,Cheese Egg Rolls,(1),Mainland China,
Six Fortune Egg Rolls 1.7 oz,https://www.sayweee.com/en/product/Six-Fortune-Egg-Rolls/46131,$3.69,$2.17/oz,Six Fortune Egg Rolls,(1),Taiwan,
"Six Fortune Egg Rolls, Sesame Flavor 1.7 oz",https://www.sayweee.com/en/product/Six-Fortune-Egg-Rolls--Sesame-Flavor/44862,$3.69,$2.17/oz,"Six Fortune Egg Rolls, Sesame Flavor",(1),Taiwan,
"Healthful Wafer Roll, Chocolate 400 g",https://www.sayweee.com/en/product/Healthful-Wafer-Roll--Chocolate/45523,$14.99,$0.03/g,"Healthful Wafer Roll, Chocolate",(35),Taiwan,Healthful
"Hello Kitty Wafer Cookies, Chocolate and Vanilla Flavors 630 g",https://www.sayweee.com/en/product/Hello-Kitty-Wafer-Cookies--Chocolate-and-Vanilla-Flavors/72162,$16.79,,"Hello Kitty Wafer Cookies, Chocolate and Vanilla Flavors",(18),Taiwan,
Kaman Assorted Biscuits Wealth Gifts 520 g,https://www.sayweee.com/en/product/Kaman-Assorted-Biscuits-Wealth-Gifts/82357,$19.99,$0.03/g,Kaman Assorted Biscuits Wealth Gifts,,Mainland China,
"Peacock Wafer Rolls, Coffee Flavor 63 g",https://www.sayweee.com/en/product/Peacock-Wafer-Rolls--Coffee-Flavor/12360,$2.99,$0.04/g,"Peacock Wafer Rolls, Coffee Flavor",(34),Taiwan,
Rong Shing Macau Styled Egg Rolls 454 g,https://www.sayweee.com/en/product/Rong-Shing-Macau-Styled-Egg-Rolls/35064,$10.29,,Rong Shing Macau Styled Egg Rolls,(2),Mainland China,
"Fuyishan Egg Roll Gift Boxes, 5 Egg Rolls x 5 Pack 475 g",https://www.sayweee.com/en/product/Fuyishan-Egg-Roll-Gift-Boxes-5-Egg-Rolls-x-5-Pack/2066,$22.99,$0.04/g,"Fuyishan Egg Roll Gift Boxes, 5 Egg Rolls x 5 Pack",(62),Taiwan,Fuyishan
"Aijia Egg Rolls, Milk Flavor 3.8 oz",https://www.sayweee.com/en/product/Aijia-Egg-Rolls--Milk-Flavor/33878,$2.19,$0.57/oz,"Aijia Egg Rolls, Milk Flavor",(1),Taiwan,
"Six Fortune Egg Rolls, Salted Egg Yolk Flavor 1.7 oz",https://www.sayweee.com/en/product/Six-Fortune-Egg-Rolls--Salted-Egg-Yolk-Flavor/46132,$3.69,$2.17/oz,"Six Fortune Egg Rolls, Salted Egg Yolk Flavor",(2),Taiwan,
