Product_Name,Brand,Option,Price,Reviews,Origin,Rate,Platform,Category
Low Calories Konjac Jelly Drink Peach Flavor 150ml,Jelly.B,10 Options,1.1,280,Korea,4.8,Yami,Jelly
Low Calories Konjac Jelly Drink Lychee Flavor 150ml,Jelly.B,10 Options,1.69,137,Korea,4.7,Yami,Jelly
Low Calories Konjac Jelly Drink Blueberry Flavor 150ml,Jelly.B,10 Options,1.69,75,Korea,4.7,Yami,Jelly
Low Calories Konjac Jelly Drink Watermelon Flavor 150ml,Jelly.B,10 Options,1.69,120,Korea,4.3,Yami,Jelly
Low Calories Konjac Jelly Drink Apple Flavor 150ml,Jelly.B,10 Options,1.69,124,Korea,4.8,Yami,Jelly
"Low Calories Konjac Jelly Drink Jeju Mandarin Flavor, 150ml",Jelly.B,10 Options,1.69,2,Korea,4.5,Yami,Jelly
WAKASHOU Grape Flavor 204g,CHIA SEED JELLY,4 Options,5.29,8,Japan,5,Yami,Jelly
JINJIN Passion Fruit Flavor Jelly  480g,JINGJING,4 Options,1.59,31,Taiwan,4.4,Yami,Jelly
Turtle Jelly Guilinggao Mangosteen Flavor 250g,COINS,No,1.49,22,Mainland China,4.8,Yami,Jelly
Jelly Cup Mix Fruit Flavor 320g,NEW TOWN,No,1.29,28,Vietnam,4.8,Yami,Jelly
Purunchuchu Toy Jelly 5g,HEART,No,3.49,1,Japan,5,Yami,Jelly
Konjac Jelly Grapefruit 150g,DR.LIV,16 Options,1.85,62,Korea,4.9,Yami,Jelly
CICI Jelly Drink Mango Flavor 150g,STRONGFOOD,9 Options,1.19,100,Mainland China,4.8,Yami,Jelly
Konjac Jelly Peach 150g,DR.LIV,16 Options,1.85,83,Korea,4.9,Yami,Jelly
Kommyaku Jelly Peach Flavor 130g,ORIHIRO,7 Options,2.19,49,Japan,4.5,Yami,Jelly
SCHENG Lychee Coconut Jelly 280g,TRIKOFOODS,2 Options,1.49,131,Taiwan,4.9,Yami,Jelly
Passion Fruit Jelly Drink 220g,Chen Jiah Juang,No,2.89,0,Taiwan,0,Yami,Jelly
Mini Rabbit Jelly Cup 4.5oz,DRAGONFLY BRAND,No,4.29,0,Mainland China,0,Yami,Jelly
Guava Jelly Drink 220g,Chen Jiah Juang,No,2.89,0,Taiwan,0,Yami,Jelly
Tangerine Peel & Lemon Jelly 70g*5,SUNITY,No,5.99,7,Mainland China,4.9,Yami,Jelly
Konjac Jelly Strawberry 312g,jeagueijih,No,3.99,12,Taiwan,4.4,Yami,Jelly
Kommyaku Jelly Grape Flavor 130g,ORIHIRO,7 Options,2.39,44,Japan,4.7,Yami,Jelly
Kommyaku Jelly Lychi Flavor 130g,ORIHIRO,7 Options,2.19,16,Japan,4.7,Yami,Jelly
Konjac Jelly Purunto St Shine Muscat 130g,ORIHIRO,No,2.29,0,Japan,0,Yami,Jelly
Konjaku Juice Jelly-Strawbrry Flavor 110g,WHIKO,No,2.99,0,Mainland China,0,Yami,Jelly
Milky Oatmeal Herbal Jelly 222g*2Cups 444g,SUNITY,5 Options,4.39,106,Mainland China,4.7,Yami,Jelly
Milky Longan Herbal Jelly 222g*2Cups 444g,SUNITY,5 Options,4.39,113,Mainland China,4.6,Yami,Jelly
Kojac Jelly - Peach and Mango Flavor 260g,AJI,3 Options,4.69,3,Mainland China,5,Yami,Jelly
Fruits Jelly Drink Orange Flavor 150g,SHIRAKIKU,10 Options,1.29,47,Japan,4.6,Yami,Jelly
Mini Tiger Jelly Cup 4.9oz,DRAGONFLY BRAND,No,3.99,0,Mainland China,0,Yami,Jelly
Mango Flavor Jelly 400g,JINGJING,2 Options,1.69,88,Taiwan,4.8,Yami,Jelly
Brown Sugar & Date Jelly 70g*5,SUNITY,No,5.99,0,Mainland China,0,Yami,Jelly
Konjac Jelly Green Grape 150g x10 Packs,DR.LIV,No,17.49,17,Korea,5,Yami,Jelly
Konjac Jelly Grapefruit 150g x10 Packs,DR.LIV,No,17.49,29,Korea,5,Yami,Jelly
Kommyaku Jelly Apple Flavor 130g,ORIHIRO,7 Options,2.19,46,Japan,4.6,Yami,Jelly
Konjac Jelly Sweet Mascut Flavor Low Calories Drink 150g,DR.LIV,16 Options,1.85,61,Korea,4.8,Yami,Jelly
Konjac Jelly Apple Mango 150g,DR.LIV,16 Options,1.85,71,Korea,4.8,Yami,Jelly
QOO Jelly Drink Grape Flavor 125g,MINUTE MAID,2 Options,2.69,6,United States,3.7,Yami,Jelly
Konjac Jelly  Passion Fruit and Grape Flavor 260g,AJI,3 Options,4.99,3,Mainland China,5,Yami,Jelly
Konjac Jelly Sweet Muscat 150g x10 Packs,DR.LIV,No,17.49,19,Korea,4.9,Yami,Jelly
Cranberry and Blueberry Jelly 50g,LITTLE JASMINE,No,2.49,0,United States,0,Yami,Jelly
Konjac Jelly Peach 150g x10 Packs,DR.LIV,No,17.49,10,Korea,4.9,Yami,Jelly
Konjac Jelly Lychee 312g,jeagueijih,No,3.99,11,Taiwan,4.5,Yami,Jelly
Konjac Jelly  Lychee and Pineapple Flavor 260g,AJI,3 Options,4.99,3,Mainland China,4.7,Yami,Jelly
Herbal Jelly Kumquat Lemon 198g*2,SUNITY,No,3.69,2,Mainland China,5,Yami,Jelly
Konjac Jelly Mango 312g,jeagueijih,No,3.99,12,Taiwan,4.5,Yami,Jelly
Konjac Jelly Blueberry 150g,DR.LIV,16 Options,1.85,37,Korea,4.8,Yami,Jelly
QOO Jelly Drink Orange Flavor 125g,MINUTE MAID,No,2.69,16,United States,4.1,Yami,Jelly
QOO Jelly Drink Peach Falvour 125g,MINUTE MAID,2 Options,3.59,0,United States,4.4,Yami,Jelly
Coconut Jelly Assorted 400g,JINGJING,4 Options,2.19,2,Taiwan,5,Yami,Jelly
Jelly Peach Flavor 180g,YAKISS,No,2.39,5,Hong Kong,4.8,Yami,Jelly
Jelly Millk Tea Flavor 180g,YAKISS,No,2.39,6,Hong Kong,4.5,Yami,Jelly
Konjac Jelly Apple Mango 150g x10 Packs,DR.LIV,No,17.49,27,Korea,4.9,Yami,Jelly
Konjac Jelly Blueberry 150g x10 Packs,DR.LIV,No,17.49,17,Korea,4.9,Yami,Jelly
Pudding Jelly Coke Flavor 150g,yifen,No,0.89,5,Mainland China,3.8,Yami,Jelly
Jelly Lemon Tea Flavor 180g,YAKISS,3 Options,2.59,6,Hong Kong,4.3,Yami,Jelly
Szechuan Jelly Dessert Powder 250g,KANGYAKU,No,2.19,11,Mainland China,3.8,Yami,Jelly
Konnyaku Konjac Jelly Apple Flavor 130g,YAMAKICHI SEIKA,3 Options,2.29,0,Japan,0,Yami,Jelly
Jelly Durian Mango Flavor 180g,YAKISS,3 Options,2.59,4,Hong Kong,3.5,Yami,Jelly
Energy Jelly 130g,ORIHIRO,No,2.39,0,Japan,0,Yami,Jelly
Jelly Macchiato Cocoa flavor 180g,YAKISS,3 Options,2.59,1,Hong Kong,3,Yami,Jelly
Konjac Jelly Passion Fruit 312g,jeagueijih,No,3.99,13,Taiwan,4.5,Yami,Jelly
Coconut Jelly Candy 200g,NANGUO,No,2.99,1,Mainland China,2,Yami,Jelly
LOTTE YOGURT JELLY GUMMY CANDY (50g)-YOGURT FLAVORED,Jelly.B,3 Options,3.99,2,Korea,3,Yami,Jelly
Teochew Gummy Jelly 250g,MushroomStorm,No,8.54,1,Mainland China,5,Yami,Jelly
Konjac White Peach & Grape Flavor Jelly 12pcs,ORIHIRO,No,7.99,0,Japan,0,Yami,Jelly
TOKYO Sakura Jelly 3pc,eitaro,No,19,23,Mainland China,4.6,Yami,Jelly
Prunto Konnyaku Jelly Grape 6pc,ORIHIRO,No,2.58,0,Japan,0,Yami,Jelly
Prunto Konnyaku Jelly Orange & Muscat 12pc,ORIHIRO,No,7.47,0,Japan,0,Yami,Jelly
Jushida Konnyaku Jelly - Passion Fruit 160g,NESTLE,No,4.79,0,Japan,0,Yami,Jelly
Chia Konjac Grape Jelly 144g,ROYAL FAMILY,No,8.99,0,Taiwan,0,Yami,Jelly
Jelly Chocolate Flavor 6p,ORIHIRO,5 Options,3.99,0,Japan,0,Yami,Jelly
Konjac Macha Jelly 6pc,ORIHIRO,42 Options,3.9,0,Japan,0,Yami,Jelly
Meal Replacement Enzyme Jelly Instant Probiotics Intestinal Smoothing Fruit and Vegetable Enzyme Jelly 35g*10,Nanjing Tongrentang,No,41.9,0,Mainland China,0,Yami,Jelly
Blueberry Pomegranate Collagen Enzyme Jelly 105g Replenish collagen through the stomach and intestines,Nanjing Tongrentang,No,38.9,0,Mainland China,0,Yami,Jelly
JAPAN FETTUCCINE JELLY DROPS COLA 50g,BOURBON,42 Options,2.99,0,Japan,0,Yami,Jelly
Heart-shaped Fruit Juice Collagen Jelly White Peach Flavor 54g,KANRO,No,2.9,0,Japan,0,Yami,Jelly
Konnyaku Jelly Muscat 6pc,ORIHIRO,No,2.58,0,Japan,0,Yami,Jelly
Jelly Drink White Peach Flavor 150g,TARAMI,No,3.2,7,Japan,4.9,Yami,Jelly
Lemon+Cantaloupe Flavor Konjac Jelly 12pcs,ORIHIRO,No,4.99,1,Japan,5,Yami,Jelly
Sakura flavor fruit jelly 120g,BE & CHEERY,No,9.9,0,Mainland China,0,Yami,Jelly
HOKKAIDO Cantaloupe Jelly 12pc,HORI,No,15.5,6,Japan,4.5,Yami,Jelly
Prunto Konnyaku Jelly Apple & Grape  12pc,ORIHIRO,No,7.47,0,Japan,0,Yami,Jelly
Purun and Konjac Jelly Pouch Watermelon 20g x 6pcs 120g,ORIHIRO,No,3.99,0,Japan,0,Yami,Jelly
Prunto Konnyaku Jelly Peach 6pc,ORIHIRO,No,2.8,0,Japan,0,Yami,Jelly
Prunto Konnyaku Jelly Grape 6pc,ORIHIRO,No,2.8,0,Japan,0,Yami,Jelly
Konnyaku Jelly Muscat 6pcs,ORIHIRO,No,3.99,3,Japan,5,Yami,Jelly
Jushida Konnyaku Jelly - Lychee 160g,NESTLE,No,4.79,0,Japan,0,Yami,Jelly
Jushida Konnyaku Jelly - Peach 160g,NESTLE,No,4.79,0,Japan,0,Yami,Jelly
Sakura Jelly 3pc,eitaro,No,18.99,0,Mainland China,0,Yami,Jelly
Prunto Konnyaku Jelly Peach 6pc,ORIHIRO,No,2.58,0,Japan,0,Yami,Jelly
Konnyaku Jelly Apple Grape Flavour 12pcs,ORIHIRO,No,6.99,1,Japan,5,Yami,Jelly
Konnyaku Jelly Muscat 6pc,ORIHIRO,No,2.8,0,Japan,0,Yami,Jelly
SINOADORE Jelly  Circulist 150g,SHISEIDO,No,5.5,3,Japan,5,Yami,Jelly
Jelly Drink Green Grape Flavor 150g,TARAMI,No,3.2,6,Japan,5,Yami,Jelly
TOKYO Sakura Jelly Pudding 3pc,eitaro,No,19,1,Mainland China,5,Yami,Jelly
Prunto Konnyaku Jelly Peach 6pcs,ORIHIRO,No,3.99,3,Japan,5,Yami,Jelly
Jelly Drink Apple Flavor 150g,TARAMI,No,3.2,3,Japan,5,Yami,Jelly
Konjac Coffee Jelly 6pc,ORIHIRO,42 Options,3.9,0,Japan,0,Yami,Jelly
Choco Variety Pack 27pc In Bag Bis Milk Strawberry Jelly Cookie 176g,TIROL,No,5.88,5,Japan,4.8,Yami,Jelly
Jushida Konnyaku Jelly - Mango 160g,NESTLE,No,4.79,0,Japan,0,Yami,Jelly
Konjac Chocolate Jelly 6pc,ORIHIRO,42 Options,3.9,0,Japan,0,Yami,Jelly
Apple Chia Konjac Jelly 144g,ROYAL FAMILY,No,8.99,0,Taiwan,0,Yami,Jelly
SHIGA Plum Jelly 5pc,Kanou,4 Options,24.99,3,Japan,3,Yami,Jelly
Konjac Grape Jelly 6pc,ORIHIRO,42 Options,3.9,2,Japan,5,Yami,Jelly
Konjac Almond Milk Jelly 6pc,ORIHIRO,42 Options,3.9,0,Japan,0,Yami,Jelly
JAPAN GINZA Jelly Fudge 14pc,ROKUMEIKAN,14 Options,20.9,0,Japan,0,Yami,Jelly
Smart Lactobacillus Clear Jelly Fine Treat 90 Bags,POLA,No,132.59,0,Japan,0,Yami,Jelly
Konjac Muscat Jelly 6pc,ORIHIRO,42 Options,3.9,0,Japan,0,Yami,Jelly
Konjac  Orange Jelly 6pc,ORIHIRO,42 Options,3.9,0,Japan,0,Yami,Jelly
TACT COOL JELLY External Analgesic Pain Relief Ointment 20g,sato,No,7.99,1,Japan,1,Yami,Jelly
PinoO Jelly Your Boys Series Blind Box Single Box,POP MART,2 Options,11.99,2,Mainland China,5,Yami,Jelly
Pino Jelly Your Boys Series Blind Box Whole Set,POP MART,2 Options,139,2,Mainland China,5,Yami,Jelly
Konjac Jelly Noodle,YUANXIAN,No,3.99,4,Mainland China,4.2,Yami,Jelly
Rice Jelly (Brown Sugar Flavor) 240g,YUMEI,No,2.49,257,Mainland China,4.5,Yami,Jelly
Grass Jelly Pudding 255g,TAISUN,No,1.39,55,Taiwan,4.8,Yami,Jelly
Grass Jelly Drink Original 310ml,TAISUN,4 Options,0.99,31,Taiwan,4.4,Yami,Jelly
Hawthron Jelly Sheet 300g,YIDA,No,2.89,0,Mainland China,0,Yami,Jelly
"Night Recover Jelly, 50g",HABA,No,54.99,0,Japan,0,Yami,Jelly
Black Grass Jelly 19oz,MIFENG,No,2.49,0,Mainland China,0,Yami,Jelly
Rice Jelly (Chili Oil Flavor) 270g,YUMEI,No,2.19,72,Mainland China,4.4,Yami,Jelly
Konjac Jelly,YUANXIAN,No,3.49,7,Mainland China,4.7,Yami,Jelly
Sweet Red Bean Jelly Bar 55g,HAITAI,2 Options,0.79,122,Korea,4.3,Yami,Jelly
Herbal Jelly Mix 15packs,HEALTH STYLE,No,7.99,50,Taiwan,4.5,Yami,Jelly
Konjac Jelly Orange Flavor 263g,YUMEI,No,2.99,2,Mainland China,5,Yami,Jelly
Fiber Hawthron Jelly Roll 208g,YIDA,No,4.89,2,Mainland China,5,Yami,Jelly
Grass Jelly Drink 315ml,HONEY BEE,No,1.49,13,Taiwan,4.4,Yami,Jelly
Coffee Jelly 15g*5 bags,EZZ,No,14.5,0,Australia,0,Yami,Jelly
Konjac Jelly Brown Sugar 263g,YUMEI,No,2.99,5,Mainland China,5,Yami,Jelly
"EZZ Iron Jelly, 15g*7 pcs",EZZ,No,15.5,0,Australia,0,Yami,Jelly
Yunker Q10 JELLY Drink 150g,sato,No,2.99,43,Japan,4.9,Yami,Jelly
Konjac Jelly Pineapple Flavor 263g,YUMEI,No,2.99,1,Mainland China,5,Yami,Jelly
CHUANBEI JELLY Meat Tenderizer 300g,chuanbeiliangfen,No,2.19,3,Mainland China,5,Yami,Jelly
Jelly Soda 300ml,SUNKIST,No,2.49,2,Mainland China,4.5,Yami,Jelly
Premium Puresa Golden Jelly(GELEE) Mask Hyaluronic Acid 3sheets,UTENA,7 Options,7.99,55,Japan,4.7,Yami,Jelly
MOMO PURI Jelly Mask 4pcs,BCL,No,7.5,4,Japan,5,Yami,Jelly
Hawthorn Jelly Candy 96g,BIG GREEN,No,1.89,64,Mainland China,4.6,Yami,Jelly
Royal Jelly All In One Face Gel 75g,OZIO,No,39.99,1,Japan,5,Yami,Jelly
MOMO PURI Jelly Mask 4pcs,BCL,No,7.5,8,Japan,4.5,Yami,Jelly
Xylitol Sugar Free Chewing Gum Orange Flavor86g,LOTTE Korea,3 Options,4.99,6,Korea,4.3,Yami,Jelly
Xylitol Sugar Free Chewing Gum Aloe Vera Flavor86g,LOTTE Korea,3 Options,4.99,3,Korea,4,Yami,Jelly
Red Ginseng Yokan 30g,CROWN,No,4.39,0,Korea,0,Yami,Jelly
Konnyaku Fukairi Coffee 187g,YUKIGUNI AGURI,No,2.49,4,Japan,4.5,Yami,Jelly
Ice Pop 10 pcs 861g,DRAGONFLY BRAND,No,3.69,0,Mainland China,0,Yami,Jelly
Assorted Fruit Shape Pudding 11.3oz,DRAGONFLY BRAND,No,1.99,0,Mainland China,0,Yami,Jelly
Konnyaku Unshu Mikan 370g,YUKIGUNI AGURI,No,4.69,0,Japan,0,Yami,Jelly
Konnyaku Ringo 187g,YUKIGUNI AGURI,No,2.49,1,Japan,4,Yami,Jelly
ROCHER Fine Hazelnut Chocolates 12pcs,FERRERO,No,5.99,2,Canada,5,Yami,Jelly
Yōkan Azuki Red Bean Paste Snack 800g,eitaro,No,59.99,2,Mainland China,5,Yami,Jelly
Natural Wild Tao Jiao Peach Gum Jelly for Skin Health 16oz,PRESIDENT BRAND,No,18.99,0,United States,0,Yami,Jelly
Purinto St Hachimitsu Lemon 130g,ORIHIRO,No,2.29,0,Japan,0,Yami,Jelly
Xylitol Sugar Free Chewing Gum Original Flavor 86g,LOTTE Korea,3 Options,4.99,3,Korea,5,Yami,Jelly
Momentary W Charge  Zero Calories130g,ORIHIRO,No,2.39,2,Japan,5,Yami,Jelly
Sukito Smoothis Apple 130g,ORIHIRO,No,2.49,0,Japan,0,Yami,Jelly
Taro Babu Powder 300g,FULIN,No,14.99,1,Mainland China,5,Yami,Jelly
Instant Herb Powder 10gx12pk/box,GuanXi,No,16.99,1,Mainland China,5,Yami,Jelly
Konjac Halloween Limited Purple Grape + Orange 20g 12 pieces,ORIHIRO,No,4.89,2,Japan,4,Yami,Jelly
Konjac Powder Pineapple Flavor 40g,KANGYAKU,4 Options,1.29,10,Mainland China,4.7,Yami,Jelly
Nomu Konnyaku Peach 130g,YAMAKICHI SEIKA,3 Options,2.29,0,Japan,0,Yami,Jelly
Nomu Konnyaku Strawberry 130g,YAMAKICHI SEIKA,3 Options,2.29,0,Japan,0,Yami,Jelly
Nomu Konnyaku Acerola 130g,YAMAKICHI SEIKA,No,2.09,0,Japan,0,Yami,Jelly
Liang Xia Fen Dessert Powder Shrimp Flavor 250g,KANGYAKU,No,2.39,16,Mainland China,4.5,Yami,Jelly
Spot Serum For Sensitive Skin with Bee Venom Honey Royal Jelly Propolis Extract 30ml,A.C.CARE,No,38,0,Korea,0,Yami,Jelly
Placenta C beauty Jelly Mango taste (31 sticks),Earth,5 Options,26,0,Japan,0,Yami,Jelly
Kyotsuru Yokan K10 480g,KAWAI,No,14.99,0,Japan,0,Yami,Jelly
Sukito Smoothie Orange 130g,ORIHIRO,No,2.49,0,Japan,0,Yami,Jelly
Konjac Powder Orange Flavor 40g,KANGYAKU,4 Options,1.29,11,Mainland China,4.2,Yami,Jelly
Nomu Konnyaku Grape 130g,YAMAKICHI SEIKA,No,2.09,0,Japan,0,Yami,Jelly
1 month plenty of moisture Placenta C jelly acerola taste (31 sticks),Earth,5 Options,26,0,Japan,0,Yami,Jelly
[Limited Quantity] Momopuri Moisturizing Jelly Face Wash 100g,BCL,No,10.4,0,Japan,0,Yami,Jelly
Hyaluronic acid C jelly for moisturizing skin (31 sticks),Earth,5 Options,26,0,Japan,0,Yami,Jelly
Shiseido Maquillage Dramatic Cover Jelly BB Light Beige 30g,MAQuillAGE,No,43.18,0,Japan,0,Yami,Jelly
OKAMOTO Condoms Zero One Plenty Of Jelly 3pcs,OKAMOTO,4 Options,10.79,5,Japan,5,Yami,Jelly
Maquillage Dramatic Nude Jelly BB SPF50 + ・ PA +++ 30g,MAQuillAGE,No,42.17,0,Japan,0,Yami,Jelly
Benefique Essential All-in-One Jelly 170ml,BENEFIQUE,No,43.79,0,Japan,0,Yami,Jelly
Royal Jelly Serum 30ml,AQUALABEL,No,30.72,0,Japan,0,Yami,Jelly
Club Frozen Jelly Essence Limited quantity 160ml,CLUB,No,16.88,0,Japan,0,Yami,Jelly
SHISEIDO Maquillage Dramatic Jelly Compact #03 14g,MAQuillAGE,No,45.16,0,Japan,0,Yami,Jelly
utena premium Golden jelly mask Royal Jelly 3p,UTENA,4 Options,6.99,0,Japan,0,Yami,Jelly
BCL Susie Stand Body Jelly 150g,BCL,No,15.21,0,Japan,0,Yami,Jelly
BCL MOMOPURI JELLY MASK 4p,BCL,No,7.53,7,Japan,4.4,Yami,Jelly
Saborino Good morning jelly FO 180ml,BCL,No,22,0,Japan,0,Yami,Jelly
Active Jellyfish Vital Mask Prime 10 Sheets,JMsolution,10 Options,8.99,22,Korea,5,Yami,Jelly
Pharmaceutical Q10 Collagen Peptides 30ml x 10 Bottles,sato,2 Options,30.5,56,Japan,5,Yami,Jelly
Traceless dispensing jelly glue nursing underwear one piece gather maternity underwear lactation bra XL size brown,SUJIIN,21 Options,34.5,0,Mainland China,0,Yami,Jelly
Seamless dispensing jelly glue nursing underwear one piece gather maternity underwear lactation bra XL size black,SUJIIN,21 Options,34.5,0,Mainland China,0,Yami,Jelly
Traceless dispensing jelly gel underwear one piece gathering pregnant women breastfeeding bra M size bean paste color,SUJIIN,21 Options,34.5,0,Mainland China,0,Yami,Jelly
Traceless dispensing jelly glue nursing underwear one piece gather maternity underwear lactation bra L code brown,SUJIIN,21 Options,34.5,0,Mainland China,0,Yami,Jelly
Seamless dispensing jelly glue nursing underwear one piece gather maternity underwear lactation bra XL size orange,SUJIIN,21 Options,34.5,0,Mainland China,0,Yami,Jelly
Deep Charge Collagen two types of Grape Jelly 10pack/1bag,FANCL,8 Options,39.99,0,Japan,0,Yami,Jelly
Cleansing Gel Wholesale jelly EX 150g,IPSA,4 Options,56,0,Japan,0,Yami,Jelly
Deep Charge Collagen Stick Jelly 30pack/3bag,FANCL,8 Options,122.56,0,Japan,0,Yami,Jelly
Traceless dispensing jelly gel underwear one piece gathering pregnant women breastfeeding bra XL size bean paste color,SUJIIN,21 Options,34.5,0,Mainland China,0,Yami,Jelly
Drone Pupae Freeze-Dried Tablets Royal Jelly Freeze-Dried Powder Male Tonic 36g,Nanjing Tongrentang,No,31.9,0,Mainland China,0,Yami,Jelly
Traceless dispensing jelly glue nursing underwear one piece gather maternity underwear lactation bra M size brown,SUJIIN,21 Options,34.5,0,Mainland China,0,Yami,Jelly
Condom Jelly Cover Hyaluronic Acid Time Control Cover 12 Pack Gold,Pleasure More,2 Options,12.2,0,Mainland China,0,Yami,Jelly
Deep Charge Collagen Stick Jelly 10pack/1bag,FANCL,8 Options,39.89,0,Japan,0,Yami,Jelly
No trace dispensing jelly glue nursing underwear one piece gather maternity underwear lactation bra XL size gray,SUJIIN,21 Options,34.5,0,Mainland China,0,Yami,Jelly
Traceless dispensing jelly glue nursing underwear one piece gather maternity underwear lactation bra M code skin color,SUJIIN,21 Options,34.5,0,Mainland China,0,Yami,Jelly
Traceless dispensing jelly glue nursing underwear one piece gather maternity underwear lactation bra XL code skin color,SUJIIN,21 Options,34.5,0,Mainland China,0,Yami,Jelly
Deep Charge Collagen two types of Grape Jelly 30pack/3bag,FANCL,8 Options,122.56,0,Japan,0,Yami,Jelly
Traceless dispensing jelly glue nursing underwear one piece gather pregnant women underwear lactation bra M code green,SUJIIN,21 Options,34.5,0,Mainland China,0,Yami,Jelly
Condom Jelly Cover Hyaluronic Acid Time Control Cover 12 Pack Silver,Pleasure More,2 Options,12.2,0,Mainland China,0,Yami,Jelly
No trace dispensing jelly glue nursing underwear one piece gather maternity underwear lactation bra M size gray,SUJIIN,21 Options,34.5,0,Mainland China,0,Yami,Jelly
No trace dispensing jelly glue nursing underwear one piece gather maternity underwear lactation bra M size orange,SUJIIN,21 Options,34.5,0,Mainland China,0,Yami,Jelly
Traceless dispensing jelly glue nursing underwear one piece gathered pregnant women underwear lactation bra L code green,SUJIIN,21 Options,34.5,0,Mainland China,0,Yami,Jelly
3D jelly material Yin buttocks inverted mold two-dimensional simulation male adult products Magic Frontline,Mizz zee,No,148.5,0,Mainland China,0,Yami,Jelly
Maquillage Dramatic Nude Jelly BB SPF50 + ・ PA +++ 30g,SHISEIDO,No,38.09,0,Japan,0,Yami,Jelly
Prebiotic Blueberry Enzyme Jelly Fruit and Vegetable Powder Meal Replacement Powder for Weight Loss 105g,Nanjing Tongrentang,No,26.9,0,Mainland China,0,Yami,Jelly
POLA Smart Lactic Acid Bacteria (R) Clean Jelly Fine Treat Value 90 packets,POLA,No,142.88,0,Japan,0,Yami,Jelly
moody Bubble Tea Collection Tangerine Jelly (Amber Brown)  6 Months  1 Piece 0,moody,26 Options,14,0,Mainland China,0,Yami,Jelly
Traceless dispensing jelly gel underwear one piece gathering pregnant women breastfeeding bra L code bean paste color,SUJIIN,21 Options,34.5,0,Mainland China,0,Yami,Jelly
No trace dispensing jelly glue underwear one piece gathered pregnant women underwear lactation bra L code skin color,SUJIIN,21 Options,34.5,0,Mainland China,0,Yami,Jelly
Traceless dispensing jelly glue nursing underwear one piece gather maternity underwear lactation bra L size black,SUJIIN,21 Options,34.5,0,Mainland China,0,Yami,Jelly
Traceless dispensing jelly glue nursing underwear one piece gather maternity underwear lactation bra L size gray,SUJIIN,21 Options,34.5,0,Mainland China,0,Yami,Jelly
Traceless dispensing jelly glue nursing underwear one piece gather maternity underwear lactation bra XL code green,SUJIIN,21 Options,34.5,0,Mainland China,0,Yami,Jelly
Traceless dispensing jelly glue nursing underwear one piece gather maternity underwear lactation bra M size black,SUJIIN,21 Options,34.5,0,Mainland China,0,Yami,Jelly
No trace dispensing jelly glue nursing underwear one piece gather maternity underwear lactation bra L size orange,SUJIIN,21 Options,34.5,0,Mainland China,0,Yami,Jelly
0.02 Condoms Jelly double 6pcs,OKAMOTO,No,10.99,0,Japan,0,Yami,Jelly
Check Jelly Blusher #1 Strawberry Chou 8g,TOO COOL FOR SCHOOL,6 Options,12,0,Korea,0,Yami,Jelly
IRON JELLY 90 tablets 450g,HABA,No,39.99,0,Japan,0,Yami,Jelly
Zero One L size Plenty Of Jelly Condom 3pcs,OKAMOTO,No,17.99,1,Japan,5,Yami,Jelly
Jelly Mask Double Hyaluronic Acid Deep moisturizing 3pcs lavender essence,UTENA,No,10.79,0,Japan,0,Yami,Jelly
Mentholatum Medicinal Lip Jelly 8g,ROHTO,No,8.99,0,Japan,0,Yami,Jelly
JELLY LUMINOUS SLEEPING MASK,JMsolution,No,25.26,0,Korea,0,Yami,Jelly
Premium Puresa Golden Jelly Mask Brithening 3pcs,UTENA,No,15.99,0,Japan,0,Yami,Jelly
Royal Jelly Anti-Aging Emulsion 130ml,AQUALABEL,No,77.88,0,Japan,0,Yami,Jelly
JELLY LUMINOUS HAIR TREATMENT (Pack of 5),JMsolution,No,30,0,Korea,0,Yami,Jelly
Royal Jelly Anti-Aging Lotion  (Moist M Type) 200ml,AQUALABEL,No,77.88,0,Japan,0,Yami,Jelly
Collagen Jelly 90 days,POLA,2 Options,145.5,4,Japan,5,Yami,Jelly
Varie Gold Jelly Mask Activating Anti-Agin Type 3sheets,UTENA,3 Options,7.05,2,Japan,4.5,Yami,Jelly
Natural Wild Tao Jiao Peach Gum Jelly for Skin Health 16oz,PRESIDENT BRAND,No,18.99,0,United States,0,Yami,Jelly
Jeju Cherry Blossom Jelly Cream 50ml,INNISFREE,No,12,0,Korea,0,Yami,Jelly
MOMO PURI Jelly Mask 4pcs,BCL,No,8.49,0,Japan,0,Yami,Jelly
Oral Jelly Generate Sexual Excitement,KAMAGRA,No,49.99,0,India,0,Yami,Jelly
Papa Jelly 5 Vitamin Calcium Pantothenate Strawberry,OHKISEIYAKU,No,27,6,Japan,5,Yami,Jelly
Premium Royal Jelly 1000mg 120 softgels,NUTRIDOM,4 Options,65,1,Canada,5,Yami,Jelly
JELLY LUMINOUS LIP SLEEPING MASK 20g,JMsolution,No,24,0,Korea,0,Yami,Jelly
Momopuri Peach Jelly Mask 4pcs,BCL,No,11.99,1,Japan,5,Yami,Jelly
PREMIUM PUReSA Golden Jelly Mask Royal Jelly 3sheets,UTENA,No,7.9,2,Japan,5,Yami,Jelly
Repairing Jelly Mask 4pcs,MEGUMI NO HONPO,No,25.99,2,Japan,5,Yami,Jelly
JELLY LUMINOUS CLEANSING BALM 110ml,JMsolution,No,38,0,Korea,0,Yami,Jelly
JELLY LUMINOUS CLEANSING GEL 150ml,JMsolution,No,25,0,Korea,0,Yami,Jelly
JELLY LUMINOUS TONER 200ml,JMsolution,No,55,0,Korea,0,Yami,Jelly
0.02 Condoms Jelly double 6pcs,OKAMOTO,6 Options,11.2,0,Japan,0,Yami,Jelly
Papa Jelly 5 Vitamin Calcium Pantothenate Strawberry,OHKISEIYAKU,No,28.86,0,Japan,0,Yami,Jelly
Diet Maru Jelly 12g x 10 bags,EISHIN,No,15.86,0,Japan,0,Yami,Jelly
Jelly Mask Collagen #Blue 1 Box 3 sheets,UTENA,3 Options,6.99,7,Japan,4.3,Yami,Jelly
Varie Gold Jelly Mask Type Double Hyaluronic Acid 3sheets,UTENA,4 Options,7.5,2,Japan,4.5,Yami,Jelly
JAPAN Collagen Jelly 30 Days,POLA,2 Options,45.45,1,Japan,5,Yami,Jelly
POLA Collagen Jelly 30 Days,POLA,No,62.58,0,Japan,0,Yami,Jelly
Check Jelly Blusher #7 Peony Mauve 8g,TOO COOL FOR SCHOOL,6 Options,12,0,Korea,0,Yami,Jelly
Hyaluronic Acid Condom 001 Ultra-thin Large Grain Spike Oil Condom Black Jelly Box of 10,OKAMOTO,No,16.5,0,Japan,0,Yami,Jelly
0.02 Ex Lubricating Jelly 60g,OKAMOTO,No,19.99,2,Japan,5,Yami,Jelly
Check Jelly Blusher #2 Apricot Sherbet 8g,TOO COOL FOR SCHOOL,6 Options,12,0,Korea,0,Yami,Jelly
Placenta C Collagen Jelly VC Hyaluronic Acid Beauty 10g*7bag,EARTH CHEMICAL,No,10.88,0,Japan,0,Yami,Jelly
Lactic Acid Bacteria Jelly Fine Treat 90 Bags,POLA,No,143.58,1,Japan,5,Yami,Jelly
Varie Gold Jelly Mask Activating Anti-Agin Type 3sheets,UTENA,4 Options,7.5,1,Japan,5,Yami,Jelly
Papa Jelly 5 Vitamin Calcium Pantothenate Lemon 120 Pills,OHKISEIYAKU,No,28.58,1,Japan,5,Yami,Jelly
Fish CollagenC VC Hyaluronic Acid Jelly Blueberry Flavor 10g*7bag,EARTH CHEMICAL,No,10.88,0,Japan,0,Yami,Jelly
Jelly Sakura Essence Moisturizing Mask 1 box/3 pieces,UTENA,No,10.79,0,Japan,0,Yami,Jelly
0.02 Condoms Jelly double 6pcs,OKAMOTO,No,15.99,0,Japan,0,Yami,Jelly
Jelly inverted model name device transparent airplane cup male masturbation device pink model,D-PENG,4 Options,30.7,0,Mainland China,0,Yami,Jelly
JELLY LUMINOUS MASK (Pack of 10),JMsolution,No,17,0,Korea,0,Yami,Jelly
Papa Jelly 5 Vitamin Calcium Pantothenate Strawberry,OHKISEIYAKU,No,31.99,0,Japan,0,Yami,Jelly
JELLY LUMINOUS EYE PATCH 90g,JMsolution,No,24,0,Korea,0,Yami,Jelly
JELLY LUMINOUS MOISTURE CREAM 50ml,JMsolution,No,58,0,Korea,0,Yami,Jelly
Beautiful girl jelly model name device transparent airplane cup male masturbation device black model,D-PENG,4 Options,30.7,0,Mainland China,0,Yami,Jelly
Enrich Jelly Mask 4pcs,MEGUMI NO HONPO,No,25.99,0,Japan,0,Yami,Jelly
Golden Jelly Facial Mask Lavender 3pcs,UTENA,No,15.99,0,Japan,0,Yami,Jelly
Lamb Placenta & Royal Jelly with Vitamin E Facial Oil 200capsules,Bill,7 Options,45.93,3,Canada,5,Yami,Jelly
Beijing Tong Ren Tang Blue Berry Enzyme Jelly Bars Contain Collagen Meal Replacement Healthy Leisure Snacks 140g,TONG REN TANG,No,64.99,0,Mainland China,0,Yami,Jelly
Collagen Jelly 90 days,POLA,No,153.58,0,Japan,0,Yami,Jelly
Antiperspirant Deodorant Jelly 50g,KOBAYASHI,No,45.48,0,Japan,0,Yami,Jelly
Momopuri Peach Jelly Mask 4pcs,BCL,No,11.99,0,Japan,0,Yami,Jelly
Royal Jelly 30 days 180 capsules,FANCL,No,99.99,0,Japan,0,Yami,Jelly
Royal Jelly Anti-Aging Lotion  (Moist RM Type) 200ml,AQUALABEL,No,77.88,0,Japan,0,Yami,Jelly
PREMIUM PUReSA Golden Jelly Mask Brightening 3pcs,UTENA,No,10.79,0,Japan,0,Yami,Jelly
Varie Gold Jelly Mask Type Double Hyaluronic Acid 3sheets,UTENA,No,10.78,0,Japan,0,Yami,Jelly
Beautiful girl jelly inverted model name device transparent airplane cup male masturbation device white model,D-PENG,4 Options,30.7,0,Mainland China,0,Yami,Jelly
Aloe vera powder moisturizing hyaluronic acid jelly ultra-thin 12 pieces,ELASUN,No,14.99,0,Thailand,0,Yami,Jelly
Royal Jelly Anti-Aging Wash Cream 110g,AQUALABEL,No,57.88,0,Japan,0,Yami,Jelly
Premium Puresa Collagen Golden Jelly Mask 3pcs,UTENA,No,12.99,0,Japan,0,Yami,Jelly
Cup Pudding 3pc,Taro pudding,No,18.5,0,Japan,0,Yami,Jelly
