Product_Name,Brand,Option,Price,Reviews,Origin,Rate,Platform,Category
Soybean Rice cake Chocolate,MEIJI,No,3.2,17,Japan,4.6,Yami,Jelly
Caramel Pudding 1pc,Bunmeido,No,6.5,1,Japan,5,Yami,Jelly
Core Fudge Strawberry flavor 50g,BESTORE,No,4.99,1,Mainland China,5,Yami,Jelly
BREATH CARE MINT 50 tablets,KOBAYASHI,No,6.5,4,Japan,4.5,Yami,Jelly
HOKKAIDO Almond Matcha Chocolate 190g,ROYCE,No,18.5,2,Japan,4.5,Yami,Jelly
Chocolates Egg Roll 5pc,message de rose,No,24.99,2,Japan,5,Yami,Jelly
Fruit Juice Pudding Litchi 100g*4pcs,jeagueijih,No,9.49,3,Taiwan,4.7,Yami,Jelly
BVLGARI IL CHOCOLATE Valentine Day Limited 10pc,bvlgari il cioccolato,No,175,0,Japan,0,Yami,Jelly
Fruit Juice Pudding Strawberry 100g*4pcs(Shelf life:2022/5/12),jeagueijih,No,5.99,0,Taiwan,0,Yami,Jelly
Mango Sorbet 504g 14pcs,Kuo Yuan Ye,No,17.09,0,Taiwan,0,Yami,Jelly
BVLGARI IL CHOCOLATE Valentine Day Limited 5pc,bvlgari il cioccolato,No,75,0,Japan,0,Yami,Jelly
JAPAN Creme Brulee 1pc,Bunmeido,No,6.35,5,Japan,5,Yami,Jelly
JAPAN MELTYKISS Brandy & Orange Chocolate 80g,MEIJI,1 Options,4.69,8,Japan,4.6,Yami,Jelly
Fruit Juice Pudding Mango100g*4 pcs,jeagueijih,No,9.49,0,Taiwan,0,Yami,Jelly
BREATH CARE Lemon 50 tablets,KOBAYASHI,No,7.9,3,Japan,3.7,Yami,Jelly
SKIN TIGHTENING WHITE FACE MASK 6PC,ZEFF,No,21,0,Japan,0,Yami,Jelly
JAPAN BREATH CARE Peach 50 tablets,KOBAYASHI,No,7.9,8,Japan,4.4,Yami,Jelly
MARY‘s Christmas Limited Chocolate Gift Box 24pc,MARY'S,No,29.9,0,Japan,0,Yami,Jelly
MILO Nuggets Chocolate Flavoured Confectionery 25g,NESTLE,No,1.59,0,Japan,0,Yami,Jelly
Low Calories Konjac Jelly Drink Grape Flavor 150ml,Jelly.B,10 Options,1.69,221,Korea,4.7,Yami,Jelly
Low Calories Konjac Jelly Drink Mango Flavor 150ml,Jelly.B,10 Options,1.69,134,Korea,4.7,Yami,Jelly
WAKASHOU CHIA SEED Mini Momo Flavor 104g,CHIA SEED JELLY,4 Options,2.99,9,Japan,4.7,Yami,Jelly
WAKASHOU Chia Seed Konjac Mini Ringo Flavor 104g,CHIA SEED JELLY,4 Options,2.99,5,Japan,4.8,Yami,Jelly
WAKASHOU Chia Seed Konjac Mini Grape Flavor 104g,CHIA SEED JELLY,4 Options,2.99,12,Japan,4.8,Yami,Jelly
CICI Jelly Drink Strawberry 150g,STRONGFOOD,9 Options,1.19,19,Mainland China,4.9,Yami,Jelly
Konjac Jelly Apple and Grape Flavor 20g*12,ORIHIRO,No,4.69,15,Japan,5,Yami,Jelly
Konjac Jelly Muscat and Orange Flavor 20g*12,ORIHIRO,No,7.09,6,Japan,5,Yami,Jelly
CICI Jelly Drink  Lychee Flavor 150g,STRONGFOOD,9 Options,1.19,0,Mainland China,4.8,Yami,Jelly
Konjac Jelly Peach and Litchi Flavor 20g*12,ORIHIRO,No,7.09,1,Japan,5,Yami,Jelly
Konjac Jelly Cherry Flavor 130g,ORIHIRO,No,2.99,6,Japan,4.3,Yami,Jelly
Milky Red Beans Herbal Jelly 222g*2Cups 444g,SUNITY,5 Options,4.59,243,Mainland China,4.7,Yami,Jelly
Herbal Jelly Original Flavors 215g*3Cups,SUNITY,6 Options,3.49,155,Mainland China,4.7,Yami,Jelly
Herbal Jelly 250g,COINS,4 Options,1.49,131,Mainland China,4.9,Yami,Jelly
CICI Jelly Drink  Pineapple Flavor 150g,STRONGFOOD,9 Options,1.19,94,Mainland China,4.9,Yami,Jelly
Konjac Jelly Strawberry Flavor 20g*6pcs,ORIHIRO,No,2.69,3,Japan,4.3,Yami,Jelly
Konjac Jelly Grape+Strawberry Flavor 20g*12pcs,ORIHIRO,No,4.99,4,Japan,5,Yami,Jelly
Lychee Jelly 400g,JINGJING,2 Options,1.79,139,Taiwan,4.8,Yami,Jelly
White Peach Pulp Jelly 210g,TARAMI,No,3.69,2,Japan,4,Yami,Jelly
Jelly Orange Flavor 6pcs 120g,ORIHIRO,No,2.59,72,Japan,4.9,Yami,Jelly
Fruits Jelly Drink Lychee Flavor 150g,SHIRAKIKU,10 Options,1.19,127,Japan,4.8,Yami,Jelly
Herbal Jelly with Litchi Juice and Honey 1265g,SUNITY,6 Options,6.99,96,Mainland China,4.8,Yami,Jelly
Herbal Jelly Rock Sugar & Lotus Seed 3cups 215g*3,SUNITY,6 Options,2.99,110,Mainland China,4.7,Yami,Jelly
CICI Jelly Drink Orange Flavor 150g,STRONGFOOD,9 Options,1.19,77,Mainland China,4.9,Yami,Jelly
CICI Jelly Drink Grape Flavor 150g,STRONGFOOD,9 Options,1.19,145,Mainland China,4.8,Yami,Jelly
SCHENG Mixed Fruit Flavored Jelly 280g,TRIKOFOODS,2 Options,1.49,56,Taiwan,4.6,Yami,Jelly
Loquat Autumn Pear Jelly 70g*5,SUNITY,No,5.99,19,Mainland China,4.4,Yami,Jelly
Jelly Passion Fruit Strawberry Green Plum Konjac Jelly 240g,LIULIUMEI,No,4.29,11,Mainland China,4.9,Yami,Jelly
Jelly Dessert Pink Grapefruit Flavor 210g,TARAMI,No,3.49,6,Japan,4.7,Yami,Jelly
Jelly Green Plum & Mango Green Plum & Konjac Jelly 240g,LIULIUMEI,No,4.29,16,Mainland China,4.9,Yami,Jelly
Fruits Jelly Drink Grape Flavor 150g,SHIRAKIKU,10 Options,1.19,106,Japan,4.7,Yami,Jelly
Herbal Jelly with Osmanthus and Honey 1265g,SUNITY,6 Options,6.89,135,Mainland China,4.7,Yami,Jelly
Konjac Jelly Peach and Grapefruit Flavor 240g 12pc,ORIHIRO,8 Options,4.29,11,Japan,4.5,Yami,Jelly
CICI Jelly Drink Apple Flavor 150g,STRONGFOOD,9 Options,1.19,87,Mainland China,4.9,Yami,Jelly
Herbal Jelly Rock Sugar & Lily Seed 3cups 215g*3,SUNITY,6 Options,2.99,117,Mainland China,4.8,Yami,Jelly
Herbal Jelly Cranberry Coconut Flavor 246g*2cups,SUNITY,3 Options,5.29,61,Mainland China,4.7,Yami,Jelly
Jelly Kiwi Flavor 6pcs 120g,ORIHIRO,8 Options,2.59,50,Japan,4.8,Yami,Jelly
Jelly Apple Flavor 6pcs 120g,ORIHIRO,No,2.59,47,Japan,4.8,Yami,Jelly
Jelly Cherry Flavor 6pcs 120g,ORIHIRO,No,2.59,35,Japan,4.7,Yami,Jelly
Herbal Jelly Honey & Ginseng 3cups 215g*3,SUNITY,6 Options,3.29,28,Mainland China,4.8,Yami,Jelly
Assorted Jelly Strip 400g,JINGJING,4 Options,1.79,16,Taiwan,4.9,Yami,Jelly
Herbal Jelly in Cup Gift Set,SUNITY,No,11.99,14,Mainland China,4.7,Yami,Jelly
Herbal Jelly Chia Seeds Natural Osmanthus&Honey 230g*4,SUNITY,4 Options,5.09,32,Mainland China,4.4,Yami,Jelly
Herb Jelly Original Flavor 210g,COINS,4 Options,0.99,19,Mainland China,4.1,Yami,Jelly
Jelly Banana Flavor 6pcs 120g,ORIHIRO,8 Options,2.59,25,Japan,4.6,Yami,Jelly
Herb Jelly Chrysanthemum Flavor 210g,COINS,4 Options,0.99,15,Mainland China,4.8,Yami,Jelly
FRUIT  BEAUTY Vitamin C Jelly Grapefruit  Yogurt Flavor 165g     8/13/2017,TARAMI,No,2.59,25,Japan,3.9,Yami,Jelly
Fruit Jelly Litchi 160g,ROYAL FAMILY,6 Options,1.69,6,Taiwan,4.5,Yami,Jelly
JELLY LEMON 160g,MILI,No,1.79,10,Mainland China,4.9,Yami,Jelly
Jelly 0kcal Grape Flavor 130g,ORIHIRO,3 Options,2.49,2,Japan,5,Yami,Jelly
Jelly Drink Mixed Flavor 150g,WANT WANT,No,3.59,7,Taiwan,4.6,Yami,Jelly
Fruit Jelly Grape 160g,ROYAL FAMILY,6 Options,1.69,10,Taiwan,4.1,Yami,Jelly
JELLY PEAR WHITE FUNGUS 152g,MILI,2 Options,1.79,10,Mainland China,4.2,Yami,Jelly
Collagen Jelly Jasmine Flavor 190g,CLEVER MAMA,4 Options,4.19,9,Korea,3.4,Yami,Jelly
Jelly Drink Apple Flavor 150g,TARAMI,3 Options,2.09,8,Japan,4.5,Yami,Jelly
PORORO Konjac jelly Tropical Fruit Flavor,BIOSTAR PORORO,3 Options,1.99,8,Korea,3.9,Yami,Jelly
WANTWANT Strawberry Jelly 132g,WANT WANT,No,1.99,1,Taiwan,5,Yami,Jelly
Grass Jelly Drink Red Bean Flavor 218g,COINS,No,1.99,4,Mainland China,4.8,Yami,Jelly
Ringo Flavor Jelly 360g,YUKIGURI AGURI,No,4.99,2,Japan,4.5,Yami,Jelly
Grass Jelly Drink Original Flavor 218g,COINS,No,1.99,2,Mainland China,5,Yami,Jelly
Grape Jelly Drink 490ml,DYDO,No,2.49,0,Japan,0,Yami,Jelly
Reishi Herbal Jelly 3cups,SUNITY,6 Options,2.99,62,Mainland China,4.7,Yami,Jelly
Konjac Jelly Peach and Grape Flavor 20g*12,ORIHIRO,No,5.99,5,Japan,5,Yami,Jelly
Fruit Jelly Grape Flavor 187g,YUKIGUNI AGURI,No,2.49,1,Japan,5,Yami,Jelly
Fruits Jelly Drink Peach Flavor 150g,SHIRAKIKU,10 Options,1.19,63,Japan,4.6,Yami,Jelly
Yogurt Jelly Candy Peach Flavor 50g,PALDO,No,1.49,109,Korea,4.7,Yami,Jelly
Jelly Cup Lychee Flavor 2 Cups 400g,SHIRAKIKU,7 Options,3.69,45,Japan,4.4,Yami,Jelly
Fruits Jelly Drink Aloe Flavor 150g,SHIRAKIKU,10 Options,1.19,128,Japan,4.5,Yami,Jelly
Jelly Dessert Grape Flavor 210g,TARAMI,4 Options,3.69,6,Japan,4.8,Yami,Jelly
Konjac Jelly Sweet Peach 150g x10 Packs,DR.LIV,No,17.49,35,Korea,4.8,Yami,Jelly
Diet Maru Jelly 12g x 10 bags,EISHIN,No,17.99,18,Japan,4.9,Yami,Jelly
Heart-shaped Fruit Juice Collagen Jelly Grapefruit Flavor 54g,KANRO,3 Options,3.29,6,Japan,4,Yami,Jelly
Peach Jelly 130g,RIBBON,3 Options,2.79,1,Japan,5,Yami,Jelly
Pururi Matcha Azuki-Jelly Candy  170g,TSUYAMAYA,No,5.99,2,Japan,4.5,Yami,Jelly
Jelly Red Grape Flavor 6pcs 120g,ORIHIRO,8 Options,2.59,57,Japan,4.9,Yami,Jelly
Milky Purple Rice Herbal Jelly 222g*2Cups 444g,SUNITY,5 Options,4.69,219,Mainland China,4.6,Yami,Jelly
Konjac Jelly Mixed Fruit Flavor 480g,JINSIBO,No,3.89,1,Mainland China,5,Yami,Jelly
Herbal Jelly and Honey 1265g,SUNITY,6 Options,5.99,65,Mainland China,4.6,Yami,Jelly
Konjac Jelly Lemon Flavor 120g 6pc,ORIHIRO,8 Options,2.29,8,Japan,5,Yami,Jelly
Jelly Cup Peach Flavor 2 Cups 400g,SHIRAKIKU,7 Options,3.59,58,Japan,4.7,Yami,Jelly
Jelly Cup Orange Flavor 2 Cups 400g,SHIRAKIKU,7 Options,3.89,21,Japan,4.1,Yami,Jelly
Herbal Jelly Brown Sugar 205g*2,SUNITY,No,3.69,3,Mainland China,4.3,Yami,Jelly
Herbal Jelly in Cup Original Flavor 230g,SUNITY,2 Options,1.59,68,Mainland China,4.7,Yami,Jelly
Jelly Drink Peach Flavor 150g,WANT WANT,4 Options,0.79,37,Taiwan,4.5,Yami,Jelly
Herbal Jelly Coffee Flavor 180g*2cups,SUNITY,2 Options,4.29,55,Mainland China,4.8,Yami,Jelly
Jelly Cup Mixed Fruit Flavor 2 Cups 400g * 3,SHIRAKIKU,7 Options,7.79,41,Japan,4.4,Yami,Jelly
JINJIN Sun Moon Lake Black Tea Flavor Jelly 490g,JINGJING,4 Options,1.59,13,Taiwan,4.2,Yami,Jelly
Fruit Jelly Assorted Lychee Mango Grape 1000g,ROYAL FAMILY,No,4.99,19,Taiwan,4.6,Yami,Jelly
Jelly Coffee Flavor 6pc,ORIHIRO,3 Options,2.99,4,Japan,4.2,Yami,Jelly
Ai Yu Jelly 540g,CHINCHIN,No,1.99,9,Taiwan,3.4,Yami,Jelly
Konjac Jelly Guava 312g,jeagueijih,No,3.99,7,Taiwan,4.7,Yami,Jelly
Water Jelly Peach Flavor 120ml,BIOSTAR PORORO,2 Options,1.09,12,Korea,4.7,Yami,Jelly
Strawberry + Peach Yogurt Jelly 501g,ROYAL FAMILY,No,5.49,10,Taiwan,4.6,Yami,Jelly
Fruit Jelly Passion Fruit 160g,ROYAL FAMILY,6 Options,1.69,12,Taiwan,3.9,Yami,Jelly
QOO Jelly Drink Mango Apple Falvour 125g,MINUTE MAID,No,2.69,10,United States,4.4,Yami,Jelly
Jelly Dessert Peach 160g,BOURBON,No,1.99,10,Japan,4,Yami,Jelly
YUKI/LOVE JUICY JELLY LYCHEE 200g,YUKI&LOVE,5 Options,2.49,5,Taiwan,4.2,Yami,Jelly
Yogurt Jelly Original  Flavor 500g,ROYAL FAMILY,No,5.49,10,Taiwan,4.8,Yami,Jelly
Collagen Jelly Rose Flavor 190g,CLEVER MAMA,4 Options,4.19,9,Korea,3.3,Yami,Jelly
Herbal Jelly Chia Seeds Natural Ginseng&Honey 230g*4,SUNITY,4 Options,5.09,14,Mainland China,3.2,Yami,Jelly
Fruit Jelly Litchi & Mango 300g,ROYAL FAMILY,6 Options,2.89,0,Taiwan,2.8,Yami,Jelly
Jelly Grapefruit Flavor 6pcs 120g,ORIHIRO,8 Options,2.59,2,Japan,4.5,Yami,Jelly
Herbal Jelly Rock Sugar & Chrysanthemum 3cups,SUNITY,6 Options,2.99,119,Mainland China,4.6,Yami,Jelly
YUKI/LOVE JUICY JELLY BLUEBERRY 200g,YUKI&LOVE,5 Options,2.29,0,Taiwan,0,Yami,Jelly
Creamy Cafe Jelly 240g,DYDO,No,2.49,2,Japan,3,Yami,Jelly
Jelly Matcha Flavor 6pc,ORIHIRO,3 Options,2.99,5,Japan,4.8,Yami,Jelly
Jelly Drink Mango Flavor 150g,TARAMI,3 Options,2.09,6,Japan,4.5,Yami,Jelly
PORORO Konjac jelly Apple Flavor,BIOSTAR PORORO,3 Options,1.99,8,Korea,4.6,Yami,Jelly
Grape + Lychee Fruit Flavor Jelly 500g,ROYAL FAMILY,No,5.49,6,Taiwan,5,Yami,Jelly
Jelly Chocolate Flavor 6pc,ORIHIRO,3 Options,2.99,5,Japan,4.6,Yami,Jelly
Purun and Konjac Jelly Lemon Flavor 130g,ORIHIRO,No,2.29,3,Japan,5,Yami,Jelly
JELLY LOQUAT 152g,MILI,2 Options,1.79,6,Mainland China,4,Yami,Jelly
Mini Cup Jelly (18pcs) 298g,EISHINDO,No,2.19,5,Japan,3.8,Yami,Jelly
Konjac jelly (banana)130g,ORIHIRO,No,2.99,5,Japan,4.6,Yami,Jelly
YUKI/LOVE JUICY JELLY ORANGE 200g,YUKI&LOVE,5 Options,2.29,2,Taiwan,5,Yami,Jelly
Fruit Jelly Litchi & Mango 300g,ROYAL FAMILY,6 Options,2.89,5,Taiwan,2.8,Yami,Jelly
PORORO Konjac jelly Green grape Flavor,BIOSTAR PORORO,3 Options,1.99,2,Korea,4,Yami,Jelly
Milky Oatmeal Herbal Jelly 222g*2Cups 444g,SUNITY,No,3.99,0,Mainland China,0,Yami,Jelly
Jelly Drink White Peach Flavor 150g,TARAMI,No,2.09,0,Japan,0,Yami,Jelly
Jelly Dessert Mango Flavor 210g,TARAMI,4 Options,3.69,7,Japan,3.9,Yami,Jelly
Vilac Yogurt Jelly 50g,PALDO,2 Options,1.49,51,Korea,4.6,Yami,Jelly
Jelly Cup Mixed Fruit Flavor 2 Cups 400g,SHIRAKIKU,7 Options,3.69,41,Japan,4.4,Yami,Jelly
Herbal Jelly Yellow Peach Coconut Flavor 246g*2cups,SUNITY,3 Options,5.29,53,Mainland China,4.8,Yami,Jelly
Jelly Cup Grape Flavor 2 Cups 400g,SHIRAKIKU,7 Options,3.49,30,Japan,4.5,Yami,Jelly
Milky Red Beans Herbal Jelly 222g*2Cups 444g,SUNITY,5 Options,3.99,128,Mainland China,4.7,Yami,Jelly
Jelly Peach Flavor 6pcs 120g,ORIHIRO,8 Options,2.29,62,Japan,4.9,Yami,Jelly
Jelly Peach Mango Red Grape Flavor 20g*24,ORIHIRO,No,8.99,7,Japan,5,Yami,Jelly
Fruits Jelly Drink Aloe Flavor 150g * 4,SHIRAKIKU,10 Options,3.99,28,Japan,4.2,Yami,Jelly
Jelly 248g,HUIERKANG,No,0.89,5,Mainland China,5,Yami,Jelly
Herbal Jelly with Pear Juice and Honey 1265g,SUNITY,6 Options,5.49,116,Mainland China,4.6,Yami,Jelly
CICI Orange Fruit in Jelly 2 Cups,STRONGFOOD,4 Options,2.59,15,Mainland China,3.8,Yami,Jelly
Collagen Jelly Osmanthus Flavor 190g,CLEVER MAMA,4 Options,4.19,13,Korea,4.3,Yami,Jelly
Herbal Jelly Rock Sugar & Chrysanthemum 230g,SUNITY,2 Options,1.59,18,Mainland China,4.2,Yami,Jelly
Herbal Jelly Chia Seeds Natural  Chrysanthemum&Honey 230g*4,SUNITY,4 Options,5.09,18,Mainland China,3.9,Yami,Jelly
Vilac Yogurt Jelly Strawberry Flavor 50g,PALDO,2 Options,1.49,15,Korea,4,Yami,Jelly
【Pack of 10】Milky Oatmeal Herbal Jelly 2 Cups 444g * 5,SUNITY,No,19.99,11,Mainland China,4.5,Yami,Jelly
Herb Jelly Mangosteen (Lohanko) Flavor 210g,COINS,4 Options,0.99,10,Mainland China,4.6,Yami,Jelly
Jelly Drink Orange Fllavor 150g,WANT WANT,4 Options,0.79,11,Taiwan,4.9,Yami,Jelly
Enersupply Jelly 180g,J-HOLDINGS,No,2.49,13,Japan,4.2,Yami,Jelly
Sakura Soft Candy Jelly 140g,SONGWAI,No,3.69,0,Japan,0,Yami,Jelly
Konjac Jelly 750g,OTHER BRANDS,No,4.99,6,Unclear,5,Yami,Jelly
Puruhada Konnyaku Acerola Jelly 150g,SUNTORY,No,2.99,0,Japan,4.4,Yami,Jelly
Pear Jelly Drink 218g,COINS,No,1.99,9,Mainland China,4.7,Yami,Jelly
Fruit Jelly Passion Fruit & Grape 300g,ROYAL FAMILY,6 Options,2.89,10,Taiwan,3.8,Yami,Jelly
Konjac Jelly Pouch Lemon Watermelon Flavor 240g,ORIHIRO,No,4.29,6,Japan,4.5,Yami,Jelly
Fruits Jelly Drink Peach Flavor 150g Pack of 4,SHIRAKIKU,10 Options,4.29,5,Japan,5,Yami,Jelly
Fruit Jelly Mango 160g,ROYAL FAMILY,6 Options,1.69,4,Taiwan,5,Yami,Jelly
Assorted Fruit Jelly 200g,yifen,No,2.49,5,Mainland China,4,Yami,Jelly
Mango + Passion Fruit Jelly 501g,ROYAL FAMILY,No,5.49,6,Taiwan,4.7,Yami,Jelly
Grass Jelly Drink Rose Flavor 218g,COINS,No,1.99,6,Mainland China,4.2,Yami,Jelly
Jelly Drink Grape Flavor 150g,TARAMI,3 Options,2.09,4,Japan,5,Yami,Jelly
Jelly Peach Flavor,MILI,3 Options,3.29,3,Mainland China,5,Yami,Jelly
Fruits Jelly Drink Grape Flavor 150g Pack of 4,SHIRAKIKU,10 Options,4.29,106,Japan,4.7,Yami,Jelly
Grass Jelly Pudding Cup Pomegranate Flavor 230g,yifen,No,2.99,3,Mainland China,3.3,Yami,Jelly
Jelly Mango Flavor 193g,MILI,3 Options,3.29,4,Mainland China,4.8,Yami,Jelly
Assorted Fruit Jelly 250g,OUMA,No,1.39,4,Korea,4.8,Yami,Jelly
Konjac Jelly Kiwi Flavor 130g,ORIHIRO,No,2.99,2,Japan,4.5,Yami,Jelly
Green Tea Jelly 130g,KINJOSEIKA,No,2.29,0,Japan,0,Yami,Jelly
Jelly Strawberry Flavor 193g,MILI,3 Options,3.29,2,Mainland China,4,Yami,Jelly
Herbal Jelly Matcha Flavor 180g*2cups,SUNITY,2 Options,4.29,70,Mainland China,4.9,Yami,Jelly
Fruits Jelly Drink Orange Flavor 150g * 4,SHIRAKIKU,10 Options,4.29,47,Japan,4.6,Yami,Jelly
Herbal Jelly Mixed Taste 253g*3,SUNITY,No,3.99,39,Mainland China,4.8,Yami,Jelly
Herbal Jelly Coconut Flavor 246g*2cups,SUNITY,3 Options,5.29,39,Mainland China,4.7,Yami,Jelly
Jelly Plum Flavor 6pcs 120g,ORIHIRO,No,2.59,35,Japan,4.7,Yami,Jelly
Fruits Jelly Drink Lychee Flavor 150g * 4,SHIRAKIKU,10 Options,3.99,18,Japan,4.4,Yami,Jelly
CICI Peach Fruit in Jelly 2 Cups,STRONGFOOD,4 Options,2.59,19,Mainland China,4.5,Yami,Jelly
CICI Jelly Drink Lemon Flavor 150g,STRONGFOOD,9 Options,0.89,16,Mainland China,4.9,Yami,Jelly
FRUIT & BEAUTY Vitamin C Jelly Orange & Raspberry Sauce 165g,TARAMI,No,2.59,22,Japan,3.7,Yami,Jelly
Sakura Jelly 3pc,eitaro,No,22.99,12,Mainland China,4.7,Yami,Jelly
Collagen Jelly Lavender Flavor 190g,CLEVER MAMA,4 Options,4.19,14,Korea,4.5,Yami,Jelly
XIANCAO BRAND Grass Jelly Sweet Soup Pineapple Flavor 310g,XCLL,No,4.29,0,Mainland China,0,Yami,Jelly
Collagen Juice Jelly Peach Flavor 180g,CLEVER MAMA,4 Options,3.29,11,Korea,4.6,Yami,Jelly
Fruits & Beauty Jelly Vitamin C White Peach Apple Flavor 165g,TARAMI,No,2.49,10,Japan,3.3,Yami,Jelly
Purun and Konjac Jelly Pouch Soda 120g,ORIHIRO,8 Options,2.29,7,Japan,5,Yami,Jelly
Aquarius Jelly Pouch 180g,COCA COLA,No,2.99,3,United States,5,Yami,Jelly
Multi-Vitamins Jelly 180g,J-HOLDINGS,No,2.49,11,Japan,4.1,Yami,Jelly
Collagen Juice Jelly Pear Flavor 180g,CLEVER MAMA,4 Options,3.29,9,Korea,4.7,Yami,Jelly
Vanilla Ice Cream Flavor Jelly 480g,U KISS,2 Options,3.99,3,Mainland China,4.3,Yami,Jelly
0kcal Jelly Peach 130g,ORIHIRO,3 Options,2.49,0,Japan,0,Yami,Jelly
Jelly Cup Peach Flavor 2 Cups 400g * 5,SHIRAKIKU,7 Options,14.69,2,Japan,5,Yami,Jelly
Milky Purple Rice Herbal Jelly 222g*2Cups 444g,SUNITY,No,3.99,0,Mainland China,0,Yami,Jelly
Choco Variety Pack 27pc In Bag Bis Milk Strawberry Jelly Cookie 175g,TIROL,No,6.49,24,Japan,4.5,Yami,Jelly
My Chew Jelly Candy Peach Flavor 32g,CROWN,No,1.29,16,Korea,4.8,Yami,Jelly
AN AN Mixed Jelly Canby 130g,AN-AN,No,2.19,16,Japan,4.2,Yami,Jelly
WANTWANT Chocolate Jelly 132g,WANT WANT,No,1.99,3,Taiwan,5,Yami,Jelly
LIJIANG Rose Jelly 150g,Snow Mountain Farm,2 Options,4.49,10,Mainland China,4,Yami,Jelly
Ginger Jelly Candy 200g,HAITAI,No,3.69,1,Korea,5,Yami,Jelly
【Halloween Exclusive】Premium Jelly Pack (good for 10-15 kids),OTHER BRANDS,No,11.99,0,Unclear,0,Yami,Jelly
Heart-shaped Fruit Juice Collagen Jelly Honey Melon Flavor 54g+Grape Fruit 54g,KANRO,No,6.58,0,Japan,0,Yami,Jelly
CALPIS Jelly Filling Marshmallow 80g,EIWA,No,2.29,48,Japan,4.8,Yami,Jelly
LIJIANG Peach Jelly 150g,Snow Mountain Farm,2 Options,5.49,17,Mainland China,4.4,Yami,Jelly
Wellness Foods 1 Day Vitamin Jelly Muscat 180g,HOUSE,No,3.79,3,Japan,3.7,Yami,Jelly
Heart-shaped Fruit Juice Collagen Jelly Honey Melon Flavor 54g,KANRO,3 Options,3.29,1,Japan,5,Yami,Jelly
Konjac Milk Tea Jelly 6pc,ORIHIRO,42 Options,3.9,0,Japan,0,Yami,Jelly
GUOMENQIAN Spicy Buckwheat Jelly 200g,Gou Men Qian,No,2.19,8,Mainland China,3.4,Yami,Jelly
GUOMENQIAN Hot&Spicy Buckwheat Jelly 200g,Gou Men Qian,No,2.19,5,Mainland China,5,Yami,Jelly
Deluxe Grass Jelly Dessert 330g,AGV,No,1.59,293,Taiwan,4.5,Yami,Jelly
Herbal Jelly Yellow Peach 253g*7ml,SUNITY,No,3.99,11,Mainland China,4.4,Yami,Jelly
PREMIUM PUReSA Golden Jelly Mask Brightening 3pcs,UTENA,7 Options,8.99,9,Japan,4.9,Yami,Jelly
Grass Jelly 223g,YOUHUALIANGCAO,No,4.59,11,Mainland China,4.7,Yami,Jelly
Herbal Jelly in Cup Passion Fruit Flavor 390g,SUNITY,9 Options,2.29,86,Mainland China,4.6,Yami,Jelly
Herbal Jelly in Cup Honey Pomelo Flavor 390g,SUNITY,9 Options,2.29,53,Mainland China,4.4,Yami,Jelly
Red Bean Jelly 8pcs,IMEI,No,4.19,27,Taiwan,4.4,Yami,Jelly
001 Lubricating Jelly 50g,OKAMOTO,No,17.99,4,Japan,5,Yami,Jelly
Herbal Jelly In Cup Mulberry Leaf & Matcha Style 216g,SUNITY,4 Options,2.99,34,Mainland China,4.1,Yami,Jelly
Grass Jelly Powder 100g,BEAR COMING,No,1.89,21,Mainland China,4.9,Yami,Jelly
QINZONG ShanXi Jelly Hot&Spicy Flavor 193g,BEIJINGSHIJIA,No,3.29,18,Mainland China,4.7,Yami,Jelly
Shimmering Black Gold Herbal Grass Jelly Dessert 255g,OTHER BRANDS,No,2.29,2,Unclear,5,Yami,Jelly
Agar Grass Jelly Drink 410g,AGV,No,1.79,0,Taiwan,0,Yami,Jelly
Grass Jelly Drink Pandan Leaf Flavor 320g,CHINCHIN,5 Options,0.99,2,Taiwan,3,Yami,Jelly
Ready To Eat Jelly 154g,LIPOPO,2 Options,1.85,4,Mainland China,3,Yami,Jelly
Grass Jelly Drink Banana Flavor 320g,CHINCHIN,5 Options,0.99,3,Taiwan,3.3,Yami,Jelly
Herbal Jelly Cranberry 253g*7ml,SUNITY,No,3.99,4,Mainland China,4.8,Yami,Jelly
Konjac Jelly Powder 100g,BEAR COMING,No,1.89,11,Mainland China,4.7,Yami,Jelly
Hawthron Jelly Roll 150g,YIDA,No,1.99,38,Mainland China,4.7,Yami,Jelly
"Instant Grass Jelly Powder 15pk, 45g",GuanXi,No,19.99,0,Mainland China,0,Yami,Jelly
Red Bean with Jelly in Syrup 340g,AGV,No,1.69,73,Taiwan,4,Yami,Jelly
Herbal Jelly In Cup Hongkong Style 216g,SUNITY,4 Options,2.99,68,Mainland China,3.9,Yami,Jelly
Herbal Jelly in Cup Roselle Flavor 390g,SUNITY,9 Options,2.49,36,Mainland China,4.6,Yami,Jelly
Grass Jelly Dessert 320g,CHINCHIN,No,1.29,17,Unclear,3.6,Yami,Jelly
C1000 Vitamin C Lemon Jelly 180g,HOUSE,3 Options,3.79,25,Japan,4.8,Yami,Jelly
Red Bean Jelly 5 Flavors 360g,SUGIMOTOYA,No,6.59,19,Japan,4.7,Yami,Jelly
Grass Jelly Powder 100g,ZHANYI,No,3.59,1,Mainland China,5,Yami,Jelly
Herbal Jelly in Cup Green Tea Flavor 390g,SUNITY,9 Options,2.29,23,Mainland China,4.6,Yami,Jelly
【Value Pack】Herbal Jelly in Cup Roselle Flavor*1 Cherry Blossoms Flavor*1 Oolong Tea Flavor*1,SUNITY,9 Options,6.09,19,Mainland China,4.7,Yami,Jelly
Coconut Soft Candy Jelly 95g,NANGUO,No,2.09,12,Mainland China,4.8,Yami,Jelly
C 1000 Vitamins Jelly Peach Flavor 180g,HOUSE,3 Options,3.79,11,Japan,4.7,Yami,Jelly
JIKAKU Red Bean Jelly Original Flavor 150g,SUGIMOTOYA,No,2.49,15,Japan,4.2,Yami,Jelly
JIKAKU Red Bean Jelly -Chestnut Flavor,SUGIMOTOYA,No,2.49,9,Japan,4.1,Yami,Jelly
Pink Guava Flavored Drink With Coconut Jelly 320ml,MOGU MOGU,14 Options,1.09,1,Tailand,5,Yami,Jelly
QINZONG ShanXi Jelly Premium Sesame Flavor 343g,BEIJINGSHIJIA,No,3.29,9,Mainland China,3.1,Yami,Jelly
Matcha Jelly 105g,IMURAYA,No,5.49,2,Japan,5,Yami,Jelly
Sour Ready To Eat Jelly 154g,LIPOPO,2 Options,1.79,5,Mainland China,3.6,Yami,Jelly
Everyone loves it! Multi-flavor Stick Jelly For Kids Toddlers 20 pieces,RIBON,2 Options,4.59,2,Japan,4.5,Yami,Jelly
CHUANBEI Sweet&Sour Sweet Potato Jelly 328g,chuanbeiliangfen,No,6.99,2,Mainland China,1,Yami,Jelly
KWANGGONG Vita500 Vitamin C Jelly 48g,kwangdong,No,1.29,0,Korea,0,Yami,Jelly
Queen's Banquet Collagen Jelly 30 Bags,POLA,No,47.99,6,Japan,4.8,Yami,Jelly
CHUANBEI JELLY Sweet Potato Starch 300g,chuanbeiliangfen,No,2.19,4,Mainland China,5,Yami,Jelly
Herbal Jelly in Cup Original Flavor 390g,SUNITY,9 Options,2.29,142,Mainland China,4.6,Yami,Jelly
Konjac Powder 40g,KANGYAKU,4 Options,0.99,504,Mainland China,4.9,Yami,Jelly
CHUANBEI Spicy Oil Instant Jelly 240g,chuanbeiliangfen,No,3.99,14,Mainland China,3.6,Yami,Jelly
YEO’S Grass Jelly Drink 300ml,YEO'S,15 Options,0.99,21,Singapore,4,Yami,Jelly
CHUABEI Pepper Instant Jelly 245g,chuanbeiliangfen,No,3.99,11,Mainland China,2.5,Yami,Jelly
Everyone loves it! Multi-flavor 100% Juice KAJU Stick Jelly For Kids Toddlers 8 pieces,RIBON,2 Options,2.59,2,Japan,4.5,Yami,Jelly
CHUANBEI JELLY Pea Starch 300g,chuanbeiliangfen,No,2.29,5,Mainland China,5,Yami,Jelly
SUNITY Herbal Jelly in Cup Original Flavor 230g*3+Jinduigu Tender Tofu Mushroom Snack Hot Flavor 180g*3,ZHANGQILONG,No,12.39,1,Mainland China,4,Yami,Jelly
JIKAKU Red Bean Jelly -Matcha Flavor 150g,SUGIMOTOYA,No,2.49,20,Japan,4,Yami,Jelly
Collagen Enrich Jelly 14pcs,REFA,No,60,2,Japan,5,Yami,Jelly
CHUANBEI Fish Flavor Sweet Potato Jelly 328g,chuanbeiliangfen,No,6.99,3,Mainland China,4.7,Yami,Jelly
BASHULANREN Chili Oil Jelly Noodle,BA SHU LAN REN,No,3.99,4,Mainland China,4,Yami,Jelly
BASHULANREN  Green Pepper Jelly Noodle,BA SHU LAN REN,No,3.99,0,Mainland China,0,Yami,Jelly
YLM- Mixed Flavor Milk Tea with Coconut Jelly 320g*4Cups,STRONGFOOD,No,4.16,14,Mainland China,4.7,Yami,Jelly
Cold Rice Jelly(brown sugar flavor) 240g,OTHER BRANDS,No,1.69,40,Unclear,4.5,Yami,Jelly
Herbal Jelly in Cup Oolong Tea Flavor 390g,SUNITY,9 Options,2.29,39,Mainland China,4.7,Yami,Jelly
Herbal Jelly in Cup Peach Blossoms Flavor 390g,SUNITY,9 Options,2.29,35,Mainland China,4.7,Yami,Jelly
Potato Chips Coffee Jelly Oolong Milk Tea Flavor 65g,Lay's,No,2.29,27,Mainland China,4.4,Yami,Jelly
RIBBON Grape Juice Jelly 275ml,POKKA SAPPORO,No,2.29,12,Japan,4.3,Yami,Jelly
Skin C Collagen Jelly Berry Flavor  7pcs,OTSUKA GROUP,8 Options,6.99,11,Japan,4.8,Yami,Jelly
【Pack of 12】Herbal Jelly in Cup Original Flavor  X 4 Passion Fruit Flavor X 4 Honey Pomelo Flavor X 4,SUNITY,9 Options,23.99,9,Mainland China,4.4,Yami,Jelly
Instant Tofu Jelly 45g,BESTORE,No,1.99,0,Mainland China,0,Yami,Jelly
C 1000 Vitamins Jelly Grapefruit 180g,HOUSE,3 Options,3.79,9,Japan,5,Yami,Jelly
In Jelly Energy 180g,MORINAGA,5 Options,4.5,1,Japan,5,Yami,Jelly
Grass Jelly Drink Lychee Flavor 320g,CHINCHIN,5 Options,0.99,4,Taiwan,4.5,Yami,Jelly
【Editor's Pick】Grass Jelly Milk Tea,SUNITY,No,11.39,4,Mainland China,5,Yami,Jelly
CHUANBEI Seasame Instant  Jelly 245g,chuanbeiliangfen,No,6.39,11,Mainland China,2,Yami,Jelly
Grass Jelly Drink Honey Flavor 320g,CHINCHIN,5 Options,0.99,3,Taiwan,4.3,Yami,Jelly
Wonda Kiwami Fukairi Coffee Jelly 260g,ASAHI,No,2.69,2,Japan,5,Yami,Jelly
CHUANBEI Sour Pepper Instant Jelly 253g,chuanbeiliangfen,No,3.99,0,Mainland China,3.2,Yami,Jelly
In Jelly Multi Mineral 180g,MORINAGA,5 Options,4.5,2,Japan,4,Yami,Jelly
In Jelly Multi Vitamin 180g,MORINAGA,5 Options,4.5,0,Japan,0,Yami,Jelly
Grass Jelly Drink Coconut Flavor 320g,CHINCHIN,5 Options,0.99,0,Taiwan,0,Yami,Jelly
Orihiro Konjac Kyoho+Green Grape+Mango 18g 24pcs,ORIHIRO,No,8.99,11,Japan,4.8,Yami,Jelly
PuruNto Konnyaku Jell Muscat Flavor 130g,ORIHIRO,7 Options,2.19,38,Japan,4.9,Yami,Jelly
Konnyaku Pink Grapefruit 187g,YUKIGUNI AGURI,No,2.49,0,Japan,0,Yami,Jelly
Purnto Pauch Mitsu Ringo 120g,ORIHIRO,No,2.29,2,Japan,5,Yami,Jelly
MARRY'S Marron Glaces Candied Chestnut 100g,MARY'S,No,20.99,1,Japan,4,Yami,Jelly
Konnyaku Momo 187g,YUKIGUNI AGURI,2 Options,2.49,2,Japan,4,Yami,Jelly
Purnto Pauch Mitsuringo Unshu Mikan 12pc 240g,ORIHIRO,No,3.99,3,Japan,5,Yami,Jelly
Konnyaku Muscat 370g,YUKIGUNI AGURI,2 Options,2.49,2,Japan,5,Yami,Jelly
Pear Loquat Leaf Extract 70g*6,LIZIQI,No,7.99,76,Mainland China,4.6,Yami,Jelly
Purunto Pauch Hosui Nashi 120g,ORIHIRO,No,2.29,4,Japan,4.2,Yami,Jelly
Fried Yogurt Pudding 85g*6,CLEVER MAMA,No,6.99,5,Korea,4.8,Yami,Jelly
Yogurt Sakura Pudding,Lingsik King,5 Options,2.49,4,Japan,4.2,Yami,Jelly
Yangmei Honey Flavor 5 bags 1265g,SUNITY,No,6.99,7,Mainland China,4.9,Yami,Jelly
