Product_Name,Brand,Price,Reviews,Origin,Rate,Platform,Category,Sold_Weekly,Sold_Monthly,Weekly_Revenue
Salted Egg Fish Skin Crunchy Crisps 125g,golden duck,12.99,17,Unclear,4.4,Yami,Seaweed,200,800,2598
CHIEN JUNG FOOD  Stir Fried Marlin Fish Floss 200g,chien jung foods,9.29,5,Unclear,5,Yami,Seaweed,25,100,232
Crispy Roasted Canned Eel 100g,hsintungyang,2.59,5,Unclear,4.4,Yami,Seaweed,25,100,65
LXS Dried Squid Larvae 230g,laoxiansheng,11.59,21,Mainland China,4.4,Yami,Seaweed,400,1600,4636
LXS Dried Squid Slice 68g,laoxiansheng,2.69,17,Mainland China,4.4,Yami,Seaweed,400,1600,1076
TAK SHING HONG Dried Scallop Original 113.4g,tsh,18.99,5,Japan,4.4,Yami,Seaweed,400,1600,7596
Hot Prepared Shredded Squid 85g,jane jane,4.89,11,Unclear,4.1,Yami,Seaweed,200,800,978
ENLIEN Grilled Cod Crisp 60g,ease taste,2.39,21,Unclear,4.2,Yami,Seaweed,200,800,478
CHIEN JUNG FOOD Stir Fried Tuna Fish Floss 200g,chien jung foods,9.29,3,Unclear,5,Yami,Seaweed,25,100,232
Fish Tofu Cake-Crab Flavor 20pcs 400g,yanting fisherman,5.69,17,Mainland China,4,Yami,Seaweed,400,1600,2276
SHANGHAI Smoked Fish Spicy Flavor 250g,lao du agriculture,9.99,4,Mainland China,4.2,Yami,Seaweed,400,1600,3996
Canned Bai-Top Shell Hot Flavor 400g,dong won,8.89,14,Korea,3.6,Yami,Seaweed,200,800,1778
Crab Sticks Cheese Flavor 35g,inaba,2.69,4,Unclear,5,Yami,Seaweed,25,100,67
Abalone In Oyster Sauce,captain jiang,13.99,0,Unclear,0,Yami,Seaweed,25,100,350
ENLIEN Charcoal BBQ Fish Sticks 85g,ease taste,2.29,17,Unclear,3.3,Yami,Seaweed,200,800,458
TENGXIN FOODS Srab Sticker Spicy Flavor 30packs 600g,haixin,5.89,14,Mainland China,4,Yami,Seaweed,200,800,1178
Rosted Squid Snack Beef Rib Flavor 50g,keumhan,5.99,8,Unclear,4.9,Yami,Seaweed,400,1600,2396
TENGXIN FOODS Srab Sticker Crab Flavor 600g,haixin,5.89,6,Mainland China,2.8,Yami,Seaweed,400,1600,2356
Grilled Squid Original Flavor 120g,yanghang,4.49,8,Unclear,4.2,Yami,Seaweed,400,1600,1796
TAK SHING HONG Dried Scallop Chilli 113.4g,tsh,18.99,4,Japan,3,Yami,Seaweed,400,1600,7596
QingJiang Wild Fish (Hot Flavor) 110g,tulaohan,4.49,6,Unclear,4.8,Yami,Seaweed,400,1600,1796
Spicy Shirmp Cake 92g,bestore,5.89,8,Mainland China,2.1,Yami,Seaweed,200,800,1178
Dried Squid Oshaburi Yakiika 11g,kojima,2.79,2,Unclear,4,Yami,Seaweed,400,1600,1116
Spicy Hairtail 150g,zhihaile,3.79,2,Unclear,5,Yami,Seaweed,400,1600,1516
Fish Skins Red Curry Flavor 50g,dah tien,5.09,5,Unclear,5,Yami,Seaweed,400,1600,2036
fried Salmon fish skin spicy & salted egg 100g,feilong,9.99,4,Unclear,4.2,Yami,Seaweed,400,1600,3996
FISH Snack Pickled Peeper Flavor 50g,xiangxiangzui,1.89,6,Mainland China,4.8,Yami,Seaweed,400,1600,756
LINJU Crunch Fish  Original 20g,dalitianjiang,1.39,7,Unclear,3.7,Yami,Seaweed,400,1600,556
Fish Skin Spicy Flavor 60g,wow,3.79,5,Unclear,4.2,Yami,Seaweed,400,1600,1516
Spicy Crawfish 76g,bestore,9.99,5,Mainland China,3.2,Yami,Seaweed,25,100,250
Seasoned Laver Salmon Flavor 18g,krm,1.99,4,Unclear,4,Yami,Seaweed,400,1600,796
Shredd Jellyfish Spciy Flavor 150g,yida foods,1.59,1,Unclear,4,Yami,Seaweed,400,1600,636
Seasoned Laver BBQ Flavor 18g,krm,1.99,3,Unclear,5,Yami,Seaweed,400,1600,796
Sanma Soy Sauce Flavor 150g,ssk sales,3.69,3,Japan,4.3,Yami,Seaweed,400,1600,1476
Fish Snack Spicy Flavor 50g,xiangxiangzui,1.89,4,Mainland China,3.5,Yami,Seaweed,400,1600,756
Mr.Searo ???????????? Crispy Fish Slices (20g x 5 packs),mr.searo????????????,5.59,0,Unclear,0,Yami,Seaweed,400,1600,2236
Spicy Fish Snack (GuiFei) 80g,zhuayudemao,2.89,37,Mainland China,4.5,Yami,Seaweed,400,1600,1156
Dried Bean Curb Chili Flavor 240g,txfood,5.89,28,Mainland China,4.4,Yami,Seaweed,400,1600,2356
Roasted & Spicy Seasoned Monkfish 160g,jayone,10.99,23,Unclear,4.6,Yami,Seaweed,400,1600,4396
Fried Fish Skin - Salty Egg Flavor 30g,shao nv hao bai,3.19,26,Unclear,4.3,Yami,Seaweed,400,1600,1276
Spicy Roasted Sea Eel 65g,chinmi,7.89,17,Unclear,4,Yami,Seaweed,200,800,1578
I Feng Squid Series 70g,kou show,2.99,26,Mainland China,3.9,Yami,Seaweed,400,1600,1196
TAKUMA Dried Crab 45g,other brands,4.99,12,Unclear,3.3,Yami,Seaweed,400,1600,1996
Dried Fish with Spicy Peanuts 4 Pack*30g,yu gan de yu gan,11.99,2,Unclear,4,Yami,Seaweed,400,1600,4796
YES SIR Crispy dried Crab-Plum 25g,xiaxiansheng,3.99,21,Unclear,4,Yami,Seaweed,400,1600,1596
Fish Sausage Mayonnaise Flavor 400g,dalitianjiang,9.89,13,Korea,3.8,Yami,Seaweed,25,100,247
Crispy Fried Fish Pickled Pepper Flavor 120g,bestore,5.99,3,Mainland China,4.3,Yami,Seaweed,200,800,1198
HUAWEN Spiced Fish Snack Sour Vegetable Flavor 240g,hua wen food,6.89,12,Mainland China,4.6,Yami,Seaweed,200,800,1378
Ex Squid Peanut Cracker (Ika Peana)  62g,kasugai,2.29,6,Unclear,5,Yami,Seaweed,25,100,57
TONGRONG Milkfish In Fish Tomato Sauce 230g,tongyeng,2.69,11,Unclear,4.1,Yami,Seaweed,400,1600,1076
KING'S Roasted Squid Shreds 8oz,king?€?s,19.99,11,Unclear,4.4,Yami,Seaweed,400,1600,7996
Seasoned Laver Pollack Roe Flavor 18g,krm,1.99,9,Unclear,4.8,Yami,Seaweed,400,1600,796
Fried Seasoned Anchovy Sesame Flavor 4.2oz,three deer,5.99,1,Unclear,5,Yami,Seaweed,400,1600,2396
HONG KONG UNCHI Fish Skin Chips Black Pepper Flavor 110g,hong kong un chi,5.79,9,Unclear,4.3,Yami,Seaweed,25,100,145
ROFEEL VIKE Little Yellow Croaker Sichuan Spicy 320g,rofeel,5.89,14,Mainland China,4.2,Yami,Seaweed,400,1600,2356
Fried Dace with Salted Black Beans & Pepper 184g,eagle coin,4.59,2,Unclear,5,Yami,Seaweed,400,1600,1836
Dried Fish Hot Spicy 50g,happy party,2.19,12,Mainland China,3.9,Yami,Seaweed,200,800,438
Fish Snack (Sweet & Sour)  20Pcs 260g,yanjinpuzi,5.39,11,Mainland China,3.8,Yami,Seaweed,400,1600,2156
WANG Canned Saury 396g,wang food,2.99,6,Unclear,5,Yami,Seaweed,400,1600,1196
Seasoned Laver Original Flavor 12g,krm,1.99,7,Unclear,5,Yami,Seaweed,400,1600,796
Fish Sausage Jalapeno Chesse Flavor 400g,dalitianjiang,9.89,9,Korea,3.3,Yami,Seaweed,400,1600,3956
Fried Salmon Fish Skin Salted Egg 100g,feilong,9.99,3,Unclear,5,Yami,Seaweed,400,1600,3996
Roasted Squid Snack Butter Flavor 30g,jayone,4.39,4,Korea,2.8,Yami,Seaweed,25,100,110
Cod Fish Stick Hot Spicy Flavor 18*20pcs,haoyudao,6.49,1,Mainland China,3,Yami,Seaweed,400,1600,2596
PENGUIN Pacific Saury&Kimchi In Can 380g,penguin's,4.59,1,Unclear,4,Yami,Seaweed,400,1600,1836
PENGUIN Pacific Saury Boiled In Can 400g,penguin's,4.59,0,Unclear,0,Yami,Seaweed,400,1600,1836
Fried Crispy Shrimps 40g,huajing,2.69,0,Unclear,0,Yami,Seaweed,25,100,67
CHUNG CHOU CITY Dried Seaweed 50g,chungchou city,2.99,1,Unclear,5,Yami,Seaweed,25,100,75
[Mainland China Direct Mail] Baicao Flavor-Squid Squid Dried Squid Snacks 80g,be & cheery,12.9,0,Unclear,0,Yami,Seaweed,25,100,323
